rank,repo_name,forks,stars,language,repo_url,description,id,last_commit
693,yojimbo,222,2224,C,https://github.com/networkprotocol/yojimbo,A network library for client/server games written in C++,MDEwOlJlcG9zaXRvcnk1OTkyNTc0Nw==,2023-03-20T01:55:44Z
694,ATC_MiThermometer,389,2223,C,https://github.com/atc1441/ATC_MiThermometer,Custom firmware for the Xiaomi Thermometer LYWSD03MMC and Telink Flasher via USB to Serial converter,MDEwOlJlcG9zaXRvcnkyOTA4MDgzOTE=,2022-07-02T21:46:56Z
695,neural-redis,106,2214,C,https://github.com/antirez/neural-redis,Neural networks module for Redis,MDEwOlJlcG9zaXRvcnk2OTM5Mzg0Mw==,2018-07-23T11:39:34Z
696,mtr,316,2214,C,https://github.com/traviscross/mtr,"Official repository for mtr, a network diagnostic tool",MDEwOlJlcG9zaXRvcnk3OTcyNDAy,2023-01-10T10:11:49Z
697,EpMedia,511,2212,C,https://github.com/yangjie10930/EpMedia,"Android上基于FFmpeg开发的视频处理框架，简单易用，体积小，帮助使用者快速实现视频处理功能。包含以下功能：剪辑，裁剪，旋转，镜像，合并，分离，变速，添加LOGO，添加滤镜，添加背景音乐，加速减速视频，倒放音视频。 The video processing framework based on FFmpeg developed on Android is simple, easy to use, and small in size, helping users quickly realize video processing functions. Contains the following functions: editing, cropping, rotating, mirroring, merging, separating, variable speed, adding LOGO, adding filters, adding background music, accelerating and decelerating video, rewinding audio and video.",MDEwOlJlcG9zaXRvcnk5MjM1NjE3Nw==,2021-08-09T08:11:06Z
698,panda,469,2204,C,https://github.com/panda-re/panda,Platform for Architecture-Neutral Dynamic Analysis,MDEwOlJlcG9zaXRvcnkxMjMzMDg3Mg==,2023-03-27T13:40:18Z
699,smenu,47,2204,C,https://github.com/p-gen/smenu,"smenu started as a lightweight and flexible terminal menu generator, but quickly evolved into a powerful and versatile CLI selection tool for interactive or scripting use.",MDEwOlJlcG9zaXRvcnk2OTE4ODE4OQ==,2023-03-25T19:48:46Z
700,libqrencode,555,2202,C,https://github.com/fukuchi/libqrencode,A fast and compact QR Code encoding library,MDEwOlJlcG9zaXRvcnkxNDEwMjQy,2023-01-13T07:54:37Z
701,DBProxy,572,2199,C,https://github.com/Meituan-Dianping/DBProxy,,MDEwOlJlcG9zaXRvcnk3NzUyMzcwNw==,2018-01-05T22:54:54Z
702,compton,537,2197,C,https://github.com/chjj/compton,A compositor for X11.,MDEwOlJlcG9zaXRvcnkyNzExNTM5,2021-06-29T13:48:18Z
703,rugged,292,2197,C,https://github.com/libgit2/rugged,ruby bindings to libgit2,MDEwOlJlcG9zaXRvcnk5MDE2NjM=,2023-03-27T11:08:37Z
704,silk-v3-decoder,545,2191,C,https://github.com/kn007/silk-v3-decoder,"[Skype Silk Codec SDK]Decode silk v3 audio files (like wechat amr, aud files, qq slk files) and convert to other format (like mp3). Batch conversion support.",MDEwOlJlcG9zaXRvcnk1MTI1NDYxMw==,2023-03-14T20:44:41Z
705,riscv-gnu-toolchain,849,2190,C,https://github.com/riscv-collab/riscv-gnu-toolchain,"GNU toolchain for RISC-V, including GCC",MDEwOlJlcG9zaXRvcnkyMzc4MDEzOA==,2023-03-14T02:38:14Z
706,ZQCNN,507,2187,C,https://github.com/zuoqing1988/ZQCNN,一款推理框架，同时有很多有用的demo，觉得好用请点星啊,MDEwOlJlcG9zaXRvcnkxMzIwOTE4Njg=,2022-08-22T04:20:31Z
707,esp-homekit-devices,321,2180,C,https://github.com/RavenSystem/esp-homekit-devices,Project to add native Apple HomeKit support to any device with an ESP32 or an ESP8266 chip,MDEwOlJlcG9zaXRvcnkxMTkwODY5OTI=,2023-03-01T16:31:49Z
708,Arduino_Core_STM32,837,2180,C,https://github.com/stm32duino/Arduino_Core_STM32,STM32 core support for Arduino,MDEwOlJlcG9zaXRvcnk5MDg2Nzg5OQ==,2023-03-23T15:40:31Z
709,ck,300,2180,C,https://github.com/concurrencykit/ck,"Concurrency primitives, safe memory reclamation mechanisms and non-blocking (including lock-free) data structures designed to aid in the research, design and implementation of high performance concurrent systems developed in C99+.",MDEwOlJlcG9zaXRvcnkxODg4NzE4Nw==,2023-02-18T21:18:45Z
710,lmdb,538,2176,C,https://github.com/LMDB/lmdb,Read-only mirror of official repo on openldap.org. Issues and pull requests here are ignored. Use OpenLDAP ITS for issues.,MDEwOlJlcG9zaXRvcnkzNDQwNjkzMw==,2022-11-29T03:04:19Z
711,immortalwrt,963,2176,C,https://github.com/immortalwrt/immortalwrt,An opensource OpenWrt variant for mainland China users.,MDEwOlJlcG9zaXRvcnkyMDM3NTk4OTY=,2023-03-28T07:51:39Z
712,unbound,292,2176,C,https://github.com/NLnetLabs/unbound,"Unbound is a validating, recursive, and caching DNS resolver.",MDEwOlJlcG9zaXRvcnk5NDE5NTMwMQ==,2023-03-27T14:29:53Z
713,solo1,254,2174,C,https://github.com/solokeys/solo1,Solo 1 firmware in C,MDEwOlJlcG9zaXRvcnkxNDg3MDYyMDg=,2022-11-13T10:16:36Z
714,earth-reverse-engineering,201,2172,C,https://github.com/retroplasma/earth-reverse-engineering,Reversing Google's 3D satellite mode,MDEwOlJlcG9zaXRvcnkxNjUzNTM2NjY=,2020-12-23T00:03:53Z
715,ReflectiveDLLInjection,721,2169,C,https://github.com/stephenfewer/ReflectiveDLLInjection,Reflective DLL injection is a library injection technique in which the concept of reflective programming is employed to perform the loading of a library from memory into a host process.,MDEwOlJlcG9zaXRvcnkyNzA5MTc2,2022-09-03T17:48:42Z
716,Il2CppInspector,352,2168,C,https://github.com/djkaty/Il2CppInspector,Powerful automated tool for reverse engineering Unity IL2CPP binaries,MDEwOlJlcG9zaXRvcnk4NTI5NjUwMw==,2022-05-13T11:13:16Z
717,warpd,93,2168,C,https://github.com/rvaiya/warpd,A modal keyboard-driven virtual pointer,MDEwOlJlcG9zaXRvcnkyMTAwOTkyNDg=,2023-02-20T19:26:58Z
718,libpcap,776,2166,C,https://github.com/the-tcpdump-group/libpcap,the LIBpcap interface to various kernel packet capture mechanism,MDEwOlJlcG9zaXRvcnk5NDM1ODg3,2023-03-28T07:15:15Z
719,tcpdump,770,2165,C,https://github.com/the-tcpdump-group/tcpdump,the TCPdump network dissector,MDEwOlJlcG9zaXRvcnk5NDM1ODgy,2023-03-27T07:43:01Z
721,tetragon,186,2164,C,https://github.com/cilium/tetragon,eBPF-based Security Observability and Runtime Enforcement,R_kgDOHDOB4Q,2023-03-28T12:57:37Z
720,nginx-push-stream-module,300,2164,C,https://github.com/wandenberg/nginx-push-stream-module,A pure stream http push technology for your Nginx setup. Comet made easy and really scalable.,MDEwOlJlcG9zaXRvcnk5OTQ2MTU=,2023-02-21T19:16:17Z
722,net-speeder,565,2161,C,https://github.com/snooda/net-speeder,net-speeder 在高延迟不稳定链路上优化单线程下载速度 ,MDEwOlJlcG9zaXRvcnkyOTU5OTI1Mg==,2021-11-10T13:28:40Z
723,libsixel,70,2159,C,https://github.com/saitoha/libsixel,A SIXEL encoder/decoder implementation derived from kmiya's sixel (https://github.com/saitoha/sixel).,MDEwOlJlcG9zaXRvcnkxMjI0NzIxMw==,2022-09-02T11:55:22Z
724,renderer,246,2158,C,https://github.com/zauonlok/renderer,A shader-based software renderer written from scratch in C89,MDEwOlJlcG9zaXRvcnk4NTU3OTYzMA==,2021-03-06T07:55:05Z
725,way-cooler,78,2145,C,https://github.com/way-cooler/way-cooler,Wayland compositor for AwesomeWM,MDEwOlJlcG9zaXRvcnk0OTMxMjA3MQ==,2019-12-19T21:57:23Z
726,gpac,458,2141,C,https://github.com/gpac/gpac,"Modular Multimedia framework for packaging, streaming and playing your favorite content, see http://netflix.gpac.io",MDEwOlJlcG9zaXRvcnkxOTQwMTY0Ng==,2023-03-28T08:01:11Z
727,Reptile,534,2121,C,https://github.com/f0rb1dd3n/Reptile,LKM Linux rootkit,MDEwOlJlcG9zaXRvcnkxMDc4OTExNzk=,2021-03-07T22:51:36Z
728,i3blocks,175,2118,C,https://github.com/vivien/i3blocks,The hacker-friendly status_command for Sway and i3,MDEwOlJlcG9zaXRvcnkxNjYyODY3Mw==,2023-02-14T21:48:54Z
729,hashcat-legacy,319,2117,C,https://github.com/hashcat/hashcat-legacy,Advanced CPU-based password recovery utility,MDEwOlJlcG9zaXRvcnk0Njg2MjQzOA==,2022-09-30T13:02:25Z
730,openvas-scanner,495,2112,C,https://github.com/greenbone/openvas-scanner,This repository contains the scanner component for Greenbone Community Edition.,MDEwOlJlcG9zaXRvcnkxMTg0MjQwNTM=,2023-03-28T13:08:31Z
731,WiringPi,1072,2111,C,https://github.com/WiringPi/WiringPi,Gordon's Arduino wiring-like WiringPi Library for the Raspberry Pi (Unofficial Mirror for WiringPi bindings),MDEwOlJlcG9zaXRvcnk0ODMwMzM0,2023-02-23T04:31:37Z
732,raygui,205,2109,C,https://github.com/raysan5/raygui,A simple and easy-to-use immediate-mode gui library,MDEwOlJlcG9zaXRvcnk2MTIzMTMzOQ==,2023-03-19T10:13:49Z
733,darkforestGo,344,2108,C,https://github.com/facebookresearch/darkforestGo,"DarkForest, the Facebook Go engine.",MDEwOlJlcG9zaXRvcnk1ODI5MTgwOQ==,2019-12-26T09:04:19Z
734,esp32-snippets,684,2105,C,https://github.com/nkolban/esp32-snippets,Sample ESP32 snippets and code fragments,MDEwOlJlcG9zaXRvcnk3MjkzNDc3Nw==,2021-12-20T01:00:06Z
735,desmume,414,2104,C,https://github.com/TASEmulators/desmume,DeSmuME is a Nintendo DS emulator,MDEwOlJlcG9zaXRvcnk3NDYzMDUxNQ==,2023-03-07T06:19:10Z
736,crun,235,2103,C,https://github.com/containers/crun,A fast and lightweight fully featured OCI runtime and C library for running containers,MDEwOlJlcG9zaXRvcnkxMDM0NDY0NjA=,2023-03-25T07:25:33Z
737,dustcloud,248,2100,C,https://github.com/dgiese/dustcloud,Xiaomi Smart Home Device Reverse Engineering and Hacking,MDEwOlJlcG9zaXRvcnkxMTUyMTMwODI=,2022-09-30T20:13:35Z
738,drmemory,248,2100,C,https://github.com/DynamoRIO/drmemory,"Memory Debugger for Windows, Linux, Mac, and Android",MDEwOlJlcG9zaXRvcnkyNzI0NDE4MQ==,2022-12-01T15:53:56Z
739,criu,455,2099,C,https://github.com/checkpoint-restore/criu,Checkpoint/Restore tool,MDEwOlJlcG9zaXRvcnkxNTk5OTYzOA==,2023-03-28T07:00:43Z
740,InfiniTime,726,2098,C,https://github.com/InfiniTimeOrg/InfiniTime,Firmware for Pinetime smartwatch written in C++ and based on FreeRTOS,MDEwOlJlcG9zaXRvcnkyMjYxNjc2MjA=,2023-03-27T22:12:32Z
741,OpenSC,653,2094,C,https://github.com/OpenSC/OpenSC,Open source smart card tools and middleware. PKCS#11/MiniDriver/Tokend,MDEwOlJlcG9zaXRvcnkxOTk5Njky,2023-03-24T16:43:31Z
742,Reader,438,2087,C,https://github.com/binbyu/Reader,A win32 txt file reader,MDEwOlJlcG9zaXRvcnkxNDkyMzMxOTE=,2022-10-29T12:02:09Z
743,dump1090,1238,2086,C,https://github.com/antirez/dump1090,Dump1090 is a simple Mode S decoder for RTLSDR devices,MDEwOlJlcG9zaXRvcnk3NDU1MzI5,2022-11-25T08:40:41Z
744,zapret,226,2084,C,https://github.com/bol-van/zapret,Обход DPI в linux,MDEwOlJlcG9zaXRvcnk1MTc1NzQ1OA==,2023-03-26T09:52:35Z
745,HyperDbg,298,2084,C,https://github.com/HyperDbg/HyperDbg,State-of-the-art native debugging tool,MDEwOlJlcG9zaXRvcnkyMzEyMTQzNTA=,2023-03-28T10:46:03Z
746,winafl,504,2082,C,https://github.com/googleprojectzero/winafl,A fork of AFL for fuzzing Windows binaries,MDEwOlJlcG9zaXRvcnk2MjgwMjczMA==,2022-12-20T10:12:04Z
747,fwupd,335,2080,C,https://github.com/fwupd/fwupd,A system daemon to allow session software to update firmware,MDEwOlJlcG9zaXRvcnkzMTM3NDczNQ==,2023-03-28T09:52:35Z
748,yajl,430,2079,C,https://github.com/lloyd/yajl,A fast streaming JSON parsing library in C.,MDEwOlJlcG9zaXRvcnk4OTkxMg==,2022-12-05T02:46:46Z
749,util-linux,1062,2077,C,https://github.com/util-linux/util-linux,,MDEwOlJlcG9zaXRvcnkyMzM5NTU1,2023-03-27T11:51:41Z
750,open62541,1054,2070,C,https://github.com/open62541/open62541,Open source implementation of OPC UA (OPC Unified Architecture) aka IEC 62541 licensed under Mozilla Public License v2.0,MDEwOlJlcG9zaXRvcnkxNTMzMzgwOQ==,2023-03-27T22:56:48Z
752,ext-ds,97,2067,C,https://github.com/php-ds/ext-ds,An extension providing efficient data structures for PHP 7,MDEwOlJlcG9zaXRvcnk1MDgyNDIzNQ==,2022-10-04T14:02:44Z
751,thc-tips-tricks-hacks-cheat-sheet,271,2067,C,https://github.com/hackerschoice/thc-tips-tricks-hacks-cheat-sheet,Various tips & tricks,MDEwOlJlcG9zaXRvcnkyMzU4MDQzNjQ=,2023-03-28T10:42:29Z
753,OpenGL,638,2064,C,https://github.com/McNopper/OpenGL,OpenGL 3 and 4 with GLSL,MDEwOlJlcG9zaXRvcnk4MzczMzU4,2022-05-21T11:49:30Z
754,litex,435,2063,C,https://github.com/enjoy-digital/litex,"Build your hardware, easily!",MDEwOlJlcG9zaXRvcnk0NTczNDcxOQ==,2023-03-27T15:43:17Z
755,wlroots,352,2061,C,https://github.com/swaywm/wlroots,A modular Wayland compositor library,MDEwOlJlcG9zaXRvcnk4OTM3NzM5Mg==,2022-02-16T22:22:50Z
756,melonDS,346,2059,C,https://github.com/melonDS-emu/melonDS,"DS emulator, sorta",MDEwOlJlcG9zaXRvcnk1ODg5NDU4Mg==,2023-03-28T07:09:58Z
757,ldd3,828,2057,C,https://github.com/martinezjavier/ldd3,Linux Device Drivers 3 examples updated to work in recent kernels,MDEwOlJlcG9zaXRvcnkxMTE3MTg1,2023-03-09T15:24:49Z
758,HID,376,2056,C,https://github.com/NicoHood/HID,Bring enhanced HID functions to your Arduino!,MDEwOlJlcG9zaXRvcnkyMDQ0NjY4Mg==,2022-12-26T05:30:40Z
759,nexmon,421,2053,C,https://github.com/seemoo-lab/nexmon,"The C-based Firmware Patching Framework for Broadcom/Cypress WiFi Chips that enables Monitor Mode, Frame Injection and much more",MDEwOlJlcG9zaXRvcnk3MjA5MzAxMA==,2023-03-24T21:49:00Z
760,gps-sdr-sim,680,2052,C,https://github.com/osqzss/gps-sdr-sim,Software-Defined GPS Signal Simulator,MDEwOlJlcG9zaXRvcnkzNzQzNjIyMw==,2022-10-13T23:23:08Z
761,moonlight-android,376,2046,C,https://github.com/moonlight-stream/moonlight-android,GameStream client for Android,MDEwOlJlcG9zaXRvcnkxMjk4OTc5MA==,2023-03-12T08:13:10Z
762,Down,298,2038,C,https://github.com/johnxnguyen/Down,"Blazing fast Markdown / CommonMark rendering in Swift, built upon cmark.",MDEwOlJlcG9zaXRvcnk1OTkxOTkzMg==,2023-02-15T20:33:08Z
763,tinn,185,2034,C,https://github.com/glouw/tinn,A tiny neural network library,MDEwOlJlcG9zaXRvcnkxMjY5NDQ5MzM=,2021-01-17T23:06:12Z
764,openmv,930,2031,C,https://github.com/openmv/openmv,OpenMV Camera Module,MDEwOlJlcG9zaXRvcnkxNDM2MDk0MA==,2023-03-26T05:17:45Z
765,wiredtiger,350,2021,C,https://github.com/wiredtiger/wiredtiger,WiredTiger's source tree,MDEwOlJlcG9zaXRvcnkyOTQ0MzAy,2023-03-28T10:54:44Z
766,RTKLIB,1418,2019,C,https://github.com/tomojitakasu/RTKLIB,,MDEwOlJlcG9zaXRvcnk5NzQzMjY3,2023-02-26T23:56:32Z
767,Adafruit-GFX-Library,1457,2018,C,https://github.com/adafruit/Adafruit-GFX-Library,"Adafruit GFX graphics core Arduino library, this is the 'core' class that all our other graphics libraries derive from",MDEwOlJlcG9zaXRvcnkzNzAxNjk0,2023-03-27T01:33:04Z
768,tilck,84,2018,C,https://github.com/vvaltchev/tilck,A Tiny Linux-Compatible Kernel,MDEwOlJlcG9zaXRvcnk1Mzg0NTU5NQ==,2023-01-21T15:10:13Z
770,c-jwt-cracker,245,2017,C,https://github.com/brendan-rius/c-jwt-cracker,JWT brute force cracker written in C,MDEwOlJlcG9zaXRvcnk3OTUwMTM1NQ==,2021-04-23T22:31:53Z
769,dosbox-x,307,2017,C,https://github.com/joncampbell123/dosbox-x,DOSBox-X fork of the DOSBox project,MDEwOlJlcG9zaXRvcnkxOTg4MTQyMQ==,2023-03-28T10:08:43Z
772,proxydroid,678,2016,C,https://github.com/madeye/proxydroid,Global Proxy for Android,MDEwOlJlcG9zaXRvcnkzMjgwODI3,2023-01-18T11:26:36Z
771,HackSysExtremeVulnerableDriver,498,2016,C,https://github.com/hacksysteam/HackSysExtremeVulnerableDriver,HackSys Extreme Vulnerable Windows Driver (HEVD),MDEwOlJlcG9zaXRvcnkzNjQyNDgzMg==,2022-12-07T08:23:48Z
773,playerctl,78,2015,C,https://github.com/altdesktop/playerctl,"🎧 mpris media player command-line controller for vlc, mpv, RhythmBox, web browsers, cmus, mpd, spotify and others.",MDEwOlJlcG9zaXRvcnkxODc4ODgwNA==,2023-01-30T17:01:20Z
774,php-ext-xlswriter,206,2014,C,https://github.com/viest/php-ext-xlswriter,🚀 PHP Extension for creating and reader XLSX files. ,MDEwOlJlcG9zaXRvcnkxMTE3NjY3OTc=,2023-03-01T23:52:20Z
775,nanos,114,2013,C,https://github.com/nanovms/nanos,A kernel designed to run one and only one application in a virtualized environment,MDEwOlJlcG9zaXRvcnkxMTUxNTk2MTY=,2023-03-26T10:46:01Z
776,xcape,122,2011,C,https://github.com/alols/xcape,Linux utility to configure modifier keys to act as other keys when pressed and released on their own.,MDEwOlJlcG9zaXRvcnkzODg4MjY1,2022-09-13T06:49:04Z
777,quadsort,97,2007,C,https://github.com/scandum/quadsort,Quadsort is a branchless stable adaptive mergesort faster than quicksort.,MDEwOlJlcG9zaXRvcnkyMzk3NzA0OTA=,2023-03-22T10:31:10Z
778,printf,390,2005,C,https://github.com/mpaland/printf,"Tiny, fast, non-dependent and fully loaded printf implementation for embedded systems. Extensive test suite passing.",MDEwOlJlcG9zaXRvcnkyNDc5ODc2Mw==,2022-04-26T03:55:04Z
779,ettercap,474,2002,C,https://github.com/Ettercap/ettercap,Ettercap Project,MDEwOlJlcG9zaXRvcnk1MDQxMTMz,2023-03-25T09:52:50Z
780,ltp,927,1998,C,https://github.com/linux-test-project/ltp,Linux Test Project http://linux-test-project.github.io/,MDEwOlJlcG9zaXRvcnkzNjQ5OTIy,2023-03-28T10:38:57Z
781,liburing,297,1996,C,https://github.com/axboe/liburing,,MDEwOlJlcG9zaXRvcnkyMDA2NjM1NTU=,2023-03-28T10:49:44Z
782,userland,1096,1994,C,https://github.com/raspberrypi/userland,Source code for ARM side libraries for interfacing to Raspberry Pi GPU.,MDEwOlJlcG9zaXRvcnk2MzY3ODg2,2023-03-22T14:36:56Z
783,mc,485,1988,C,https://github.com/MidnightCommander/mc,Midnight Commander's repository,MDEwOlJlcG9zaXRvcnkyNzY2Mjcz,2023-03-25T07:49:27Z
784,wax,638,1983,C,https://github.com/probablycorey/wax,Wax is now being maintained by alibaba,MDEwOlJlcG9zaXRvcnkyMzg1Mzk=,2017-03-30T07:41:40Z
786,pspg,82,1982,C,https://github.com/okbob/pspg,"Unix pager (with very rich functionality) designed for work with tables. Designed for PostgreSQL, but MySQL is supported too. Works well with pgcli too. Can be used as CSV or TSV viewer too. It supports searching, selecting rows, columns, or block and export selected area to clipboard. ",MDEwOlJlcG9zaXRvcnk5NjkyNjI0Mw==,2023-03-14T05:09:21Z
785,libarchive,641,1982,C,https://github.com/libarchive/libarchive,Multi-format archive and compression library,MDEwOlJlcG9zaXRvcnkzMjE5ODA0,2023-03-02T05:29:50Z
787,ServerStatus-Hotaru,646,1972,C,https://github.com/cokemine/ServerStatus-Hotaru,云探针、多服务器探针、云监控、多服务器云监控,MDEwOlJlcG9zaXRvcnkxNjkwMzQ1ODc=,2022-11-24T07:31:10Z
789,pg_cron,156,1970,C,https://github.com/citusdata/pg_cron,Run periodic jobs in PostgreSQL,MDEwOlJlcG9zaXRvcnk2NzM3Mjk3Nw==,2023-03-13T12:29:12Z
788,Divert,450,1970,C,https://github.com/basil00/Divert,WinDivert: Windows Packet Divert,MDEwOlJlcG9zaXRvcnkyMjMzNzA4,2023-03-15T23:09:58Z
790,chafa,41,1968,C,https://github.com/hpjansson/chafa,📺🗿 Terminal graphics for the 21st century.,MDEwOlJlcG9zaXRvcnkxMzA5MDY4OTc=,2023-03-10T20:15:14Z
791,oniguruma,300,1967,C,https://github.com/kkos/oniguruma,regular expression library,MDEwOlJlcG9zaXRvcnkzODk5OTg3NA==,2023-03-27T14:16:12Z
792,pgbouncer,368,1965,C,https://github.com/pgbouncer/pgbouncer,lightweight connection pooler for PostgreSQL,MDEwOlJlcG9zaXRvcnk2NDY0MjM=,2023-03-27T22:27:58Z
793,FreeDVDBoot,148,1960,C,https://github.com/CTurt/FreeDVDBoot,PlayStation 2 DVD Player Exploit,MDEwOlJlcG9zaXRvcnkyNzIyMjI2MjQ=,2022-02-02T08:15:09Z
794,rlwrap,136,1959,C,https://github.com/hanslub42/rlwrap,A readline wrapper,MDEwOlJlcG9zaXRvcnkxNzExMzAzNw==,2023-03-25T22:06:03Z
795,fdupes,168,1958,C,https://github.com/adrianlopezroche/fdupes,FDUPES is a program for identifying or deleting duplicate files residing within specified directories.,MDEwOlJlcG9zaXRvcnkxOTgxMzAwMw==,2022-11-06T01:34:39Z
796,sqlite,542,1946,C,https://github.com/mackyle/sqlite,Unofficial git mirror of SQLite sources (see link for build instructions),MDEwOlJlcG9zaXRvcnkxMDQwMDYzMg==,2023-03-28T09:51:54Z
797,inih,419,1946,C,https://github.com/benhoyt/inih,"Simple .INI file parser in C, good for embedded systems",MDEwOlJlcG9zaXRvcnkzMjA5NTQwNg==,2022-12-02T21:39:43Z
798,open-vm-tools,403,1943,C,https://github.com/vmware/open-vm-tools,Official repository of VMware open-vm-tools project,MDEwOlJlcG9zaXRvcnkxOTE2MTQxNQ==,2023-03-24T21:22:33Z
799,sundown,394,1939,C,https://github.com/vmg/sundown,"Standards compliant, fast, secure markdown processing library in C",MDEwOlJlcG9zaXRvcnkxNjE4MTE0,2018-07-23T10:50:07Z
800,printf-tac-toe,56,1937,C,https://github.com/carlini/printf-tac-toe,tic-tac-toe in a single call to printf,MDEwOlJlcG9zaXRvcnkyNjM4NDIxMTc=,2022-06-08T08:33:53Z
802,winevdm,123,1935,C,https://github.com/otya128/winevdm,"16-bit Windows (Windows 1.x, 2.x, 3.0, 3.1, etc.) on 64-bit Windows",MDEwOlJlcG9zaXRvcnk0MjkzNjA0OQ==,2023-03-25T00:55:26Z
801,go-sdl2,220,1935,C,https://github.com/veandco/go-sdl2,SDL2 binding for Go,MDEwOlJlcG9zaXRvcnkxMDUwOTY4Mw==,2023-02-10T02:20:32Z
803,Remmina,719,1931,C,https://github.com/FreeRDP/Remmina,Mirror of https://gitlab.com/Remmina/Remmina The GTK+ Remmina Remote Desktop Client,MDEwOlJlcG9zaXRvcnkyNjk2MzA2,2023-03-27T12:06:32Z
804,box64,131,1931,C,https://github.com/ptitSeb/box64,"Box64 - Linux Userspace x86_64 Emulator with a twist, targeted at ARM64 Linux devices",MDEwOlJlcG9zaXRvcnkzMTc0OTM0NDI=,2023-03-28T12:14:58Z
805,noah,93,1930,C,https://github.com/linux-noah/noah,Bash on Ubuntu on macOS,MDEwOlJlcG9zaXRvcnk1NTY1OTQ2MQ==,2020-06-09T10:30:59Z
806,mini3d,479,1927,C,https://github.com/skywind3000/mini3d,3D Software Renderer in 700 Lines !!,MDEwOlJlcG9zaXRvcnk0MDQ0MzQ2NQ==,2022-02-10T20:21:55Z
807,toybox,280,1926,C,https://github.com/landley/toybox,toybox,MDEwOlJlcG9zaXRvcnkzMzc0NTU0,2023-03-28T11:55:43Z
808,mydumper,396,1926,C,https://github.com/mydumper/mydumper,Official MyDumper project,MDEwOlJlcG9zaXRvcnk0NTY5NTYxNg==,2023-03-27T20:44:55Z
809,VulkanMemoryAllocator,268,1925,C,https://github.com/GPUOpen-LibrariesAndSDKs/VulkanMemoryAllocator,Easy to integrate Vulkan memory allocation library,MDEwOlJlcG9zaXRvcnk5NDU1MTY0Nw==,2023-03-22T16:42:59Z
810,FUZIX,241,1924,C,https://github.com/EtchedPixels/FUZIX,FuzixOS: Because Small Is Beautiful,MDEwOlJlcG9zaXRvcnkyNjAxNDAxMw==,2023-03-28T11:20:57Z
811,SwiftLaTeX,98,1922,C,https://github.com/SwiftLaTeX/SwiftLaTeX,"SwiftLaTeX, a WYSIWYG Browser-based LaTeX Editor ",MDEwOlJlcG9zaXRvcnkyMjU5OTAyMDk=,2023-01-20T20:25:18Z
812,ejoy2d,644,1922,C,https://github.com/ejoy/ejoy2d,A 2D Graphics Engine for Mobile Game,MDEwOlJlcG9zaXRvcnkxNTQ5MDEzMA==,2018-09-15T04:06:15Z
813,onion,251,1922,C,https://github.com/davidmoreno/onion,C library to create simple HTTP servers and Web Applications.,MDEwOlJlcG9zaXRvcnk5NjEzMzU=,2022-10-17T18:56:32Z
814,LVS,682,1917,C,https://github.com/alibaba/LVS,"A distribution of Linux Virtual Server with some advanced features. It introduces a new packet forwarding method - FULLNAT other than NAT/Tunneling/DirectRouting, and defense mechanism against synflooding attack - SYNPROXY.",MDEwOlJlcG9zaXRvcnkxMTExNzY4Ng==,2019-07-02T02:59:08Z
815,sc,187,1913,C,https://github.com/tezc/sc,Common libraries and data structures for C.,MDEwOlJlcG9zaXRvcnkzMTE3OTgzMjQ=,2023-03-26T20:18:44Z
816,sigma-file-manager,70,1912,C,https://github.com/aleksey-hoffman/sigma-file-manager,"""Sigma File Manager"" is a free, open-source, quickly evolving, modern file manager (explorer / finder) app for Windows and Linux.",MDEwOlJlcG9zaXRvcnkzNzA2Nzk4MTE=,2023-03-23T17:49:35Z
817,FidelityFX-FSR,148,1911,C,https://github.com/GPUOpen-Effects/FidelityFX-FSR,FidelityFX Super Resolution,MDEwOlJlcG9zaXRvcnkzODU2NDIwMjA=,2022-05-22T20:25:43Z
818,Chipmunk2D,321,1905,C,https://github.com/slembcke/Chipmunk2D,A fast and lightweight 2D game physics library.,MDEwOlJlcG9zaXRvcnkyMDMzMDc5,2023-03-08T03:02:08Z
819,gobpf,300,1905,C,https://github.com/iovisor/gobpf,Go bindings for creating BPF programs.,MDEwOlJlcG9zaXRvcnk3NDE1NTkyMw==,2023-02-27T14:43:02Z
820,simplest_ffmpeg_mobile,769,1903,C,https://github.com/leixiaohua1020/simplest_ffmpeg_mobile,ffmpeg examples in Android / IOS / WinPhone,MDEwOlJlcG9zaXRvcnkzNzg1OTExNA==,2016-04-19T11:30:33Z
821,php-rdkafka,258,1902,C,https://github.com/arnaud-lb/php-rdkafka,"Production-ready, stable Kafka client for PHP",MDEwOlJlcG9zaXRvcnkzMzE0MDYxNg==,2022-07-26T18:44:01Z
822,rune,46,1902,C,https://github.com/google/rune,Rune is a programming language developed to test ideas for improving security and efficiency.,R_kgDOGUHfFw,2023-03-26T00:41:29Z
823,keen,173,1897,C,https://github.com/keendreams/keen,Keen Dreams on Greenlight!,MDEwOlJlcG9zaXRvcnkyNDA5NDcwOA==,2014-11-12T20:12:32Z
824,cc65,369,1895,C,https://github.com/cc65/cc65,cc65 - a freeware C compiler for 6502 based systems,MDEwOlJlcG9zaXRvcnk4OTMyNDg5,2023-03-27T22:00:29Z
825,termbox,185,1895,C,https://github.com/nsf/termbox,Library for writing text-based user interfaces,MDEwOlJlcG9zaXRvcnk0ODM3NzA=,2020-08-25T15:20:53Z
826,f3,122,1894,C,https://github.com/AltraMayor/f3,F3 - Fight Flash Fraud,MDEwOlJlcG9zaXRvcnkyOTg0MTU2,2023-03-13T14:13:19Z
827,txiki.js,121,1890,C,https://github.com/saghul/txiki.js,A tiny JavaScript runtime,MDEwOlJlcG9zaXRvcnkxOTgwOTc4NTA=,2023-03-09T13:25:39Z
828,YAOF,544,1887,C,https://github.com/QiuSimons/YAOF,OpenWrt for Nanopi R2C/R2S/R4S/X86,MDEwOlJlcG9zaXRvcnkyNzU4MzczNTI=,2023-03-28T12:05:36Z
829,android_bootable_recovery,1543,1886,C,https://github.com/omnirom/android_bootable_recovery,,MDEwOlJlcG9zaXRvcnkxMzUzNTgwMQ==,2023-02-15T20:58:36Z
830,CSAPP-Labs,406,1884,C,https://github.com/Exely/CSAPP-Labs,Solutions and Notes for Labs of Computer Systems: A Programmer's Perspective 3rd Editon // 《深入理解计算机系统》第三版的实验文件、解答与笔记,MDEwOlJlcG9zaXRvcnkxMDQ1NjI2NTA=,2023-02-15T15:50:22Z
831,nuster,157,1881,C,https://github.com/jiangwenyuan/nuster,A high performance HTTP proxy cache server and RESTful NoSQL cache server based on HAProxy,MDEwOlJlcG9zaXRvcnkxMDkxMjA4Mjg=,2021-12-07T14:46:06Z
832,KernelSU,303,1878,C,https://github.com/tiann/KernelSU,A Kernel based root solution for Android,R_kgDOIlmzKw,2023-03-28T12:00:15Z
833,pgvector,57,1873,C,https://github.com/pgvector/pgvector,Open-source vector similarity search for Postgres,MDEwOlJlcG9zaXRvcnkzNTk5NTI2MDE=,2023-03-27T06:39:19Z
834,Shipwright,316,1873,C,https://github.com/HarbourMasters/Shipwright,,R_kgDOHCru5Q,2023-03-27T21:32:31Z
835,sslscan,356,1871,C,https://github.com/rbsec/sslscan,sslscan tests SSL/TLS enabled services to discover supported cipher suites,MDEwOlJlcG9zaXRvcnk5NDc2NTQy,2023-03-20T13:44:19Z
