rank,item,repo_name,stars,forks,language,repo_url,username,issues,last_commit,description
416,CPP,fibjs,2957,310,C++,https://github.com/fibjs/fibjs,fibjs,31,2023-03-27T10:28:25Z,JavaScript on Fiber (built on Chrome's V8 JavaScript engine)
417,CPP,luau,2956,273,C++,https://github.com/Roblox/luau,Roblox,73,2023-03-24T18:07:55Z,"A fast, small, safe, gradually typed embeddable scripting language derived from Lua"
418,CPP,OpenMQTTGateway,2955,659,C++,https://github.com/1technophile/OpenMQTTGateway,1technophile,88,2023-03-27T01:34:16Z,"MQTT gateway for ESP8266, ESP32, Sonoff RF Bridge or Arduino with bidirectional 433mhz/315mhz/868mhz, Infrared communications, BLE, Bluetooth, beacons detection, mi flora, mi jia, LYWSD02, LYWSD03MMC, Mi Scale, TPMS, BBQ thermometer compatibility, SMS & LORA."
419,CPP,readerwriterqueue,2954,582,C++,https://github.com/cameron314/readerwriterqueue,cameron314,9,2023-03-24T14:55:53Z,"A fast single-producer, single-consumer lock-free queue for C++"
420,CPP,HIP,2946,474,C++,https://github.com/ROCm-Developer-Tools/HIP,ROCm-Developer-Tools,349,2023-03-27T11:45:12Z,HIP: C++ Heterogeneous-Compute Interface for Portability
421,CPP,harfbuzz,2932,542,C++,https://github.com/harfbuzz/harfbuzz,harfbuzz,59,2023-03-26T16:45:05Z,HarfBuzz text shaping engine
422,CPP,azerothcore-wotlk,2912,1607,C++,https://github.com/azerothcore/azerothcore-wotlk,azerothcore,1537,2023-03-27T11:13:04Z,Complete Open Source and Modular solution for MMO
423,CPP,cpp_new_features,2901,661,C++,https://github.com/0voice/cpp_new_features,0voice,7,2022-06-08T00:28:04Z,2021年最新整理， C++ 学习资料，含C++ 11 / 14 / 17 / 20 / 23 新特性、入门教程、推荐书籍、优质文章、学习笔记、教学视频等
424,CPP,xtensor,2897,364,C++,https://github.com/xtensor-stack/xtensor,xtensor-stack,341,2023-03-24T10:07:01Z,C++ tensors with broadcasting and lazy computing
425,CPP,ESPEasy,2895,2083,C++,https://github.com/letscontrolit/ESPEasy,letscontrolit,684,2023-03-27T10:17:46Z,Easy MultiSensor device based on ESP8266
426,CPP,AtomicGameEngine,2887,511,C++,https://github.com/AtomicGameEngine/AtomicGameEngine,AtomicGameEngine,389,2022-10-02T02:30:25Z,"The Atomic Game Engine is a multi-platform 2D and 3D engine with a consistent API in C++, C#, JavaScript, and TypeScript"
427,CPP,tomahawk,2883,376,C++,https://github.com/tomahawk-player/tomahawk,tomahawk-player,171,2020-09-08T14:35:33Z,"Tomahawk, the multi-source music player"
428,CPP,Serious-Engine,2862,372,C++,https://github.com/Croteam-official/Serious-Engine,Croteam-official,14,2020-10-31T19:06:31Z,An open source version of a game engine developed by Croteam for the classic Serious Sam games.
429,CPP,notes,2855,269,C++,https://github.com/nuttyartist/notes,nuttyartist,110,2023-03-26T23:02:23Z,Fast and beautiful note-taking app written in C++. Write down your thoughts.
430,CPP,djinni,2854,499,C++,https://github.com/dropbox/djinni,dropbox,53,2020-03-26T04:02:08Z,A tool for generating cross-language type declarations and interface bindings.
431,CPP,cefpython,2852,466,C++,https://github.com/cztomczak/cefpython,cztomczak,197,2022-03-22T13:06:22Z,Python bindings for the Chromium Embedded Framework (CEF)
432,CPP,yue,2850,136,C++,https://github.com/yue/yue,yue,15,2023-03-26T12:58:44Z,A library for creating native cross-platform GUI apps
433,CPP,JoltPhysics,2842,184,C++,https://github.com/jrouwe/JoltPhysics,jrouwe,4,2023-03-26T21:05:04Z,"A multi core friendly rigid body physics and collision detection library, written in C++, suitable for games and VR applications."
434,CPP,euler,2834,559,C++,https://github.com/alibaba/euler,alibaba,214,2022-10-23T02:22:52Z,A distributed graph deep learning framework.
435,CPP,dumpDex,2823,601,C++,https://github.com/WrBug/dumpDex,WrBug,37,2020-05-15T06:35:32Z,"💯一款Android脱壳工具，需要xposed支持, 易开发已集成该项目。"
436,CPP,Cpp-0-1-Resource,2817,1152,C++,https://github.com/AnkerLeng/Cpp-0-1-Resource,AnkerLeng,6,2020-10-01T18:02:25Z,C++ 匠心之作 从0到1入门资料
437,CPP,ESPAsyncWebServer,2814,921,C++,https://github.com/me-no-dev/ESPAsyncWebServer,me-no-dev,106,2023-03-01T16:27:38Z,Async Web Server for ESP8266 and ESP32
438,CPP,kungfu,2809,993,C++,https://github.com/kungfu-origin/kungfu,kungfu-origin,21,2022-12-12T09:52:00Z,Kungfu Trader
439,CPP,PhoenixGo,2809,572,C++,https://github.com/Tencent/PhoenixGo,Tencent,22,2019-03-11T11:19:25Z,Go AI program which implements the AlphaGo Zero paper
440,CPP,date,2809,620,C++,https://github.com/HowardHinnant/date,HowardHinnant,126,2023-03-04T20:42:06Z,A date and time library based on the C++11/14/17 <chrono> header
441,CPP,onnx-simplifier,2808,309,C++,https://github.com/daquexian/onnx-simplifier,daquexian,102,2023-03-21T14:29:07Z,Simplify your onnx model
442,CPP,ServerStatus,2806,809,C++,https://github.com/cppla/ServerStatus,cppla,9,2023-03-13T07:23:51Z,云探针、多服务器探针、云监控、多服务器云监控，演示： https://tz.cloudcpp.com/
443,CPP,openbr,2786,768,C++,https://github.com/biometrics/openbr,biometrics,62,2022-12-15T18:51:36Z,"Open Source Biometrics, Face Recognition"
444,CPP,RxCpp,2781,373,C++,https://github.com/ReactiveX/RxCpp,ReactiveX,85,2022-09-12T22:18:08Z,Reactive Extensions for C++
445,CPP,thrust,2779,131,C++,https://github.com/breach/thrust,breach,47,2018-10-25T04:53:38Z,Chromium-based cross-platform / cross-language application framework
446,CPP,snowboy,2778,942,C++,https://github.com/Kitt-AI/snowboy,Kitt-AI,292,2021-10-13T11:44:20Z,Future versions with model training module will be maintained through a forked version here: https://github.com/seasalt-ai/snowboy
447,CPP,heavydb,2777,433,C++,https://github.com/heavyai/heavydb,heavyai,227,2023-02-10T13:51:38Z,HeavyDB (formerly OmniSciDB)
448,CPP,visualboyadvance-m,2766,277,C++,https://github.com/visualboyadvance-m/visualboyadvance-m,visualboyadvance-m,294,2023-03-27T11:12:41Z,The continuing development of the legendary VBA gameboy advance emulator.
449,CPP,wdt,2765,397,C++,https://github.com/facebook/wdt,facebook,74,2022-12-19T04:38:15Z,Warp speed Data Transfer (WDT)  is an embeddedable library (and command line tool) aiming to transfer data between 2 systems as fast as possible over multiple TCP paths.
450,CPP,Adafruit_NeoPixel,2758,1192,C++,https://github.com/adafruit/Adafruit_NeoPixel,adafruit,60,2023-03-23T08:25:37Z,"Arduino library for controlling single-wire LED pixels (NeoPixel, WS2812, etc.)"
451,CPP,include-what-you-use,3282,348,C++,https://github.com/include-what-you-use/include-what-you-use,include-what-you-use,221,2023-03-26T20:57:40Z,A tool for use with clang to analyze #includes in C and C++ source files
452,CPP,CSPostgraduate-408,3281,591,C++,https://github.com/CodePanda66/CSPostgraduate-408,CodePanda66,0,2023-01-07T19:08:27Z,💯  CSPostgraduate 计算机考研 408 专业课资料及真题资源
453,CPP,robotstxt,3272,218,C++,https://github.com/google/robotstxt,google,7,2022-10-18T10:29:37Z,The repository contains Google's robots.txt parser and matcher as a C++ library (compliant to C++11).
454,CPP,kalibr,3270,1225,C++,https://github.com/ethz-asl/kalibr,ethz-asl,72,2023-02-14T00:34:42Z,The Kalibr visual-inertial calibration toolbox
455,CPP,ALVR,3269,319,C++,https://github.com/alvr-org/ALVR,alvr-org,76,2023-03-27T11:15:51Z,Stream VR games from your PC to your headset via Wi-Fi
456,CPP,WindowsAppSDK,3256,249,C++,https://github.com/microsoft/WindowsAppSDK,microsoft,447,2023-03-26T20:45:21Z,"The Windows App SDK empowers all Windows desktop apps with modern Windows UI, APIs, and platform features, including back-compat support, shipped via NuGet."
457,CPP,noMeiryoUI,3254,123,C++,https://github.com/Tatsu-syo/noMeiryoUI,Tatsu-syo,28,2023-01-22T12:02:07Z,No!! MeiryoUI is Windows system font setting tool on Windows 8.1/10/11.
458,CPP,halley,3253,155,C++,https://github.com/amzeratul/halley,amzeratul,27,2023-03-27T10:27:20Z,A lightweight game engine written in modern C++
459,CPP,domoticz,3243,1127,C++,https://github.com/domoticz/domoticz,domoticz,90,2023-03-25T16:13:20Z,Open source Home Automation System
460,CPP,cplusplus-_Implementation_Of_Introduction_to_Algorithms,3235,978,C++,https://github.com/huaxz1986/cplusplus-_Implementation_Of_Introduction_to_Algorithms,huaxz1986,6,2021-06-17T11:09:27Z,《算法导论》第三版中算法的C++实现
461,CPP,cuml,3219,451,C++,https://github.com/rapidsai/cuml,rapidsai,716,2023-03-27T07:57:55Z,cuML - RAPIDS Machine Learning Library
462,CPP,pushpin,3216,140,C++,https://github.com/fanout/pushpin,fanout,29,2023-03-16T16:23:34Z,Proxy server for adding push to your API
463,CPP,LibreSprite,3214,193,C++,https://github.com/LibreSprite/LibreSprite,LibreSprite,37,2023-03-15T19:10:46Z,Animated sprite editor & pixel art tool -- Fork of the last GPLv2 commit of Aseprite
464,CPP,phxpaxos,3209,880,C++,https://github.com/Tencent/phxpaxos,Tencent,56,2021-05-08T09:40:31Z,The Paxos library implemented in C++ that has been used in the WeChat production environment.
465,CPP,zopfli,3209,326,C++,https://github.com/google/zopfli,google,90,2023-03-11T02:10:39Z,"Zopfli Compression Algorithm is a compression library programmed in C to perform very good, but slow, deflate or zlib compression."
466,CPP,ogre,3208,867,C++,https://github.com/OGRECave/ogre,OGRECave,110,2023-03-25T14:01:06Z,"scene-oriented, flexible 3D engine (C++, Python, C#, Java)"
467,CPP,matplotplusplus,3183,245,C++,https://github.com/alandefreitas/matplotplusplus,alandefreitas,31,2023-02-17T17:00:31Z,Matplot++: A C++ Graphics Library for Data Visualization 📊🗾
468,CPP,fully-homomorphic-encryption,3180,225,C++,https://github.com/google/fully-homomorphic-encryption,google,1,2023-03-17T14:57:26Z,An FHE compiler for C++
469,CPP,cubefs,3169,420,C++,https://github.com/cubefs/cubefs,cubefs,121,2023-03-27T09:24:37Z,CubeFS is a cloud native file storage
470,CPP,AppleALC,3164,923,C++,https://github.com/acidanthera/AppleALC,acidanthera,0,2023-03-27T08:09:47Z,Native macOS HD audio for not officially supported codecs
471,CPP,Serial-Studio,3158,457,C++,https://github.com/Serial-Studio/Serial-Studio,Serial-Studio,41,2023-02-06T03:48:00Z,Multi-purpose serial data visualization & processing program
472,CPP,PrismLauncher,3158,249,C++,https://github.com/PrismLauncher/PrismLauncher,PrismLauncher,313,2023-03-25T12:14:22Z,A custom launcher for Minecraft that allows you to easily manage multiple installations of Minecraft at once (Fork of MultiMC)
473,CPP,beringei,3155,313,C++,https://github.com/facebookarchive/beringei,facebookarchive,0,2018-07-11T17:33:58Z,"Beringei is a high performance, in-memory storage engine for time series data."
474,CPP,nan,3154,509,C++,https://github.com/nodejs/nan,nodejs,48,2023-01-31T05:46:08Z,Native Abstractions for Node.js
475,CPP,reshade,3150,478,C++,https://github.com/crosire/reshade,crosire,0,2023-03-26T10:12:41Z,A generic post-processing injector for games and video software.
476,CPP,taskwarrior,3147,226,C++,https://github.com/GothenburgBitFactory/taskwarrior,GothenburgBitFactory,426,2023-03-27T06:07:27Z,Taskwarrior - Command line Task Management
477,CPP,openthread,3126,1005,C++,https://github.com/openthread/openthread,openthread,77,2023-03-27T10:03:15Z,OpenThread released by Google is an open-source implementation of the Thread networking protocol
478,CPP,mcrouter,3122,528,C++,https://github.com/facebook/mcrouter,facebook,89,2023-03-27T09:25:24Z,Mcrouter is a memcached protocol router for scaling memcached deployments.
479,CPP,hybridclr,3120,419,C++,https://github.com/focus-creative-games/hybridclr,focus-creative-games,2,2023-03-27T02:58:48Z,"HybridCLR是一个特性完整、零成本、高性能、低内存的Unity全平台原生c#热更方案。 HybridCLR is a fully featured, zero-cost, high-performance, low-memory solution for Unity's all-platform native c# hotupdate."
480,CPP,love,3112,277,C++,https://github.com/love2d/love,love2d,88,2023-03-26T23:46:30Z,LÖVE is an awesome 2D game framework for Lua.
481,CPP,PacVim,3105,195,C++,https://github.com/jmoon018/PacVim,jmoon018,13,2021-11-18T10:29:14Z,
482,CPP,nlp_paper_study,3099,588,C++,https://github.com/km1994/nlp_paper_study,km1994,3,2023-03-10T09:40:06Z,该仓库主要记录 NLP 算法工程师相关的顶会论文研读笔记
483,CPP,Bilibili-plus,3094,901,C++,https://github.com/ZachL1/Bilibili-plus,ZachL1,0,2023-03-18T05:16:20Z,课程视频、PPT和源代码：侯捷C++系列；台大郭彦甫MATLAB
484,CPP,CppPrimer,3088,1463,C++,https://github.com/pezy/CppPrimer,pezy,25,2022-10-10T02:31:33Z,:books: Solutions for C++ Primer 5th exercises.
485,CPP,btfs,3084,131,C++,https://github.com/johang/btfs,johang,12,2023-02-28T16:24:09Z,A bittorrent filesystem based on FUSE.
486,CPP,fr_public,3084,331,C++,https://github.com/farbrausch/fr_public,farbrausch,21,2019-07-28T21:02:28Z,Farbrausch demo tools 2001-2011
487,CPP,orbit,3084,316,C++,https://github.com/google/orbit,google,28,2023-03-26T22:39:37Z,C/C++ Performance Profiler
488,CPP,vcmi,3083,355,C++,https://github.com/vcmi/vcmi,vcmi,230,2023-03-27T08:29:29Z,Open-source engine for Heroes of Might and Magic III
489,CPP,touchegg,3063,157,C++,https://github.com/JoseExposito/touchegg,JoseExposito,17,2023-02-06T19:20:29Z,Linux multi-touch gesture recognizer
490,CPP,ceres-solver,3058,932,C++,https://github.com/ceres-solver/ceres-solver,ceres-solver,87,2023-03-11T22:09:04Z,A large scale non-linear optimization library
491,CPP,mergerfs,3055,146,C++,https://github.com/trapexit/mergerfs,trapexit,31,2023-03-22T03:05:15Z,a featureful union filesystem
492,CPP,spring,3053,813,C++,https://github.com/spring/spring,spring,0,2023-02-12T17:27:34Z,A powerful free cross-platform RTS game engine. - Report issues at https://springrts.com/mantis/
493,CPP,Slic3r,3049,1284,C++,https://github.com/slic3r/Slic3r,slic3r,1098,2023-02-16T12:09:06Z,Open Source toolpath generator for 3D printers
494,CPP,rpi-rgb-led-matrix,3043,1016,C++,https://github.com/hzeller/rpi-rgb-led-matrix,hzeller,446,2023-03-23T16:33:15Z,"Controlling up to three chains of 64x64, 32x32, 16x32 or similar RGB LED displays using Raspberry Pi GPIO"
495,CPP,node-packer,3041,210,C++,https://github.com/pmq20/node-packer,pmq20,90,2023-01-07T21:04:07Z,Packing your Node.js application into a single executable.
496,CPP,xlearn,3041,538,C++,https://github.com/aksnzhy/xlearn,aksnzhy,185,2022-08-23T09:45:09Z,"High performance, easy-to-use, and scalable machine learning (ML) package, including linear model (LR), factorization machines (FM), and field-aware factorization machines (FFM) for Python and CLI interface."
497,CPP,Clipboard,3037,78,C++,https://github.com/Slackadays/Clipboard,Slackadays,1,2023-03-27T00:05:04Z,"😎 Your external brain that remembers anything, anytime, anywhere. Save time and effort the 𝗲𝗮𝘀𝘆 way! :rocket:"
498,CPP,manticoresearch,3033,176,C++,https://github.com/manticoresoftware/manticoresearch,manticoresoftware,223,2023-03-27T10:20:13Z,Easy to use open source fast database for search | Good alternative to Elasticsearch now | Drop-in replacement for E in the ELK soon
499,CPP,WechatExporter,3030,334,C++,https://github.com/BlueMatthew/WechatExporter,BlueMatthew,62,2022-08-28T03:08:20Z,Wechat Chat History Exporter 微信聊天记录导出备份程序
500,CPP,GW-BASIC,3029,460,C++,https://github.com/microsoft/GW-BASIC,microsoft,0,2020-05-22T00:19:53Z,The original source code of Microsoft GW-BASIC from 1983
501,CPP,cef,2189,360,C++,https://github.com/chromiumembedded/cef,chromiumembedded,165,2023-03-19T04:01:09Z,Chromium Embedded Framework (CEF). A simple framework for embedding Chromium-based browsers in other applications.
502,CPP,Beef,2188,119,C++,https://github.com/beefytech/Beef,beefytech,199,2023-03-22T04:50:05Z,Beef Programming Language
503,CPP,wil,2188,197,C++,https://github.com/microsoft/wil,microsoft,54,2023-03-26T23:03:38Z,Windows Implementation Library
504,CPP,huatuo,2179,370,C++,https://github.com/tuyoogame/huatuo,tuyoogame,3,2023-02-16T03:17:00Z,"huatuo是一个特性完整、零成本、高性能、低内存的近乎完美的Unity全平台原生c#热更方案。 Huatuo is a fully featured, zero-cost, high-performance, low-memory solution for Unity's all-platform native c# hotfix"
505,CPP,wallet-core,2171,1327,C++,https://github.com/trustwallet/wallet-core,trustwallet,21,2023-03-27T10:54:48Z,"Cross-platform, cross-blockchain wallet library."
506,CPP,Learning-OpenCV-3_examples,2158,881,C++,https://github.com/oreillymedia/Learning-OpenCV-3_examples,oreillymedia,15,2021-02-19T19:42:48Z,
507,CPP,treesheets,2157,172,C++,https://github.com/aardappel/treesheets,aardappel,139,2023-03-18T19:38:31Z,TreeSheets : Free Form Data Organizer (see strlen.com/treesheets)
508,CPP,Algo_Ds_Notes,2154,2073,C++,https://github.com/jainaman224/Algo_Ds_Notes,jainaman224,157,2022-12-31T18:10:38Z,It is a repository that is a collection of algorithms and data structures with implementation in various languages.
509,CPP,GacUI,2145,289,C++,https://github.com/vczh-libraries/GacUI,vczh-libraries,15,2023-03-26T13:52:38Z,"GPU Accelerated C++ User Interface, with WYSIWYG developing tools, XML supports, built-in data binding and MVVM features."
510,CPP,openauto,2145,390,C++,https://github.com/f1xpl/openauto,f1xpl,0,2020-12-11T10:49:59Z,AndroidAuto headunit emulator
511,CPP,Surround360,2142,595,C++,https://github.com/facebookarchive/Surround360,facebookarchive,39,2019-08-30T06:22:04Z,"Surround360 is Facebook's open source hardware and software for capturing stereoscopic 3D 360 video for VR. The repo contains hardware designs, as well as software for camera control and rendering."
512,CPP,maplab,2136,666,C++,https://github.com/ethz-asl/maplab,ethz-asl,95,2023-03-25T16:49:47Z,A Modular and Multi-Modal Mapping Framework
513,CPP,hpx,2124,375,C++,https://github.com/STEllAR-GROUP/hpx,STEllAR-GROUP,91,2023-03-27T00:01:46Z,The C++ Standard Library for Parallelism and Concurrency
514,CPP,code-library,2124,609,C++,https://github.com/ShahjalalShohag/code-library,ShahjalalShohag,0,2023-03-17T18:01:00Z,"Templates, algorithms and data structures implemented and collected for programming contests."
515,CPP,texstudio,2117,312,C++,https://github.com/texstudio-org/texstudio,texstudio-org,427,2023-03-26T10:06:44Z,TeXstudio is a fully featured LaTeX editor. Our goal is to make writing LaTeX documents as easy and comfortable as possible.
516,CPP,cpp-learning,2116,368,C++,https://github.com/chengxumiaodaren/cpp-learning,chengxumiaodaren,0,2022-09-03T01:16:04Z,
517,CPP,jfx,2116,370,C++,https://github.com/openjdk/jfx,openjdk,0,2023-03-25T16:21:48Z,JavaFX mainline development
518,CPP,leocad,2115,190,C++,https://github.com/leozide/leocad,leozide,186,2023-03-20T01:26:41Z,A CAD application for creating virtual LEGO models
519,CPP,RawTherapee,2115,275,C++,https://github.com/Beep6581/RawTherapee,Beep6581,909,2023-03-27T11:23:42Z,A powerful cross-platform raw photo processing program
520,CPP,CS_Offer,2113,621,C++,https://github.com/selfboot/CS_Offer,selfboot,12,2022-12-30T03:09:11Z,计算机学科基础知识和主流编程语言相关内容的总结
521,CPP,NanoLog,2111,271,C++,https://github.com/PlatformLab/NanoLog,PlatformLab,26,2022-03-09T15:51:06Z,Nanolog is an extremely performant nanosecond scale logging system for C++ that exposes a simple printf-like API.
522,CPP,kenlm,2108,465,C++,https://github.com/kpu/kenlm,kpu,99,2023-03-05T13:43:39Z,KenLM: Faster and Smaller Language Model Queries
523,CPP,sdsl-lite,2106,336,C++,https://github.com/simongog/sdsl-lite,simongog,62,2021-10-05T12:22:00Z,Succinct Data Structure Library 2.0
524,CPP,rehex,2102,111,C++,https://github.com/solemnwarning/rehex,solemnwarning,36,2023-03-26T22:46:33Z,Reverse Engineers' Hex Editor
525,CPP,corona,2098,237,C++,https://github.com/coronalabs/corona,coronalabs,102,2023-03-27T04:12:09Z,Solar2D Game Engine main repository (ex Corona SDK)
526,CPP,WebServer,2089,528,C++,https://github.com/markparticle/WebServer,markparticle,36,2022-01-17T17:55:14Z,C++  Linux WebServer服务器
527,CPP,sofa-pbrpc,2089,666,C++,https://github.com/baidu/sofa-pbrpc,baidu,47,2022-02-10T01:45:26Z,A light-weight RPC implement of google protobuf RPC framework.
528,CPP,VTK,2088,1074,C++,https://github.com/Kitware/VTK,Kitware,0,2023-03-27T10:03:08Z,Mirror of Visualization Toolkit repository
529,CPP,botan,2086,504,C++,https://github.com/randombit/botan,randombit,124,2023-03-27T11:26:55Z,Cryptography Toolkit
530,CPP,ELF,2086,298,C++,https://github.com/facebookresearch/ELF,facebookresearch,37,2021-08-30T20:13:52Z,"An End-To-End, Lightweight and Flexible Platform for Game Research"
531,CPP,qt-material-widgets,2082,525,C++,https://github.com/laserpants/qt-material-widgets,laserpants,21,2023-02-27T07:52:58Z,:art: Qt widgets-based implementation of the Material Design specification.
532,CPP,Hardcoder,2081,201,C++,https://github.com/Tencent/Hardcoder,Tencent,14,2022-05-26T09:29:58Z,"Hardcoder is a solution which allows Android APP and Android System to communicate with each other directly, solving the problem that Android APP could only use system standard API rather than the hardware resource of system."
533,CPP,nccl,2074,569,C++,https://github.com/NVIDIA/nccl,NVIDIA,220,2023-03-21T02:56:10Z,Optimized primitives for collective multi-GPU communication
534,CPP,LiveVideoCoreSDK,2062,620,C++,https://github.com/runner365/LiveVideoCoreSDK,runner365,15,2022-05-30T03:26:03Z,
535,CPP,2048.cpp,2057,306,C++,https://github.com/plibither8/2048.cpp,plibither8,15,2022-06-24T22:26:38Z,"🎮 Fully featured terminal version of the game ""2048"" written in C++"
536,CPP,lc0,2056,444,C++,https://github.com/LeelaChessZero/lc0,LeelaChessZero,78,2023-03-23T15:43:34Z,"The rewritten engine, originally for tensorflow. Now all other backends have been ported here."
537,CPP,entityx,2049,287,C++,https://github.com/alecthomas/entityx,alecthomas,16,2022-02-04T11:00:21Z,"EntityX - A fast, type-safe C++ Entity-Component system"
538,CPP,AntSimulator,2044,262,C++,https://github.com/johnBuffer/AntSimulator,johnBuffer,17,2023-01-19T00:33:05Z,Simple Ants simulator
539,CPP,cmake-examples-Chinese,2043,320,C++,https://github.com/SFUMECJF/cmake-examples-Chinese,SFUMECJF,8,2022-11-28T04:15:56Z,"快速入门CMake,通过例程学习语法。在线阅读地址：https://sfumecjf.github.io/cmake-examples-Chinese/"
540,CPP,rtabmap,2042,708,C++,https://github.com/introlab/rtabmap,introlab,348,2023-03-26T05:41:34Z,RTAB-Map library and standalone application
541,CPP,tair,2038,621,C++,https://github.com/alibaba/tair,alibaba,4,2019-11-19T03:53:09Z,A distributed key-value storage system developed by Alibaba Group
542,CPP,obs-multi-rtmp,2035,356,C++,https://github.com/sorayuki/obs-multi-rtmp,sorayuki,102,2023-03-04T10:20:46Z,OBS ≧ 26.1用複数サイト同時配信プラグイン
543,CPP,sciter-sdk,2033,221,C++,https://github.com/c-smile/sciter-sdk,c-smile,53,2023-01-18T03:27:07Z,Sciter is an embeddable HTML/CSS/scripting engine
544,CPP,HexRaysCodeXplorer,2029,365,C++,https://github.com/REhints/HexRaysCodeXplorer,REhints,13,2023-02-14T09:49:44Z,Hex-Rays Decompiler plugin for better code navigation
545,CPP,griddb,2027,4689,C++,https://github.com/griddb/griddb,griddb,35,2023-03-16T02:32:36Z,"GridDB is a next-generation open source database that makes time series IoT and big data fast,and easy."
546,CPP,dso,2027,867,C++,https://github.com/JakobEngel/dso,JakobEngel,112,2023-03-16T18:29:43Z,Direct Sparse Odometry
547,CPP,googerteller,2025,103,C++,https://github.com/berthubert/googerteller,berthubert,11,2022-10-05T09:40:51Z,audible feedback on just how much your browsing feeds into google
548,CPP,openvdb,2024,536,C++,https://github.com/AcademySoftwareFoundation/openvdb,AcademySoftwareFoundation,90,2023-03-25T18:20:37Z,OpenVDB - Sparse volume data structure and tools
549,CPP,simbody,2021,463,C++,https://github.com/simbody/simbody,simbody,122,2023-03-24T23:49:24Z,"High-performance C++ multibody dynamics/physics library for simulating articulated biomechanical and mechanical systems like vehicles, robots, and the human skeleton."
550,CPP,antimony,2014,154,C++,https://github.com/mkeeter/antimony,mkeeter,67,2023-01-18T13:38:19Z,CAD from a parallel universe
551,CPP,OTTO,2543,147,C++,https://github.com/bitfieldaudio/OTTO,bitfieldaudio,19,2023-01-23T08:31:10Z,"Sampler, Sequencer, Multi-engine synth and effects - in a box! [WIP]"
552,CPP,Tendis,2542,298,C++,https://github.com/Tencent/Tendis,Tencent,93,2022-10-17T06:09:38Z,Tendis is a high-performance distributed storage system fully compatible with the Redis protocol. 
553,CPP,terra,2542,192,C++,https://github.com/terralang/terra,terralang,101,2022-10-17T21:01:57Z,Terra is a low-level system programming language that is embedded in and meta-programmed by the Lua programming language.
554,CPP,FasterTransformer,2532,438,C++,https://github.com/NVIDIA/FasterTransformer,NVIDIA,94,2023-03-24T09:59:53Z,"Transformer related optimization, including BERT, GPT"
555,CPP,node-webrtc,2529,435,C++,https://github.com/node-webrtc/node-webrtc,node-webrtc,110,2022-11-22T03:49:21Z,node-webrtc is a Node.js Native Addon that provides bindings to WebRTC M87
556,CPP,srt,2528,752,C++,https://github.com/Haivision/srt,Haivision,239,2023-03-21T19:25:42Z,"Secure, Reliable, Transport"
557,CPP,VulkanTutorial,2512,447,C++,https://github.com/Overv/VulkanTutorial,Overv,38,2023-03-09T17:05:24Z,Tutorial for the Vulkan graphics and compute API
558,CPP,jakt,2501,241,C++,https://github.com/SerenityOS/jakt,SerenityOS,54,2023-03-25T22:40:48Z,The Jakt Programming Language
559,CPP,go-sciter,2499,267,C++,https://github.com/sciter-sdk/go-sciter,sciter-sdk,90,2022-04-04T06:33:22Z,Golang bindings of Sciter: the Embeddable HTML/CSS/script engine for modern UI development
560,CPP,youtube,2497,508,C++,https://github.com/Errichto/youtube,Errichto,3,2022-06-16T05:48:13Z,codes for my streams and YT videos
