rank,repo_name,forks,stars,language,repo_url,description,id,last_commit
557,webdis,295,2657,C,https://github.com/nicolasff/webdis,A Redis HTTP interface with JSON output,MDEwOlJlcG9zaXRvcnkxMTg0Njc4,2023-03-25T20:13:31Z
558,EasyHook,619,2652,C,https://github.com/EasyHook/EasyHook,EasyHook - The reinvention of Windows API Hooking,MDEwOlJlcG9zaXRvcnk0MDQyNDYyMg==,2023-03-17T13:29:39Z
559,json-c,1032,2648,C,https://github.com/json-c/json-c,https://github.com/json-c/json-c is the official code repository for json-c.  See the wiki for release tarballs for download.  API docs at http://json-c.github.io/json-c/,MDEwOlJlcG9zaXRvcnkxMTM5MTE5,2023-03-10T19:54:44Z
560,os,217,2648,C,https://github.com/minoca/os,Minoca operating system,MDEwOlJlcG9zaXRvcnk3MjM4NTU5MA==,2021-12-17T08:35:39Z
561,gear-lib,753,2645,C,https://github.com/gozfree/gear-lib,"Gear-Lib, C library for IOT Embedded Multimedia and Network",MDEwOlJlcG9zaXRvcnk0MDM1OTg3MQ==,2023-02-18T14:37:38Z
562,notcurses,96,2644,C,https://github.com/dankamongmen/notcurses,blingful character graphics/TUI library. definitely not curses.,MDEwOlJlcG9zaXRvcnkyMjIxODczNjE=,2023-03-21T04:09:08Z
563,libmill,201,2642,C,https://github.com/sustrik/libmill,Go-style concurrency in C,MDEwOlJlcG9zaXRvcnkxOTI2NzY1Mg==,2021-02-09T05:27:00Z
564,libmodbus,1531,2635,C,https://github.com/stephane/libmodbus,"A Modbus library for Linux, Mac OS, FreeBSD and Windows",MDEwOlJlcG9zaXRvcnk0ODE5Nzc=,2023-03-14T09:36:22Z
565,weechat,311,2634,C,https://github.com/weechat/weechat,The extensible chat client.,MDEwOlJlcG9zaXRvcnkxNzM1OTIxMA==,2023-03-27T11:06:26Z
566,irssi,348,2631,C,https://github.com/irssi/irssi,The client of the future,MDEwOlJlcG9zaXRvcnkyMDM0NDAzMA==,2023-03-28T00:37:49Z
567,Broadway,421,2629,C,https://github.com/mbebenita/Broadway,A JavaScript H.264 decoder.,MDEwOlJlcG9zaXRvcnkyNTc3OTM5,2023-01-22T15:40:35Z
568,patchelf,410,2626,C,https://github.com/NixOS/patchelf,A small utility to modify the dynamic linker and RPATH of ELF executables,MDEwOlJlcG9zaXRvcnkyOTI4MTY0,2023-03-27T05:38:44Z
569,mjpg-streamer,1154,2625,C,https://github.com/jacksonliam/mjpg-streamer,Fork of http://sourceforge.net/projects/mjpg-streamer/,MDEwOlJlcG9zaXRvcnkxMDU1NTAyMQ==,2023-02-06T21:13:52Z
570,starrtc-server,843,2624,C,https://github.com/starrtc/starrtc-server,免费IM系统，IM即时通信消息系统(含一对一文字聊天，群聊，聊天室)，免费一对一voip实时通话，录屏，webrtc服务端，免费直播连麦，互动直播，视频直播，RTSP拉流，RTMP推流，语音对讲，免费在线会议，视频会议等服务端程序，支持物联网平台，✨万水千山总是情，来个star行不行✨,MDEwOlJlcG9zaXRvcnkxNjQ1ODUyNDc=,2019-12-27T13:44:39Z
571,libopencm3,954,2613,C,https://github.com/libopencm3/libopencm3,Open source ARM Cortex-M microcontroller library,MDEwOlJlcG9zaXRvcnk0MDY1OTgw,2023-03-08T20:53:52Z
572,massdns,439,2612,C,https://github.com/blechschmidt/massdns,A high-performance DNS stub resolver for bulk lookups and reconnaissance (subdomain enumeration),MDEwOlJlcG9zaXRvcnk2MTc5NjcyNQ==,2023-03-05T14:10:06Z
573,SmartAppUpdates,835,2612,C,https://github.com/cundong/SmartAppUpdates,Android应用增量更新,MDEwOlJlcG9zaXRvcnkxNTAzOTQ2Nw==,2016-04-11T07:19:23Z
574,shadowsocksr-native,788,2612,C,https://github.com/ShadowsocksR-Live/shadowsocksr-native,"翻墙 从容穿越党国敏感日 ShadowsocksR (SSRoT) native implementation for all platforms, GFW terminator",MDEwOlJlcG9zaXRvcnk5ODY1MTE2Ng==,2022-12-08T09:32:03Z
575,microui,200,2605,C,https://github.com/rxi/microui,A tiny immediate-mode UI library,MDEwOlJlcG9zaXRvcnkxNDk4NTQ3MDU=,2023-03-09T19:25:13Z
576,pafish,442,2600,C,https://github.com/a0rtega/pafish,Pafish is a testing tool that uses different techniques to detect virtual machines and malware analysis environments in the same way that malware families do,MDEwOlJlcG9zaXRvcnk0ODQ5NjMw,2021-11-09T16:39:46Z
577,esp-link,692,2597,C,https://github.com/jeelabs/esp-link,"esp8266 wifi-serial bridge, outbound TCP, and arduino/AVR/LPC/NXP programmer",MDEwOlJlcG9zaXRvcnkzNTczMDA0Ng==,2021-07-18T23:32:05Z
578,obs-ndi,308,2588,C,https://github.com/obs-ndi/obs-ndi,NewTek NDI integration for OBS Studio,MDEwOlJlcG9zaXRvcnk3MTY0MzAwOA==,2023-03-15T11:29:13Z
579,viabtc_exchange_server,1497,2586,C,https://github.com/viabtc/viabtc_exchange_server,A trading engine with high-speed performance and real-time notification,MDEwOlJlcG9zaXRvcnk4NDAyMzE4Mw==,2021-12-17T13:16:42Z
580,geany,564,2570,C,https://github.com/geany/geany,A fast and lightweight IDE,MDEwOlJlcG9zaXRvcnkyNTMyOTIy,2023-03-27T13:23:05Z
581,shellinabox,444,2567,C,https://github.com/shellinabox/shellinabox,Official-ish Fork of Shell In A Box,MDEwOlJlcG9zaXRvcnkzMTU2NDMyMg==,2022-11-05T06:36:45Z
582,waifu2x-ncnn-vulkan,187,2562,C,https://github.com/nihui/waifu2x-ncnn-vulkan,"waifu2x converter ncnn version, runs fast on intel / amd / nvidia / apple-silicon GPU with vulkan",MDEwOlJlcG9zaXRvcnkxNzkzMDQ3NTI=,2023-03-12T03:08:55Z
583,TFT_eSPI,824,2560,C,https://github.com/Bodmer/TFT_eSPI,"Arduino and PlatformIO IDE compatible TFT library optimised for the Raspberry Pi Pico (RP2040), STM32, ESP8266 and ESP32 that supports different driver chips",MDEwOlJlcG9zaXRvcnk4Mjc1NDU1Ng==,2023-03-28T09:02:16Z
584,Espruino,714,2557,C,https://github.com/espruino/Espruino,The Espruino JavaScript interpreter - Official Repo,MDEwOlJlcG9zaXRvcnkxMzEyMzE0Mg==,2023-03-27T10:34:23Z
585,box86,187,2557,C,https://github.com/ptitSeb/box86,"Box86 - Linux Userspace x86 Emulator with a twist, targeted at ARM Linux devices",MDEwOlJlcG9zaXRvcnkxNjQ4NDQ1NDY=,2023-03-23T09:36:57Z
586,Tiny,342,2554,C,https://github.com/Sunzxyong/Tiny,an image compression framework.（一个高保真、高压缩比的图片压缩框架）,MDEwOlJlcG9zaXRvcnk4NzE1MTUwMw==,2020-10-07T10:50:31Z
587,PolarDB-for-PostgreSQL,405,2553,C,https://github.com/ApsaraDB/PolarDB-for-PostgreSQL,A cloud-native database based on PostgreSQL developed by Alibaba Cloud.,MDEwOlJlcG9zaXRvcnkzNzA1Mjk1MDU=,2023-03-25T06:06:23Z
588,sl,391,2553,C,https://github.com/mtoyoda/sl,SL(1): Cure your bad habit of mistyping,MDEwOlJlcG9zaXRvcnk5ODU4NzE4,2023-03-11T00:38:18Z
589,WizQTClient,815,2552,C,https://github.com/WizTeam/WizQTClient,为知笔记跨平台客户端,MDEwOlJlcG9zaXRvcnk2NjgyMDk0,2021-05-26T11:06:21Z
590,dpvs,654,2552,C,https://github.com/iqiyi/dpvs,DPVS is a high performance Layer-4 load balancer based on DPDK.,MDEwOlJlcG9zaXRvcnkxMDYzNzU2MzE=,2023-03-22T02:28:43Z
591,donut,499,2552,C,https://github.com/TheWover/donut,"Generates x86, x64, or AMD64+x86 position-independent shellcode that loads .NET Assemblies, PE files, and other Windows payloads from memory and runs them with parameters",MDEwOlJlcG9zaXRvcnkxNzgwODk0OTk=,2023-03-10T19:28:15Z
592,pipelinedb,236,2548,C,https://github.com/pipelinedb/pipelinedb,High-performance time-series aggregation for PostgreSQL,MDEwOlJlcG9zaXRvcnkxNDcwMjQ0NA==,2022-02-20T10:24:23Z
593,tidy-html5,422,2545,C,https://github.com/htacg/tidy-html5,"The granddaddy of HTML tools, with support for modern standards",MDEwOlJlcG9zaXRvcnkyNzkzNzg4,2023-02-25T08:48:09Z
594,io,295,2542,C,https://github.com/IoLanguage/io,"Io programming language. Inspired by Self, Smalltalk and LISP.",MDEwOlJlcG9zaXRvcnk5NjY=,2022-11-02T19:23:05Z
595,acl,917,2542,C,https://github.com/acl-dev/acl,"A powerful server and network library, including coroutine, redis client, http, websocket, mqtt with C/C++ for multi-platform.",MDEwOlJlcG9zaXRvcnk2MTExMjk3,2023-03-27T13:22:04Z
596,gnucash,691,2539,C,https://github.com/Gnucash/gnucash,GnuCash Double-Entry Accounting Program.,MDEwOlJlcG9zaXRvcnk3OTY2NjUw,2023-03-28T12:40:13Z
597,iotjs,455,2532,C,https://github.com/jerryscript-project/iotjs,Platform for Internet of Things with JavaScript http://www.iotjs.net ,MDEwOlJlcG9zaXRvcnkzMzU4OTQ3MA==,2021-06-18T10:15:48Z
598,amazon-freertos,1114,2527,C,https://github.com/aws/amazon-freertos,DEPRECATED - See README.md,MDEwOlJlcG9zaXRvcnkxMTAxNzA0Mzk=,2022-11-18T02:53:06Z
599,Collections-C,320,2524,C,https://github.com/srdja/Collections-C,A library of generic data structures.,MDEwOlJlcG9zaXRvcnkyMzA0MTk0OA==,2022-12-28T08:48:42Z
600,ostep-code,1111,2519,C,https://github.com/remzi-arpacidusseau/ostep-code,Code from various chapters in OSTEP (http://www.ostep.org),MDEwOlJlcG9zaXRvcnkxMjI5OTMxODY=,2023-02-23T00:59:57Z
601,sysstat,408,2519,C,https://github.com/sysstat/sysstat,Performance monitoring tools for Linux,MDEwOlJlcG9zaXRvcnk5NjcwMTk4,2023-03-11T17:24:59Z
602,frr,1024,2517,C,https://github.com/FRRouting/frr,The FRRouting Protocol Suite,MDEwOlJlcG9zaXRvcnk3NjU5OTQzOQ==,2023-03-28T13:05:15Z
603,minix,840,2508,C,https://github.com/Stichting-MINIX-Research-Foundation/minix,Official MINIX sources - Automatically replicated from gerrit.minix3.org,MDEwOlJlcG9zaXRvcnkyNDc1MTE0Nw==,2023-02-06T16:17:33Z
604,webgl-noise,273,2503,C,https://github.com/ashima/webgl-noise,Procedural Noise Shader Routines compatible with WebGL,MDEwOlJlcG9zaXRvcnkxNDAwMTI1,2021-06-30T14:10:31Z
605,lightning,819,2503,C,https://github.com/ElementsProject/lightning,Core Lightning — Lightning Network implementation focusing on spec compliance and performance,MDEwOlJlcG9zaXRvcnkzNzM1MDQ3Mg==,2023-03-27T04:08:10Z
606,ffmpeg-kit,352,2503,C,https://github.com/arthenica/ffmpeg-kit,"FFmpeg Kit for applications. Supports Android, Flutter, iOS, Linux, macOS, React Native and tvOS. Supersedes MobileFFmpeg, flutter_ffmpeg and react-native-ffmpeg.",MDEwOlJlcG9zaXRvcnkyODMxNDk2MzU=,2023-03-14T03:33:40Z
607,proxmark3,782,2499,C,https://github.com/RfidResearchGroup/proxmark3,"The Iceman fork of Proxmark3 / RFID / NFC  reader, writer, sniffer and emulator ",MDEwOlJlcG9zaXRvcnkxNDQ0NjUzNzI=,2023-03-26T18:29:13Z
608,word2vec,627,2494,C,https://github.com/danielfrg/word2vec,Python interface to Google word2vec,MDEwOlJlcG9zaXRvcnkxMjM2NjE5NQ==,2022-11-03T15:19:47Z
609,cleanflight,1383,2486,C,https://github.com/cleanflight/cleanflight,Clean-code version of the baseflight flight controller firmware,MDEwOlJlcG9zaXRvcnk5MDY2MzQ3,2021-01-16T11:46:32Z
610,npcap,478,2483,C,https://github.com/nmap/npcap,Nmap Project's Windows packet capture and transmission library,MDEwOlJlcG9zaXRvcnkzNTg1NTM1Nw==,2023-03-23T22:17:33Z
611,Kernelhub,637,2482,C,https://github.com/Ascotbe/Kernelhub,":palm_tree:Linux、macOS、Windows Kernel privilege escalation vulnerability collection, with compilation environment, demo GIF map, vulnerability details, executable file  (提权漏洞合集) ",MDEwOlJlcG9zaXRvcnkyODYxNzU0Njc=,2023-02-15T06:44:14Z
612,Remotery,230,2476,C,https://github.com/Celtoys/Remotery,"Single C file, Realtime CPU/GPU Profiler with Remote Web Viewer",MDEwOlJlcG9zaXRvcnkxNzY2NDM4MQ==,2023-01-03T22:18:42Z
613,HomeKitADK,237,2464,C,https://github.com/apple/HomeKitADK,,MDEwOlJlcG9zaXRvcnkyMjc0MjQ0OTU=,2022-07-06T20:08:37Z
614,exploits,710,2464,C,https://github.com/r4j0x00/exploits,,MDEwOlJlcG9zaXRvcnkyOTA1NjgxNTU=,2023-01-02T20:21:58Z
615,media-server,958,2455,C,https://github.com/ireader/media-server,RTSP/RTP/RTMP/FLV/HLS/MPEG-TS/MPEG-PS/MPEG-DASH/MP4/fMP4/MKV/WebM,MDEwOlJlcG9zaXRvcnkxNTU5ODQ5Ng==,2023-03-26T14:33:37Z
616,luna,162,2448,C,https://github.com/tj/luna,"luna programming language - a small, elegant VM implemented in C",MDEwOlJlcG9zaXRvcnkxODQwNDE3,2018-01-11T15:59:00Z
617,packr,171,2445,C,https://github.com/libgdx/packr,"Packages your JAR, assets and a JVM for distribution on Windows, Linux and Mac OS X",MDEwOlJlcG9zaXRvcnkxODE4ODQyMA==,2023-01-12T03:30:49Z
618,WebBench,1149,2444,C,https://github.com/EZLippi/WebBench,Webbench是Radim Kolar在1997年写的一个在linux下使用的非常简单的网站压测工具。它使用fork()模拟多个客户端同时访问我们设定的URL，测试网站在压力下工作的性能，最多可以模拟3万个并发连接去测试网站的负载能力。官网地址:http://home.tiscali.cz/~cz210552/webbench.html,MDEwOlJlcG9zaXRvcnkzMzg0ODI1OA==,2021-06-19T07:25:49Z
619,axel,243,2442,C,https://github.com/axel-download-accelerator/axel,Lightweight CLI download accelerator,MDEwOlJlcG9zaXRvcnk0MDY2MjkzNw==,2023-02-15T20:08:26Z
620,mpc,281,2437,C,https://github.com/orangeduck/mpc,A Parser Combinator library for C,MDEwOlJlcG9zaXRvcnkxMzEyMjg2OA==,2023-01-10T02:41:58Z
621,MemoryModule,724,2431,C,https://github.com/fancycode/MemoryModule,Library to load a DLL from memory.,MDEwOlJlcG9zaXRvcnkxMDE4NTIy,2022-08-24T14:59:07Z
622,wine,927,2431,C,https://github.com/wine-mirror/wine,,MDEwOlJlcG9zaXRvcnkyMjcxMTgwMg==,2023-01-01T06:31:07Z
623,sxhkd,130,2427,C,https://github.com/baskerville/sxhkd,Simple X hotkey daemon,MDEwOlJlcG9zaXRvcnk3Mzg2Mzg5,2023-01-16T23:26:50Z
624,xdotool,280,2424,C,https://github.com/jordansissel/xdotool,"fake keyboard/mouse input, window management, and more ",MDEwOlJlcG9zaXRvcnkxMzcyMjU0,2023-03-14T05:30:19Z
625,surge,327,2423,C,https://github.com/surge-synthesizer/surge,Synthesizer plug-in (previously released as Vember Audio Surge),MDEwOlJlcG9zaXRvcnkxNDk2NzgyMDI=,2023-03-21T16:10:54Z
626,shairport,1092,2418,C,https://github.com/abrasive/shairport,Airtunes emulator! Shairport is no longer maintained.,MDEwOlJlcG9zaXRvcnkxNTk3NzEx,2022-01-14T19:51:45Z
628,nginx-http-flv-module,535,2415,C,https://github.com/winshining/nginx-http-flv-module,"A media streaming server based on nginx-rtmp-module. In addtion to the features nginx-rtmp-module provides, HTTP-FLV, GOP cache and VHost (one IP for multi domain names) are supported now.",MDEwOlJlcG9zaXRvcnk5NTM0ODkzNw==,2023-03-27T14:35:30Z
627,RMStore,458,2415,C,https://github.com/robotmedia/RMStore,A lightweight iOS library for In-App Purchases,MDEwOlJlcG9zaXRvcnkxMTc2NjY5NQ==,2019-06-23T17:58:41Z
629,goxel,208,2414,C,https://github.com/guillaumechereau/goxel,Goxel: Free and Open Source 3D Voxel Editor ,MDEwOlJlcG9zaXRvcnk0MzY1OTQ3NQ==,2023-03-27T03:25:46Z
630,guacamole-server,538,2412,C,https://github.com/apache/guacamole-server,Mirror of Apache Guacamole Server,MDEwOlJlcG9zaXRvcnk1NDQ1MjYyNw==,2023-03-23T22:01:46Z
631,yyjson,222,2408,C,https://github.com/ibireme/yyjson,The fastest C JSON library,MDEwOlJlcG9zaXRvcnkzMDIyOTgwOTU=,2023-03-24T17:18:10Z
632,raspi3-tutorial,312,2408,C,https://github.com/bztsrc/raspi3-tutorial,Bare metal Raspberry Pi 3 tutorials,MDEwOlJlcG9zaXRvcnkxMTYyODg3OTE=,2023-03-23T05:15:13Z
633,tsar,734,2407,C,https://github.com/alibaba/tsar,Taobao System Activity Reporter,MDEwOlJlcG9zaXRvcnk3NjQyNTY5,2022-02-18T02:38:28Z
634,blackmagic,657,2402,C,https://github.com/blackmagic-debug/blackmagic,In application debugger for ARM Cortex microcontrollers.,MDEwOlJlcG9zaXRvcnkxMzM1Njgw,2023-03-28T12:13:26Z
635,PF_RING,334,2396,C,https://github.com/ntop/PF_RING,High-speed packet processing framework,MDEwOlJlcG9zaXRvcnkzNTA0MDA5Ng==,2023-03-24T15:12:04Z
636,bdwgc,348,2392,C,https://github.com/ivmai/bdwgc,"The Boehm-Demers-Weiser conservative C/C++ Garbage Collector (bdwgc, also known as bdw-gc, boehm-gc, libgc)",MDEwOlJlcG9zaXRvcnkyMTA5NDU2,2023-03-24T21:16:13Z
637,httrack,533,2391,C,https://github.com/xroche/httrack,"HTTrack Website Copier, copy websites to your computer (Official repository)",MDEwOlJlcG9zaXRvcnkzMjIwMjE2NQ==,2023-01-21T13:46:44Z
638,ZBar,1040,2385,C,https://github.com/ZBar/ZBar,Clone of the mercurial repository http://zbar.hg.sourceforge.net:8000/hgroot/zbar/zbar,MDEwOlJlcG9zaXRvcnk1OTE0OTMz,2023-01-24T18:17:15Z
639,mongoose-os,435,2372,C,https://github.com/cesanta/mongoose-os,"Mongoose OS - an IoT Firmware Development Framework. Supported microcontrollers: ESP32, ESP8266, CC3220, CC3200, STM32F4, STM32L4, STM32F7. Amazon AWS IoT, Microsoft Azure, Google IoT Core integrated. Code in C or JavaScript.",MDEwOlJlcG9zaXRvcnkyMTMxODI2OA==,2023-02-23T14:21:57Z
640,tvheadend,876,2364,C,https://github.com/tvheadend/tvheadend,"Tvheadend is a TV streaming server for Linux supporting DVB-S, DVB-S2, DVB-C, DVB-T, ATSC, IPTV,SAT>IP and other formats through the unix pipe as input sources.",MDEwOlJlcG9zaXRvcnkxMjA4MzYw,2023-03-25T02:32:42Z
641,ShiYanLou,719,2363,C,https://github.com/Ewenwan/ShiYanLou,学习C & C++ & python&汇编语言 LLVM编译器 数据结构 算法 操作系统 单片机  linux  面试,MDEwOlJlcG9zaXRvcnkxMTA1NTkwOTk=,2021-02-15T03:31:53Z
643,Arduino_STM32,1211,2362,C,https://github.com/rogerclarkmelbourne/Arduino_STM32,"Arduino STM32. Hardware files to support STM32 boards, on Arduino IDE 1.8.x including LeafLabs Maple and other generic STM32F103 boards",MDEwOlJlcG9zaXRvcnkyNTk0NzE3NQ==,2023-02-14T01:30:06Z
642,u2f-zero,202,2362,C,https://github.com/conorpp/u2f-zero,"U2F USB token optimized for physical security, affordability, and style",MDEwOlJlcG9zaXRvcnk0ODgzNDA2Mw==,2022-09-01T01:17:44Z
644,uftrace,354,2349,C,https://github.com/namhyung/uftrace,Function graph tracer for C/C++/Rust,MDEwOlJlcG9zaXRvcnkxNjcyNzc0OQ==,2023-03-28T13:11:43Z
645,spdk,964,2349,C,https://github.com/spdk/spdk,Storage Performance Development Kit,MDEwOlJlcG9zaXRvcnkzOTA0MjE1Nw==,2023-03-28T10:21:12Z
646,lwip,230,2347,C,https://github.com/EyalAr/lwip,Light Weight Image Processor for NodeJS,MDEwOlJlcG9zaXRvcnkyMTMwNjIxMw==,2022-04-19T23:34:20Z
647,dpdk,1010,2347,C,https://github.com/DPDK/dpdk,Data Plane Development Kit,MDEwOlJlcG9zaXRvcnk5NjM0ODg0Mg==,2023-03-28T03:28:53Z
648,tmux-MacOSX-pasteboard,83,2339,C,https://github.com/ChrisJohnsen/tmux-MacOSX-pasteboard,Notes and workarounds for accessing the Mac OS X pasteboard in tmux sessions. Note: The pu branch (“Proposed Updates”) may be rewound without notice.,MDEwOlJlcG9zaXRvcnkxNTI4NjM5,2020-10-10T04:22:59Z
649,permafrost-engine,82,2336,C,https://github.com/eduard-permyakov/permafrost-engine,An OpenGL RTS game engine written in C,MDEwOlJlcG9zaXRvcnkxMTU4MTc4NzM=,2021-05-13T09:07:02Z
650,inav,1228,2336,C,https://github.com/iNavFlight/inav,INAV: Navigation-enabled flight control software,MDEwOlJlcG9zaXRvcnkzMjE0ODYwNA==,2023-03-28T13:12:48Z
651,sl4a,820,2325,C,https://github.com/damonkohler/sl4a,SL4A brings scripting languages to Android by allowing you to edit and execute scripts and interactive interpreters directly on the Android device.,MDEwOlJlcG9zaXRvcnkxMzE0NzM1Mw==,2022-06-15T13:36:20Z
652,vifm,105,2324,C,https://github.com/vifm/vifm,"Vifm is a file manager with curses interface, which provides Vim-like environment for managing objects within file systems, extended with some useful ideas from mutt.",MDEwOlJlcG9zaXRvcnkxMTIxNzk=,2023-03-28T12:45:40Z
653,fsearch,187,2322,C,https://github.com/cboxdoerfer/fsearch,A fast file search utility for Unix-like systems based on GTK3,MDEwOlJlcG9zaXRvcnk0OTgyMjYxMA==,2023-03-26T12:55:12Z
654,simple-obfs,572,2318,C,https://github.com/shadowsocks/simple-obfs,A simple obfuscating tool (Deprecated),MDEwOlJlcG9zaXRvcnk3NzczOTE2Mg==,2022-11-05T06:26:58Z
655,chia-plotter,676,2316,C,https://github.com/madMAx43v3r/chia-plotter,,MDEwOlJlcG9zaXRvcnkzNjk4NTIwODc=,2022-11-10T23:53:04Z
656,fftw3,596,2315,C,https://github.com/FFTW/fftw3,DO NOT CHECK OUT THESE FILES FROM GITHUB UNLESS YOU KNOW WHAT YOU ARE DOING. (See below.),MDEwOlJlcG9zaXRvcnk4ODQzMzg4,2023-03-22T19:38:09Z
657,civetweb,884,2312,C,https://github.com/civetweb/civetweb,Embedded C/C++ web server,MDEwOlJlcG9zaXRvcnkxMzM1Mjk0OQ==,2023-03-15T07:52:28Z
658,annotated_redis_source,1059,2312,C,https://github.com/huangz1990/annotated_redis_source,带有详细注释的 Redis 2.6 源码,MDEwOlJlcG9zaXRvcnk4NTc0ODk4,2020-01-01T10:05:33Z
659,libsql,57,2311,C,https://github.com/libsql/libsql,"libSQL is a fork of SQLite that is both Open Source, and Open Contributions.",R_kgDOIGG8zg,2023-03-28T09:22:02Z
660,enet,606,2308,C,https://github.com/lsalzman/enet,ENet reliable UDP networking library ,MDEwOlJlcG9zaXRvcnk0MjMzMjk5,2023-03-21T13:24:33Z
661,julius,250,2303,C,https://github.com/bvschaik/julius,An open source re-implementation of Caesar III,MDEwOlJlcG9zaXRvcnkxMDA4MjA1NTU=,2023-03-23T18:04:42Z
662,pigz,158,2303,C,https://github.com/madler/pigz,"A parallel implementation of gzip for modern multi-processor, multi-core machines.",MDEwOlJlcG9zaXRvcnk2MDMyODY=,2023-01-01T05:31:32Z
663,ExpressLRS,453,2302,C,https://github.com/ExpressLRS/ExpressLRS,STM32/ESP32/ESP8285-based High-Performance Radio Link for RC applications,MDEwOlJlcG9zaXRvcnkxNTEwNjQ0Mzk=,2023-03-28T06:05:21Z
664,swift-corelibs-libdispatch,445,2301,C,https://github.com/apple/swift-corelibs-libdispatch,"The libdispatch Project, (a.k.a. Grand Central Dispatch), for concurrency on multicore hardware",MDEwOlJlcG9zaXRvcnk0NTg2Mzk2NQ==,2023-03-28T10:00:58Z
665,pycryptodome,430,2300,C,https://github.com/Legrandin/pycryptodome,A self-contained cryptographic library for Python,MDEwOlJlcG9zaXRvcnkxOTM3ODkzNQ==,2023-03-16T14:47:26Z
666,Goldleaf,281,2297,C,https://github.com/XorTroll/Goldleaf,🍂 Multipurpose homebrew tool for Nintendo Switch,MDEwOlJlcG9zaXRvcnkxMzkwODg3MzY=,2023-03-26T22:08:07Z
667,SketchyBar,41,2296,C,https://github.com/FelixKratz/SketchyBar,A highly customizable macOS status bar replacement,MDEwOlJlcG9zaXRvcnkzOTU2ODQwMTU=,2023-03-26T21:45:21Z
668,NetHack,409,2292,C,https://github.com/NetHack/NetHack,Official NetHack Git Repository,MDEwOlJlcG9zaXRvcnk0NzU5MzU0Ng==,2023-03-28T04:37:16Z
669,CreepyCodeCollection,139,2290,C,https://github.com/MinhasKamal/CreepyCodeCollection,A Nonsense Collection of Disgusting Codes,MDEwOlJlcG9zaXRvcnk2Njc1ODQxMA==,2022-07-04T03:27:49Z
670,Quake-2,597,2288,C,https://github.com/id-Software/Quake-2,Quake 2 GPL Source Release,MDEwOlJlcG9zaXRvcnkzMzE4MTc0,2022-05-27T19:12:53Z
671,OpenSimpleLidar,223,2284,C,https://github.com/iliasam/OpenSimpleLidar,Open Source scanning laser rangefinder,MDEwOlJlcG9zaXRvcnk4NjQ5ODAxMw==,2023-03-27T10:24:12Z
672,rawdrawandroid,156,2278,C,https://github.com/cnlohr/rawdrawandroid,"Build android apps without any java, entirely in C and Make",MDEwOlJlcG9zaXRvcnkyMTIwMTI0NDA=,2023-02-08T20:13:45Z
673,openssh-portable,1543,2274,C,https://github.com/openssh/openssh-portable,Portable OpenSSH,MDEwOlJlcG9zaXRvcnkxNTk5MTQ1Nw==,2023-03-28T08:04:56Z
675,hidapi,893,2272,C,https://github.com/signal11/hidapi,"A Simple library for communicating with USB and Bluetooth HID devices on Linux, Mac, and Windows.",MDEwOlJlcG9zaXRvcnk2MDU0NTk=,2022-08-06T10:09:55Z
674,pico-sdk,566,2272,C,https://github.com/raspberrypi/pico-sdk,,MDEwOlJlcG9zaXRvcnkzMzEzODA3MjM=,2023-03-28T11:36:07Z
676,libfaketime,285,2269,C,https://github.com/wolfcw/libfaketime,libfaketime modifies the system time for a single application,MDEwOlJlcG9zaXRvcnkxNjU3MjE1,2023-02-25T11:58:03Z
677,netcode,178,2264,C,https://github.com/networkprotocol/netcode,A protocol for secure client/server connections over UDP,MDEwOlJlcG9zaXRvcnk3NzY0NTc0Nw==,2023-03-21T03:45:03Z
678,sniproxy,380,2262,C,https://github.com/dlundquist/sniproxy,Proxies incoming HTTP and TLS connections based on the hostname contained in the initial request of the TCP session.,MDEwOlJlcG9zaXRvcnkxMTgzNzA4,2023-03-17T05:13:30Z
679,rosenbridge,224,2259,C,https://github.com/xoreaxeaxeax/rosenbridge,Hardware backdoors in some x86 CPUs,MDEwOlJlcG9zaXRvcnkxNDQwOTg2OTY=,2018-10-12T09:22:06Z
680,wireguard-monolithic-historical,309,2256,C,https://github.com/WireGuard/wireguard-monolithic-historical,"Historical monolithic WireGuard repository, split into wireguard-tools, wireguard-linux, and wireguard-linux-compat.",MDEwOlJlcG9zaXRvcnk4MjAwMzA4MA==,2019-12-27T09:51:53Z
681,glew,541,2254,C,https://github.com/nigels-com/glew,The OpenGL Extension Wrangler Library,MDEwOlJlcG9zaXRvcnk4ODcwMDMx,2023-03-23T13:54:55Z
682,PongoOS,355,2254,C,https://github.com/checkra1n/PongoOS,pongoOS,MDEwOlJlcG9zaXRvcnkyMzg1Mzk1NjI=,2023-03-25T08:06:45Z
683,earlyoom,132,2252,C,https://github.com/rfjakob/earlyoom,earlyoom - Early OOM Daemon for Linux,MDEwOlJlcG9zaXRvcnkxNTg1MDc4NA==,2023-03-19T15:49:07Z
684,jsmpeg-vnc,386,2252,C,https://github.com/phoboslab/jsmpeg-vnc,"A low latency, high framerate screen sharing server for Windows and client for browsers",MDEwOlJlcG9zaXRvcnkzOTc3MTU5Ng==,2022-04-21T19:45:27Z
685,OSCPRepo,731,2250,C,https://github.com/rewardone/OSCPRepo,"A list of commands, scripts, resources, and more that I have gathered and attempted to consolidate for use as OSCP (and more) study material. Commands in 'Usefulcommands' Keepnote. Bookmarks and reading material in 'BookmarkList' CherryTree. Reconscan Py2 and Py3. Custom ISO building.",MDEwOlJlcG9zaXRvcnkxMTA0MzY1OTY=,2020-06-22T14:42:08Z
686,tcpkali,202,2247,C,https://github.com/satori-com/tcpkali,Fast multi-core TCP and WebSockets load generator.,MDEwOlJlcG9zaXRvcnkyNDcwMTI3MQ==,2021-06-02T17:41:59Z
687,freeswitch,1076,2246,C,https://github.com/signalwire/freeswitch,"FreeSWITCH is a Software Defined Telecom Stack enabling the digital transformation from proprietary telecom switches to a versatile software implementation that runs on any commodity hardware. From a Raspberry PI to a multi-core server, FreeSWITCH can unlock the telecommunications potential of any device.",MDEwOlJlcG9zaXRvcnkxNTQ1MjUxMTE=,2023-03-28T11:55:44Z
688,sleuthkit,575,2244,C,https://github.com/sleuthkit/sleuthkit,The Sleuth Kit® (TSK) is a library and collection of command line digital forensics tools that allow you to investigate volume and file system data. The library can be incorporated into larger digital forensics tools and the command line tools can be directly used to find evidence. ,MDEwOlJlcG9zaXRvcnkyNTYyODcz,2023-03-25T11:02:20Z
689,glb-director,233,2243,C,https://github.com/github/glb-director,GitHub Load Balancer Director and supporting tooling.,MDEwOlJlcG9zaXRvcnkxMzM3NjAzMDA=,2023-02-25T01:42:11Z
690,dynamorio,497,2237,C,https://github.com/DynamoRIO/dynamorio,Dynamic Instrumentation Tool Platform,MDEwOlJlcG9zaXRvcnkyNzI0MjkzNQ==,2023-03-28T13:08:24Z
691,level-ip,336,2230,C,https://github.com/saminiir/level-ip,A hacker's userspace TCP/IP stack,MDEwOlJlcG9zaXRvcnk1MjYxMjYxNQ==,2022-12-13T13:14:33Z
692,coroutine,672,2229,C,https://github.com/cloudwu/coroutine,A asymmetric coroutine library for C.,MDEwOlJlcG9zaXRvcnk1MTUyMDE5,2022-12-16T09:23:01Z
