rank,item,repo_name,stars,forks,language,repo_url,username,issues,last_commit,description
561,CPP,DataStructures-Algorithms,2490,982,C++,https://github.com/rachitiitr/DataStructures-Algorithms,rachitiitr,1,2023-01-06T18:29:56Z,The best library for implementation of all Data Structures and Algorithms - Trees + Graph Algorithms too!
562,CPP,SpaceCadetPinball,2487,167,C++,https://github.com/k4zmu2a/SpaceCadetPinball,k4zmu2a,35,2023-03-26T11:35:35Z,Decompilation of 3D Pinball for Windows – Space Cadet
563,CPP,openMVS,2486,797,C++,https://github.com/cdcseacave/openMVS,cdcseacave,229,2023-03-26T13:56:40Z,open Multi-View Stereo reconstruction library
564,CPP,mailcore2,2485,604,C++,https://github.com/MailCore/mailcore2,MailCore,191,2023-02-13T11:47:32Z,"MailCore 2 provide a simple and asynchronous API to work with e-mail protocols IMAP, POP and SMTP. The API has been redesigned from ground up."
565,CPP,FreeReflection,2480,481,C++,https://github.com/tiann/FreeReflection,tiann,14,2021-07-24T06:20:33Z,A library that lets you use reflection without any restriction above Android P
566,CPP,cpp-cheatsheet,2480,638,C++,https://github.com/mortennobel/cpp-cheatsheet,mortennobel,6,2022-10-13T20:01:23Z,Modern C++ Cheatsheet
567,CPP,ogl,2470,909,C++,https://github.com/opengl-tutorials/ogl,opengl-tutorials,24,2023-03-14T21:36:18Z,
568,CPP,mcsema,2466,342,C++,https://github.com/lifting-bits/mcsema,lifting-bits,112,2022-04-26T13:43:28Z,"Framework for lifting x86, amd64, aarch64, sparc32, and sparc64 program binaries to LLVM bitcode"
569,CPP,phxsql,2463,584,C++,https://github.com/Tencent/phxsql,Tencent,46,2018-12-25T10:38:56Z,A high availability MySQL cluster that guarantees data consistency between a master and slaves.
570,CPP,TypeRunner,2454,33,C++,https://github.com/marcj/TypeRunner,marcj,3,2022-11-03T10:33:20Z,High-performance TypeScript compiler
571,CPP,deepdetect,2447,557,C++,https://github.com/jolibrain/deepdetect,jolibrain,80,2023-03-24T08:03:52Z,"Deep Learning API and Server in C++14 support for Caffe, PyTorch,TensorRT, Dlib, NCNN, Tensorflow, XGBoost and TSNE"
572,CPP,phpdesktop,2447,541,C++,https://github.com/cztomczak/phpdesktop,cztomczak,90,2022-09-02T10:48:45Z,"Develop desktop GUI applications using PHP, HTML5, JavaScript and SQLite"
573,CPP,B23Downloader,2441,324,C++,https://github.com/vooidzero/B23Downloader,vooidzero,39,2022-08-03T14:58:59Z,（已长久停更）
574,CPP,SDRPlusPlus,2436,346,C++,https://github.com/AlexandreRouma/SDRPlusPlus,AlexandreRouma,43,2023-03-26T23:50:57Z,Cross-Platform SDR Software
575,CPP,fbthrift,2431,602,C++,https://github.com/facebook/fbthrift,facebook,43,2023-03-27T07:02:13Z,"Facebook's branch of Apache Thrift, including a new C++ server."
576,CPP,biosim4,2429,360,C++,https://github.com/davidrmiller/biosim4,davidrmiller,28,2022-11-22T18:11:44Z,Biological evolution simulator
577,CPP,SimpleKernel,2429,352,C++,https://github.com/Simple-XX/SimpleKernel,Simple-XX,2,2023-02-19T04:11:42Z,Simple kernel for learning operating systems. 用于学习操作系统的简单内核
578,CPP,valhalla,2428,504,C++,https://github.com/valhalla/valhalla,valhalla,564,2023-03-27T10:24:25Z,Open Source Routing Engine for OpenStreetMap
579,CPP,gqrx,2425,482,C++,https://github.com/gqrx-sdr/gqrx,gqrx-sdr,182,2023-03-26T12:17:04Z,Software defined radio receiver powered by GNU Radio and Qt.
580,CPP,json11,2424,619,C++,https://github.com/dropbox/json11,dropbox,12,2020-03-25T23:27:28Z,A tiny JSON library for C++11.
581,CPP,lsd_slam,2411,1229,C++,https://github.com/tum-vision/lsd_slam,tum-vision,228,2023-03-23T14:55:27Z,LSD-SLAM
582,CPP,MarbleMarcher,2411,161,C++,https://github.com/HackerPoet/MarbleMarcher,HackerPoet,23,2021-06-13T22:19:41Z,A Fractal Physics Game
583,CPP,logiops,2408,227,C++,https://github.com/PixlOne/logiops,PixlOne,162,2023-03-15T14:15:32Z,An unofficial userspace driver for HID++ Logitech devices
584,CPP,ComputeLibrary,2407,731,C++,https://github.com/ARM-software/ComputeLibrary,ARM-software,17,2023-03-17T16:09:00Z,The Compute Library is a set of computer vision and machine learning functions optimised for both Arm CPUs and GPUs using SIMD technologies.
585,CPP,bustub,2406,1303,C++,https://github.com/cmu-db/bustub,cmu-db,18,2023-03-27T10:38:12Z,The BusTub Relational Database Management System (Educational)
586,CPP,pe-sieve,2403,375,C++,https://github.com/hasherezade/pe-sieve,hasherezade,8,2023-01-29T18:13:55Z,"Scans a given process. Recognizes and dumps a variety of potentially malicious implants (replaced/injected PEs, shellcodes, hooks, in-memory patches)."
587,CPP,indicators,2393,192,C++,https://github.com/p-ranav/indicators,p-ranav,21,2023-03-10T23:19:26Z,Activity Indicators for Modern C++
588,CPP,course,2392,354,C++,https://github.com/parallel101/course,parallel101,7,2023-03-20T04:33:58Z,高性能并行编程与优化 - 课件
589,CPP,subsurface,2392,476,C++,https://github.com/subsurface/subsurface,subsurface,195,2023-03-26T16:48:03Z,This is the official upstream of the Subsurface divelog program
590,CPP,Cpp_Primer_Answers,2382,787,C++,https://github.com/huangmingchuan/Cpp_Primer_Answers,huangmingchuan,43,2022-01-23T11:16:42Z,《C++ Primer》第五版中文版习题答案
591,CPP,notepad--,2379,89,C++,https://github.com/cxasm/notepad--,cxasm,84,2023-03-26T06:40:58Z,一个支持windows/linux/mac的文本编辑器，目标是要替换notepad++，来自中国。
592,CPP,WAVM,2379,215,C++,https://github.com/WAVM/WAVM,WAVM,65,2023-02-28T04:09:09Z,WebAssembly Virtual Machine
593,CPP,Simple-Web-Server,2377,734,C++,https://github.com/eidheim/Simple-Web-Server,eidheim,42,2018-06-12T09:22:10Z,"A very simple, fast, multithreaded, platform independent HTTP and HTTPS server and client library implemented using C++11 and Boost.Asio. Created to be an easy way to make REST resources available from C++ applications."
594,CPP,apitrace,2369,459,C++,https://github.com/apitrace/apitrace,apitrace,128,2023-03-14T19:12:22Z,"Tools for tracing OpenGL, Direct3D, and other graphics APIs"
595,CPP,ActionRoguelike,2367,481,C++,https://github.com/tomlooman/ActionRoguelike,tomlooman,2,2023-03-10T16:51:07Z,Third-person Action Roguelike made in Unreal Engine C++. Project for Unreal Engine Pro C++ Course & Stanford University (CS193U)
596,CPP,Polycode,2367,349,C++,https://github.com/ivansafrin/Polycode,ivansafrin,184,2018-09-13T13:42:07Z,Polycode is a cross-platform framework for creative code.
597,CPP,heaptrack,2363,155,C++,https://github.com/KDE/heaptrack,KDE,0,2023-03-12T06:37:08Z,A heap memory profiler for Linux
598,CPP,osxcross,2359,274,C++,https://github.com/tpoechtrager/osxcross,tpoechtrager,93,2023-03-02T22:59:16Z,"Mac OS X cross toolchain for Linux, FreeBSD, OpenBSD and Android (Termux)"
599,CPP,picotorrent,2355,171,C++,https://github.com/picotorrent/picotorrent,picotorrent,171,2022-10-04T21:06:03Z,"A tiny, hackable BitTorrent client."
600,CPP,bolt,2352,164,C++,https://github.com/dblalock/bolt,dblalock,17,2022-10-12T21:47:45Z,10x faster matrix and vector operations
601,CPP,telegram-bot-api,2054,396,C++,https://github.com/tdlib/telegram-bot-api,tdlib,15,2023-03-27T09:55:00Z,Telegram Bot API server 
602,CPP,kactl,2053,557,C++,https://github.com/kth-competitive-programming/kactl,kth-competitive-programming,44,2023-03-24T04:42:56Z,KTH Algorithm Competition Template Library (... eller KTHs AC-tillverkande lapp)
603,CPP,ViGEmBus,2051,212,C++,https://github.com/ViGEm/ViGEmBus,ViGEm,9,2023-02-13T11:18:56Z,Windows kernel-mode driver emulating well-known USB game controllers.
604,CPP,entityx,2049,287,C++,https://github.com/alecthomas/entityx,alecthomas,16,2022-02-04T11:00:21Z,"EntityX - A fast, type-safe C++ Entity-Component system"
605,CPP,pdqsort,2047,96,C++,https://github.com/orlp/pdqsort,orlp,4,2022-10-30T06:33:51Z,Pattern-defeating quicksort.
606,CPP,pcm,2045,391,C++,https://github.com/intel/pcm,intel,25,2023-03-20T13:11:57Z,Intel® Performance Counter Monitor (Intel® PCM)
607,CPP,AntSimulator,2044,262,C++,https://github.com/johnBuffer/AntSimulator,johnBuffer,17,2023-01-19T00:33:05Z,Simple Ants simulator
608,CPP,socket.io-client-cpp,2043,697,C++,https://github.com/socketio/socket.io-client-cpp,socketio,133,2023-02-24T13:29:02Z,C++11 implementation of Socket.IO client
609,CPP,tair,2038,621,C++,https://github.com/alibaba/tair,alibaba,4,2019-11-19T03:53:09Z,A distributed key-value storage system developed by Alibaba Group
610,CPP,obs-multi-rtmp,2035,356,C++,https://github.com/sorayuki/obs-multi-rtmp,sorayuki,102,2023-03-04T10:20:46Z,OBS ≧ 26.1用複数サイト同時配信プラグイン
611,CPP,sciter-sdk,2033,221,C++,https://github.com/c-smile/sciter-sdk,c-smile,53,2023-01-18T03:27:07Z,Sciter is an embeddable HTML/CSS/scripting engine
612,CPP,bgslibrary,2029,732,C++,https://github.com/andrewssobral/bgslibrary,andrewssobral,84,2023-03-05T18:41:20Z,"A C++ Background Subtraction Library with wrappers for Python, MATLAB, Java and GUI on QT"
613,CPP,griddb,2027,4689,C++,https://github.com/griddb/griddb,griddb,35,2023-03-16T02:32:36Z,"GridDB is a next-generation open source database that makes time series IoT and big data fast,and easy."
614,CPP,dso,2027,867,C++,https://github.com/JakobEngel/dso,JakobEngel,112,2023-03-16T18:29:43Z,Direct Sparse Odometry
615,CPP,snap,2024,795,C++,https://github.com/snap-stanford/snap,snap-stanford,76,2023-02-28T01:22:54Z,Stanford Network Analysis Platform (SNAP) is a general purpose network analysis and graph mining library.
616,CPP,simbody,2021,463,C++,https://github.com/simbody/simbody,simbody,122,2023-03-24T23:49:24Z,"High-performance C++ multibody dynamics/physics library for simulating articulated biomechanical and mechanical systems like vehicles, robots, and the human skeleton."
617,CPP,SeetaFace2,2016,604,C++,https://github.com/seetafaceengine/SeetaFace2,seetafaceengine,34,2021-09-28T04:34:13Z,"SeetaFace 2: open source, full stack face recognization toolkit."
618,CPP,grid_map,2014,720,C++,https://github.com/ANYbotics/grid_map,ANYbotics,84,2023-03-25T06:57:35Z,Universal grid map library for mobile robotic mapping
619,CPP,antimony,2014,154,C++,https://github.com/mkeeter/antimony,mkeeter,67,2023-01-18T13:38:19Z,CAD from a parallel universe
620,CPP,fheroes2,2011,269,C++,https://github.com/ihhub/fheroes2,ihhub,420,2023-03-27T03:49:06Z,fheroes2 is a recreation of Heroes of Might and Magic II game engine.
621,CPP,appleseed,2007,318,C++,https://github.com/appleseedhq/appleseed,appleseedhq,421,2022-02-28T17:59:33Z,A modern open source rendering engine for animation and visual effects
622,CPP,StreetMap,2002,419,C++,https://github.com/ue4plugins/StreetMap,ue4plugins,8,2022-12-16T20:12:27Z,Import OpenStreetMap data into Unreal Engine 4
623,CPP,xcbuild,2000,196,C++,https://github.com/facebookarchive/xcbuild,facebookarchive,55,2020-01-09T06:28:30Z,Xcode-compatible build tool.
624,CPP,project64,1994,413,C++,https://github.com/project64/project64,project64,212,2023-03-21T00:20:16Z,N64 Emulator
625,CPP,SGI-STL,1994,706,C++,https://github.com/steveLauwh/SGI-STL,steveLauwh,5,2018-01-15T16:49:57Z,剖析 STL 是一种享受的过程！
626,CPP,RuntimeCompiledCPlusPlus,1985,224,C++,https://github.com/RuntimeCompiledCPlusPlus/RuntimeCompiledCPlusPlus,RuntimeCompiledCPlusPlus,9,2022-04-18T13:14:30Z,Change C++ code at runtime
627,CPP,embree,1978,352,C++,https://github.com/embree/embree,embree,38,2023-03-21T09:00:25Z,Embree ray tracing kernels repository.
628,CPP,peloton,1975,620,C++,https://github.com/cmu-db/peloton,cmu-db,159,2019-05-15T04:27:24Z,The Self-Driving Database Management System
629,CPP,mitsuba2,1973,265,C++,https://github.com/mitsuba-renderer/mitsuba2,mitsuba-renderer,98,2022-08-22T09:30:10Z,Mitsuba 2: A Retargetable Forward and Inverse Renderer
630,CPP,maim,1963,76,C++,https://github.com/naelstrof/maim,naelstrof,45,2023-02-25T19:14:58Z,"maim (make image) takes screenshots of your desktop. It has options to take only a region, and relies on slop to query for regions. maim is supposed to be an improved scrot."
631,CPP,Cxbx-Reloaded,1960,249,C++,https://github.com/Cxbx-Reloaded/Cxbx-Reloaded,Cxbx-Reloaded,208,2023-03-13T12:55:00Z,Xbox (Original) Emulator
632,CPP,spek,1958,240,C++,https://github.com/alexkay/spek,alexkay,85,2023-03-16T18:49:22Z,Acoustic spectrum analyser
633,CPP,tinyflow,1955,378,C++,https://github.com/tqchen/tinyflow,tqchen,2,2018-10-04T18:34:44Z,Tutorial code on how to build your own Deep Learning System in 2k Lines
634,CPP,kdenlive,1953,186,C++,https://github.com/KDE/kdenlive,KDE,0,2023-03-24T03:23:38Z,"Free and open source video editor, based on MLT Framework and KDE Frameworks 5"
635,CPP,keystone,1952,431,C++,https://github.com/keystone-engine/keystone,keystone-engine,190,2023-02-18T00:15:03Z,"Keystone assembler framework: Core (Arm, Arm64, Hexagon, Mips, PowerPC, Sparc, SystemZ & X86) + bindings"
636,CPP,Falcor,1950,376,C++,https://github.com/NVIDIAGameWorks/Falcor,NVIDIAGameWorks,11,2023-03-07T14:08:28Z,Real-Time Rendering Framework
637,CPP,oryol,1950,200,C++,https://github.com/floooh/oryol,floooh,48,2023-02-06T11:24:01Z,"A small, portable and extensible C++ 3D coding framework"
638,CPP,s2geometry,1949,270,C++,https://github.com/google/s2geometry,google,46,2023-01-13T12:01:58Z,Computational geometry and spatial indexing on the sphere
639,CPP,cp-notebook,1949,372,C++,https://github.com/bqi343/cp-notebook,bqi343,3,2023-02-20T16:27:42Z,General Resources for Competitive Programming
640,CPP,BehaviorTree.CPP,1947,484,C++,https://github.com/BehaviorTree/BehaviorTree.CPP,BehaviorTree,31,2023-03-26T12:55:51Z,Behavior Trees Library in C++. Batteries included.
641,CPP,steem,1945,807,C++,https://github.com/steemit/steem,steemit,346,2022-09-21T20:15:24Z,The blockchain for Smart Media Tokens (SMTs) and decentralized applications.
642,CPP,InfinityHook,1938,453,C++,https://github.com/everdox/InfinityHook,everdox,6,2019-07-25T18:11:49Z,"Hook system calls, context switches, page faults and more."
643,CPP,libfreenect2,1938,737,C++,https://github.com/OpenKinect/libfreenect2,OpenKinect,136,2022-08-20T14:10:42Z,Open source drivers for the Kinect for Windows v2 device
644,CPP,crawl,1937,1066,C++,https://github.com/crawl/crawl,crawl,191,2023-03-27T06:17:45Z,Dungeon Crawl: Stone Soup official repository
645,CPP,pbrt-v4,1937,239,C++,https://github.com/mmp/pbrt-v4,mmp,43,2023-03-21T12:56:30Z,"Source code to pbrt, the ray tracer described in the forthcoming 4th edition of the ""Physically Based Rendering: From Theory to Implementation"" book."
646,CPP,Kirikiroid2,1935,191,C++,https://github.com/zeas2/Kirikiroid2,zeas2,111,2021-10-09T23:53:32Z,
647,CPP,SourceCodeSyntaxHighlight,1935,49,C++,https://github.com/sbarex/SourceCodeSyntaxHighlight,sbarex,44,2023-02-19T16:56:43Z,Quick Look extension for highlight source code files on macOS 10.15 and later.
648,CPP,PacketSender,1934,322,C++,https://github.com/dannagle/PacketSender,dannagle,53,2023-03-19T18:33:14Z,"Network utility for sending / receiving TCP, UDP, SSL, HTTP"
649,CPP,ESP32Marauder,1934,217,C++,https://github.com/justcallmekoko/ESP32Marauder,justcallmekoko,37,2023-03-15T23:43:10Z,A suite of WiFi/Bluetooth offensive and defensive tools for the ESP32
650,CPP,flann,1931,629,C++,https://github.com/flann-lib/flann,flann-lib,217,2023-01-14T17:23:59Z,Fast Library for Approximate Nearest Neighbors
651,CPP,EternalTerminal,2571,154,C++,https://github.com/MisterTea/EternalTerminal,MisterTea,68,2023-03-24T03:24:45Z,Re-Connectable secure remote shell
652,CPP,libpag,2568,287,C++,https://github.com/Tencent/libpag,Tencent,6,2023-03-27T11:45:30Z,The official rendering library for PAG (Portable Animated Graphics) files that renders After Effects animations natively across multiple platforms.
653,CPP,xeus-cling,2566,266,C++,https://github.com/jupyter-xeus/xeus-cling,jupyter-xeus,143,2023-03-24T11:35:00Z,Jupyter kernel for the C++ programming language
654,CPP,librime,2566,472,C++,https://github.com/rime/librime,rime,102,2023-03-27T04:29:02Z,"Rime Input Method Engine, the core library"
655,CPP,drake,2565,1121,C++,https://github.com/RobotLocomotion/drake,RobotLocomotion,763,2023-03-27T05:28:42Z,Model-based design and verification for robotics.
656,CPP,yocto-gl,2562,189,C++,https://github.com/xelatihy/yocto-gl,xelatihy,7,2023-03-02T09:24:20Z,Yocto/GL: Tiny C++ Libraries for Data-Driven Physically-based Graphics
657,CPP,elements,2554,199,C++,https://github.com/cycfi/elements,cycfi,54,2023-01-01T14:11:01Z,Elements C++ GUI library
658,CPP,GASDocumentation,2546,544,C++,https://github.com/tranek/GASDocumentation,tranek,13,2023-03-19T02:21:19Z,My understanding of Unreal Engine 5's GameplayAbilitySystem plugin with a simple multiplayer sample project.
659,CPP,OTTO,2543,147,C++,https://github.com/bitfieldaudio/OTTO,bitfieldaudio,19,2023-01-23T08:31:10Z,"Sampler, Sequencer, Multi-engine synth and effects - in a box! [WIP]"
660,CPP,Tendis,2542,298,C++,https://github.com/Tencent/Tendis,Tencent,93,2022-10-17T06:09:38Z,Tendis is a high-performance distributed storage system fully compatible with the Redis protocol. 
661,CPP,terra,2542,192,C++,https://github.com/terralang/terra,terralang,101,2022-10-17T21:01:57Z,Terra is a low-level system programming language that is embedded in and meta-programmed by the Lua programming language.
662,CPP,Vulkan-Hpp,2539,279,C++,https://github.com/KhronosGroup/Vulkan-Hpp,KhronosGroup,10,2023-03-27T10:31:15Z,Open-Source Vulkan C++ API
663,CPP,FasterTransformer,2532,438,C++,https://github.com/NVIDIA/FasterTransformer,NVIDIA,94,2023-03-24T09:59:53Z,"Transformer related optimization, including BERT, GPT"
664,CPP,node-webrtc,2529,435,C++,https://github.com/node-webrtc/node-webrtc,node-webrtc,110,2022-11-22T03:49:21Z,node-webrtc is a Node.js Native Addon that provides bindings to WebRTC M87
665,CPP,Play-Leetcode,2526,681,C++,https://github.com/liuyubobobo/Play-Leetcode,liuyubobobo,1,2023-03-27T07:18:08Z,"My Solutions to Leetcode problems. All solutions support C++ language, some support Java and Python. Multiple solutions will be given by most problems. Enjoy:) 我的Leetcode解答。所有的问题都支持C++语言，一部分问题支持Java语言。近乎所有问题都会提供多个算法解决。大家加油！：）"
666,CPP,aoapc-bac2nd,2525,1025,C++,https://github.com/aoapc-book/aoapc-bac2nd,aoapc-book,42,2020-11-16T00:16:14Z,Source codes for book <<<BeginningAlgorithmContests>> Second edition
667,CPP,DirectXShaderCompiler,2517,582,C++,https://github.com/microsoft/DirectXShaderCompiler,microsoft,460,2023-03-24T23:56:56Z,This repo hosts the source for the DirectX Shader Compiler which is based on LLVM/Clang.
668,CPP,bond,2507,335,C++,https://github.com/microsoft/bond,microsoft,137,2023-03-24T21:47:54Z,Bond is a cross-platform framework for working with schematized data. It supports cross-language de/serialization and powerful generic mechanisms for efficiently manipulating data. Bond is broadly used at Microsoft in high scale services. 
669,CPP,MineCraft-One-Week-Challenge,2501,385,C++,https://github.com/Hopson97/MineCraft-One-Week-Challenge,Hopson97,14,2023-03-12T15:14:48Z,"I challenged myself to see if I could create a voxel game (Minecraft-like) in just one week using C++ and OpenGL, and here is the result"
670,CPP,jakt,2501,241,C++,https://github.com/SerenityOS/jakt,SerenityOS,54,2023-03-25T22:40:48Z,The Jakt Programming Language
671,CPP,DataStructures-Algorithms,2490,982,C++,https://github.com/rachitiitr/DataStructures-Algorithms,rachitiitr,1,2023-01-06T18:29:56Z,The best library for implementation of all Data Structures and Algorithms - Trees + Graph Algorithms too!
672,CPP,defold,2489,189,C++,https://github.com/defold/defold,defold,984,2023-03-26T20:04:18Z,"Defold is a completely free to use game engine for development of desktop, mobile and web games."
673,CPP,SpaceCadetPinball,2487,167,C++,https://github.com/k4zmu2a/SpaceCadetPinball,k4zmu2a,35,2023-03-26T11:35:35Z,Decompilation of 3D Pinball for Windows – Space Cadet
674,CPP,openMVS,2486,797,C++,https://github.com/cdcseacave/openMVS,cdcseacave,229,2023-03-26T13:56:40Z,open Multi-View Stereo reconstruction library
675,CPP,mailcore2,2485,604,C++,https://github.com/MailCore/mailcore2,MailCore,191,2023-02-13T11:47:32Z,"MailCore 2 provide a simple and asynchronous API to work with e-mail protocols IMAP, POP and SMTP. The API has been redesigned from ground up."
676,CPP,webots,2481,1365,C++,https://github.com/cyberbotics/webots,cyberbotics,152,2023-03-27T10:23:05Z,Webots Robot Simulator
677,CPP,FreeReflection,2480,481,C++,https://github.com/tiann/FreeReflection,tiann,14,2021-07-24T06:20:33Z,A library that lets you use reflection without any restriction above Android P
678,CPP,cpp-cheatsheet,2480,638,C++,https://github.com/mortennobel/cpp-cheatsheet,mortennobel,6,2022-10-13T20:01:23Z,Modern C++ Cheatsheet
679,CPP,self-driving-car,2477,1347,C++,https://github.com/ndrplz/self-driving-car,ndrplz,9,2022-03-29T18:15:03Z,Udacity Self-Driving Car Engineer Nanodegree projects.
680,CPP,TWiLightMenu,2476,170,C++,https://github.com/DS-Homebrew/TWiLightMenu,DS-Homebrew,167,2023-03-27T08:21:42Z,DSi Menu replacement for DS/DSi/3DS/2DS
681,CPP,AnyQ,2474,658,C++,https://github.com/baidu/AnyQ,baidu,64,2020-11-28T12:32:49Z,FAQ-based Question Answering System
682,CPP,rfid,2474,1355,C++,https://github.com/miguelbalboa/rfid,miguelbalboa,14,2023-01-17T19:54:29Z,Arduino RFID Library for MFRC522
683,CPP,ogl,2470,909,C++,https://github.com/opengl-tutorials/ogl,opengl-tutorials,24,2023-03-14T21:36:18Z,
684,CPP,mcsema,2466,342,C++,https://github.com/lifting-bits/mcsema,lifting-bits,112,2022-04-26T13:43:28Z,"Framework for lifting x86, amd64, aarch64, sparc32, and sparc64 program binaries to LLVM bitcode"
685,CPP,Data-Structres,2464,468,C++,https://github.com/callmePicacho/Data-Structres,callmePicacho,4,2022-08-23T14:01:51Z,浙江大学《数据结构》上课笔记 + 数据结构实现 + 课后题题解
686,CPP,phxsql,2463,584,C++,https://github.com/Tencent/phxsql,Tencent,46,2018-12-25T10:38:56Z,A high availability MySQL cluster that guarantees data consistency between a master and slaves.
687,CPP,node-memwatch,2460,307,C++,https://github.com/lloyd/node-memwatch,lloyd,49,2022-12-29T17:24:55Z,"A NodeJS library to keep an eye on your memory usage, and discover and isolate leaks."
688,CPP,hnswlib,2450,441,C++,https://github.com/nmslib/hnswlib,nmslib,134,2023-03-19T11:57:01Z,Header-only C++/python library for fast approximate nearest neighbors
689,CPP,AliceVision,2448,735,C++,https://github.com/alicevision/AliceVision,alicevision,44,2023-03-27T11:52:41Z,Photogrammetric Computer Vision Framework
690,CPP,deepdetect,2447,557,C++,https://github.com/jolibrain/deepdetect,jolibrain,80,2023-03-24T08:03:52Z,"Deep Learning API and Server in C++14 support for Caffe, PyTorch,TensorRT, Dlib, NCNN, Tensorflow, XGBoost and TSNE"
691,CPP,phpdesktop,2447,541,C++,https://github.com/cztomczak/phpdesktop,cztomczak,90,2022-09-02T10:48:45Z,"Develop desktop GUI applications using PHP, HTML5, JavaScript and SQLite"
692,CPP,glslang,2441,722,C++,https://github.com/KhronosGroup/glslang,KhronosGroup,360,2023-03-25T16:45:08Z,"Khronos-reference front end for GLSL/ESSL, partial front end for HLSL, and a SPIR-V generator."
693,CPP,B23Downloader,2441,324,C++,https://github.com/vooidzero/B23Downloader,vooidzero,39,2022-08-03T14:58:59Z,（已长久停更）
694,CPP,SDRPlusPlus,2436,346,C++,https://github.com/AlexandreRouma/SDRPlusPlus,AlexandreRouma,43,2023-03-26T23:50:57Z,Cross-Platform SDR Software
695,CPP,openrasp,2433,582,C++,https://github.com/baidu/openrasp,baidu,30,2023-03-24T00:29:06Z,🔥Open source RASP solution
696,CPP,qgroundcontrol,2429,2924,C++,https://github.com/mavlink/qgroundcontrol,mavlink,978,2023-03-27T09:49:58Z,"Cross-platform ground control station for drones (Android, iOS, Mac OS, Linux, Windows)"
697,CPP,valhalla,2428,504,C++,https://github.com/valhalla/valhalla,valhalla,564,2023-03-27T10:24:25Z,Open Source Routing Engine for OpenStreetMap
698,CPP,UnrealEnginePython,2427,690,C++,https://github.com/20tab/UnrealEnginePython,20tab,333,2022-06-22T09:35:46Z,Embed Python in Unreal Engine 4
699,CPP,gqrx,2425,482,C++,https://github.com/gqrx-sdr/gqrx,gqrx-sdr,182,2023-03-26T12:17:04Z,Software defined radio receiver powered by GNU Radio and Qt.
700,CPP,json11,2424,619,C++,https://github.com/dropbox/json11,dropbox,12,2020-03-25T23:27:28Z,A tiny JSON library for C++11.
701,CPP,node-addon-examples,2226,575,C++,https://github.com/nodejs/node-addon-examples,nodejs,45,2023-02-03T01:31:23Z,Node.js C++ addon examples from http://nodejs.org/docs/latest/api/addons.html
702,CPP,ssr,2224,272,C++,https://github.com/MaartenBaert/ssr,MaartenBaert,472,2023-03-25T13:03:38Z,"SimpleScreenRecorder, a screen recorder for Linux"
703,CPP,CppCon2014,2214,396,C++,https://github.com/CppCon/CppCon2014,CppCon,0,2016-01-10T01:54:55Z,Speaker materials from CppCon 2014
704,CPP,immer,2214,158,C++,https://github.com/arximboldi/immer,arximboldi,36,2023-03-03T02:46:59Z,Postmodern immutable and persistent data structures for C++ — value semantics at scale
705,CPP,overgrowth,2213,230,C++,https://github.com/WolfireGames/overgrowth,WolfireGames,25,2023-03-22T13:02:40Z,Open Source codebase of the game Overgrowth by Wolfire Games LLC
706,CPP,LeetCode,2203,513,C++,https://github.com/Jack-Cherish/LeetCode,Jack-Cherish,0,2020-11-22T04:52:44Z,:monkey:LeetCode、剑指Offer刷题笔记（C/C++、Python3实现）
707,CPP,ELL,2203,299,C++,https://github.com/microsoft/ELL,microsoft,29,2022-08-30T19:36:19Z,Embedded Learning Library
708,CPP,MTuner,2202,142,C++,https://github.com/milostosic/MTuner,milostosic,1,2023-03-19T18:44:05Z,"MTuner is a C/C++ memory profiler and memory leak finder for Windows, PlayStation 4 and 3, Android and other platforms"
709,CPP,klee,2196,610,C++,https://github.com/klee/klee,klee,71,2023-03-27T10:39:04Z,KLEE Symbolic Execution Engine
710,CPP,ispc,2196,286,C++,https://github.com/ispc/ispc,ispc,364,2023-03-22T20:13:55Z,Intel® Implicit SPMD Program Compiler
