rank,repo_name,forks,stars,language,repo_url,description,id,last_commit
1,linux,47300,148662,C,https://github.com/torvalds/linux,Linux kernel source tree,MDEwOlJlcG9zaXRvcnkyMzI1Mjk4,2023-03-28T09:02:58Z
2,scrcpy,8274,80051,C,https://github.com/Genymobile/scrcpy,Display and control your Android device,MDEwOlJlcG9zaXRvcnkxMTE1ODM1OTM=,2023-03-28T06:33:12Z
3,netdata,5479,62417,C,https://github.com/netdata/netdata,"Real-time performance monitoring, done right! https://www.netdata.cloud",MDEwOlJlcG9zaXRvcnkxMDc0NDE4Mw==,2023-03-28T12:54:58Z
4,redis,22359,59126,C,https://github.com/redis/redis,"Redis is an in-memory database that persists on disk. The data model is key-value, but many different kind of values are supported: Strings, Lists, Sets, Sorted Sets, Hashes, Streams, HyperLogLogs, Bitmaps.",MDEwOlJlcG9zaXRvcnkxNTYwMTg=,2023-03-28T12:32:36Z
5,Ventoy,3304,47009,C,https://github.com/ventoy/Ventoy,A new bootable USB solution.,MDEwOlJlcG9zaXRvcnkyNDYzMzU5ODc=,2023-03-28T06:32:19Z
6,obs-studio,6727,46471,C,https://github.com/obsproject/obs-studio,OBS Studio - Free and open source software for live streaming and screen recording,MDEwOlJlcG9zaXRvcnkxMzIzMzE1OA==,2023-03-28T13:04:26Z
7,git,24869,45708,C,https://github.com/git/git,Git Source Code Mirror - This is a publish-only repository but pull requests can be turned into patches to the mailing list via GitGitGadget (https://gitgitgadget.github.io/). Please follow Documentation/SubmittingPatches procedure for any of your improvements.,MDEwOlJlcG9zaXRvcnkzNjUwMg==,2023-03-28T00:34:48Z
8,php-src,7498,35211,C,https://github.com/php/php-src,The PHP Interpreter,MDEwOlJlcG9zaXRvcnkxOTAzNTIy,2023-03-28T12:29:40Z
9,FFmpeg,10741,35089,C,https://github.com/FFmpeg/FFmpeg,Mirror of https://git.ffmpeg.org/ffmpeg.git,MDEwOlJlcG9zaXRvcnkxNjE0NDEw,2023-03-28T13:05:05Z
10,wrk,2796,34128,C,https://github.com/wg/wrk,Modern HTTP benchmarking tool,MDEwOlJlcG9zaXRvcnkzNzc0MzI4,2023-01-19T00:59:31Z
11,ijkplayer,7967,31250,C,https://github.com/bilibili/ijkplayer,"Android/iOS video player based on FFmpeg n3.4, with MediaCodec, VideoToolbox support.",MDEwOlJlcG9zaXRvcnkxMDQ0Njg5MA==,2022-12-23T14:16:42Z
12,curl,5639,28996,C,https://github.com/curl/curl,"A command line tool and library for transferring data with URL syntax, supporting DICT, FILE, FTP, FTPS, GOPHER, GOPHERS, HTTP, HTTPS, IMAP, IMAPS, LDAP, LDAPS, MQTT, POP3, POP3S, RTMP, RTMPS, RTSP, SCP, SFTP, SMB, SMBS, SMTP, SMTPS, TELNET, TFTP, WS and WSS. libcurl offers a myriad of powerful features",MDEwOlJlcG9zaXRvcnk1NjkwNDE=,2023-03-28T13:01:55Z
13,tmux,1873,28159,C,https://github.com/tmux/tmux,tmux source code,MDEwOlJlcG9zaXRvcnkzNjgzNjQ3NQ==,2023-03-26T21:42:26Z
14,lede,18815,25382,C,https://github.com/coolsnowwolf/lede,Lean's LEDE source,MDEwOlJlcG9zaXRvcnkxMDI1NzgzNDU=,2023-03-27T15:15:21Z
15,the_silver_searcher,1380,24752,C,https://github.com/ggreer/the_silver_searcher,"A code-searching tool similar to ack, but faster.",MDEwOlJlcG9zaXRvcnkyODEwNDU1,2023-03-20T09:49:17Z
16,os-tutorial,3081,24714,C,https://github.com/cfenollosa/os-tutorial,How to create an OS from scratch,MDEwOlJlcG9zaXRvcnkyNDU4NjMwOA==,2023-02-19T13:42:52Z
17,jq,1415,24580,C,https://github.com/stedolan/jq,Command-line JSON processor,MDEwOlJlcG9zaXRvcnk1MTAxMTQx,2023-03-27T15:59:04Z
18,darknet,21231,23971,C,https://github.com/pjreddie/darknet,Convolutional Neural Networks,MDEwOlJlcG9zaXRvcnkxODY2Njc1OA==,2023-03-22T07:48:36Z
19,emscripten,3044,23518,C,https://github.com/emscripten-core/emscripten,Emscripten: An LLVM-to-WebAssembly Compiler,MDEwOlJlcG9zaXRvcnkxMzU3Nzk2,2023-03-28T12:49:23Z
20,rufus,2231,22300,C,https://github.com/pbatard/rufus,The Reliable USB Formatting Utility,MDEwOlJlcG9zaXRvcnkyODEwMjky,2023-03-27T19:50:33Z
21,mpv,2570,21882,C,https://github.com/mpv-player/mpv,🎥 Command line video player,MDEwOlJlcG9zaXRvcnk2MjAxMDky,2023-03-28T12:08:59Z
22,stb,7436,21436,C,https://github.com/nothings/stb,stb single-file public domain libraries for C/C++,MDEwOlJlcG9zaXRvcnkyMDE1OTg2Nw==,2023-03-23T06:27:52Z
23,openssl,9010,21280,C,https://github.com/openssl/openssl,TLS/SSL and crypto library,MDEwOlJlcG9zaXRvcnk3NjM0Njc3,2023-03-28T12:16:25Z
24,libuv,3324,21120,C,https://github.com/libuv/libuv,Cross-platform asynchronous I/O,MDEwOlJlcG9zaXRvcnkxNDgxMjczOQ==,2023-03-28T09:58:56Z
25,TDengine,4631,21070,C,https://github.com/taosdata/TDengine,"TDengine is an open source, high-performance, cloud native time-series database optimized for Internet of Things (IoT), Connected Cars, Industrial IoT and DevOps.",MDEwOlJlcG9zaXRvcnkxOTYzNTM2NzM=,2023-03-28T12:50:34Z
26,masscan,2889,20806,C,https://github.com/robertdavidgraham/masscan,"TCP port scanner, spews SYN packets asynchronously, scanning entire Internet in under 5 minutes.",MDEwOlJlcG9zaXRvcnkxMTcxNTc1Mw==,2023-03-21T16:15:24Z
27,The-Art-Of-Programming-By-July-2nd,7180,20794,C,https://github.com/julycoding/The-Art-Of-Programming-By-July-2nd,本项目曾冲到全球第一，干货集锦见本页面最底部，另完整精致的纸质版《编程之法：面试和算法心得》已在京东/当当上销售,MDEwOlJlcG9zaXRvcnkxNTE4MzQ4NQ==,2023-02-26T17:05:49Z
28,How-to-Make-a-Computer-Operating-System,3396,20232,C,https://github.com/SamyPesse/How-to-Make-a-Computer-Operating-System,How to Make a Computer Operating System in C++,MDEwOlJlcG9zaXRvcnkxNDgwNzE3Mw==,2021-12-16T09:10:55Z
29,zstd,1870,19850,C,https://github.com/facebook/zstd,Zstandard - Fast real-time compression algorithm,MDEwOlJlcG9zaXRvcnkyOTc1OTcxNQ==,2023-03-27T23:44:07Z
30,Tasmota,4340,19439,C,https://github.com/arendst/Tasmota,"Alternative firmware for ESP8266 and ESP32 based devices with easy configuration using webUI, OTA updates, automation using timers or rules, expandability and entirely local control over MQTT, HTTP, Serial or KNX. Full documentation at",MDEwOlJlcG9zaXRvcnk4MDI4NjI4OA==,2023-03-27T13:42:45Z
31,HarmonyOS,3322,18701,C,https://github.com/Awesome-HarmonyOS/HarmonyOS,A curated list of awesome things related to HarmonyOS. 华为鸿蒙操作系统。,MDEwOlJlcG9zaXRvcnkyMDE0NTQwNTE=,2022-07-07T01:24:35Z
32,nginx,6234,18188,C,https://github.com/nginx/nginx,"An official read-only mirror of http://hg.nginx.org/nginx/ which is updated hourly. Pull requests on GitHub cannot be accepted and will be automatically closed. The proper way to submit changes to nginx is via the nginx development mailing list, see http://nginx.org/en/docs/contributing_changes.html",MDEwOlJlcG9zaXRvcnkzNzkxMjM5OA==,2023-03-13T12:59:44Z
33,radare2,2836,17795,C,https://github.com/radareorg/radare2,UNIX-like reverse engineering framework and command-line toolset,MDEwOlJlcG9zaXRvcnk0ODY5Mjk0,2023-03-28T12:23:17Z
34,mimikatz,3263,16956,C,https://github.com/gentilkiwi/mimikatz,A little tool to play with Windows security,MDEwOlJlcG9zaXRvcnkxODQ5NjE2Ng==,2023-03-03T10:17:14Z
35,hashcat,2509,16886,C,https://github.com/hashcat/hashcat,World's fastest and most advanced password recovery utility,MDEwOlJlcG9zaXRvcnk0NzQwOTY3Mg==,2023-03-27T22:06:30Z
36,bcc,3355,16881,C,https://github.com/iovisor/bcc,"BCC - Tools for BPF-based Linux IO analysis, networking, monitoring, and more",MDEwOlJlcG9zaXRvcnkzNDkyMTExNg==,2023-03-28T13:10:24Z
37,micropython,6292,16180,C,https://github.com/micropython/micropython,MicroPython - a lean and efficient Python implementation for microcontrollers and constrained systems,MDEwOlJlcG9zaXRvcnkxNTMzNzE0Mg==,2023-03-28T02:31:26Z
38,nnn,657,16024,C,https://github.com/jarun/nnn,n³ The unorthodox terminal file manager,MDEwOlJlcG9zaXRvcnk2NjE1MDEyMg==,2023-03-27T22:58:04Z
39,goaccess,1032,15958,C,https://github.com/allinurl/goaccess,GoAccess is a real-time web log analyzer and interactive viewer that runs in a terminal in *nix systems or through your browser.,MDEwOlJlcG9zaXRvcnkxMTM5NzkzOQ==,2023-03-17T22:17:29Z
40,C,3938,15865,C,https://github.com/TheAlgorithms/C,"Collection of various algorithms in mathematics, machine learning, computer science, physics, etc implemented in C for educational purposes.",MDEwOlJlcG9zaXRvcnk2MzQ3NzUxNQ==,2023-03-26T20:29:20Z
41,yabai,526,15537,C,https://github.com/koekeishiya/yabai,A tiling window manager for macOS based on binary space partitioning,MDEwOlJlcG9zaXRvcnkxODQ5MDkxNjM=,2023-02-27T00:06:33Z
42,llama.cpp,2036,14944,C,https://github.com/ggerganov/llama.cpp,Port of Facebook's LLaMA model in C/C++,R_kgDOJH_K4A,2023-03-28T13:02:43Z
43,timescaledb,782,14729,C,https://github.com/timescale/timescaledb,An open-source time-series SQL database optimized for fast ingest and complex queries.  Packaged as a PostgreSQL extension.,MDEwOlJlcG9zaXRvcnk4NDI0MDg1MA==,2023-03-28T13:06:08Z
44,qmk_firmware,31426,14688,C,https://github.com/qmk/qmk_firmware,Open-source keyboard firmware for Atmel AVR and Arm USB families,MDEwOlJlcG9zaXRvcnkyNzczNzM5Mw==,2023-03-28T11:26:05Z
45,openwrt,8475,14481,C,https://github.com/openwrt/openwrt,This repository is a mirror of https://git.openwrt.org/openwrt/openwrt.git It is for reference only and is not active for check-ins.  We will continue to accept Pull Requests here. They will be merged via staging trees then into openwrt.git.,MDEwOlJlcG9zaXRvcnk0NTgyMTU0MA==,2023-03-28T13:09:04Z
46,Mailspring,865,13936,C,https://github.com/Foundry376/Mailspring,":love_letter: A beautiful, fast and fully open source mail client for Mac, Windows and Linux.",MDEwOlJlcG9zaXRvcnk3MDc3NzE4MA==,2023-02-27T09:50:18Z
47,ish,732,13665,C,https://github.com/ish-app/ish,Linux shell for iOS,MDEwOlJlcG9zaXRvcnk5MDMyMDQ5NA==,2023-03-27T06:22:37Z
48,nuklear,1122,13523,C,https://github.com/vurtun/nuklear,A single-header ANSI C gui library,MDEwOlJlcG9zaXRvcnkzMjg2NjQ1NA==,2020-01-03T21:36:41Z
49,WindTerm,1043,13493,C,https://github.com/kingToolbox/WindTerm,A professional cross-platform SSH/Sftp/Shell/Telnet/Serial terminal.,MDEwOlJlcG9zaXRvcnkyMTQwMTE0MTQ=,2023-03-23T09:33:20Z
50,blurhash,304,13478,C,https://github.com/woltapp/blurhash,A very compact representation of a placeholder for an image.,MDEwOlJlcG9zaXRvcnkxOTM4ODU0NjQ=,2023-03-15T03:06:42Z
51,whisper.cpp,1054,13460,C,https://github.com/ggerganov/whisper.cpp,Port of OpenAI's Whisper model in C/C++,R_kgDOIEMdig,2023-03-28T10:31:10Z
52,open-gpu-kernel-modules,930,12964,C,https://github.com/NVIDIA/open-gpu-kernel-modules,NVIDIA Linux open GPU kernel module source,R_kgDOHRZU2w,2023-03-23T18:01:32Z
53,kcp,2341,12882,C,https://github.com/skywind3000/kcp,:zap: KCP - A Fast and Reliable ARQ Protocol,MDEwOlJlcG9zaXRvcnkyODUxNTgzOQ==,2023-03-22T00:40:19Z
54,ExplorerPatcher,651,12673,C,https://github.com/valinet/ExplorerPatcher,This project aims to enhance the working environment on Windows,MDEwOlJlcG9zaXRvcnkzOTQzMTg3MTA=,2023-03-25T14:03:18Z
55,memcached,3174,12513,C,https://github.com/memcached/memcached,memcached development tree,MDEwOlJlcG9zaXRvcnkxODQ5ODE=,2023-03-28T08:44:15Z
56,nginx-rtmp-module,3446,12483,C,https://github.com/arut/nginx-rtmp-module,NGINX-based Media Streaming Server,MDEwOlJlcG9zaXRvcnkzNzE0OTAw,2022-06-21T08:56:37Z
57,raylib,1471,12410,C,https://github.com/raysan5/raylib,A simple and easy-to-use library to enjoy videogames programming,MDEwOlJlcG9zaXRvcnkxMzgzNjQ5OQ==,2023-03-25T22:26:38Z
58,HandBrake,1094,12368,C,https://github.com/HandBrake/HandBrake,HandBrake's main development repository ,MDEwOlJlcG9zaXRvcnk0MTIxNTgzNQ==,2023-03-27T20:12:25Z
59,reactos,1517,12154,C,https://github.com/reactos/reactos,A free Windows-compatible Operating System,MDEwOlJlcG9zaXRvcnkxMDU2Mjc4NDY=,2023-03-28T12:22:38Z
60,sway,994,12117,C,https://github.com/swaywm/sway,i3-compatible Wayland compositor,MDEwOlJlcG9zaXRvcnk0MDIxNzkwNA==,2023-03-27T08:56:38Z
61,raspberry-pi-os,1233,12106,C,https://github.com/s-matyukevich/raspberry-pi-os,Learning operating system development using Linux kernel and Raspberry Pi,MDEwOlJlcG9zaXRvcnk5NTEzMzY2NQ==,2023-02-06T00:47:58Z
62,postgres,3802,12070,C,https://github.com/postgres/postgres,"Mirror of the official PostgreSQL GIT repository. Note that this is just a *mirror* - we don't work with pull requests on github. To contribute, please see https://wiki.postgresql.org/wiki/Submitting_a_Patch",MDEwOlJlcG9zaXRvcnk5Mjc0NDI=,2023-03-28T08:18:05Z
63,brotli,1178,12001,C,https://github.com/google/brotli,Brotli compression format,MDEwOlJlcG9zaXRvcnkyNDk5MzEzOA==,2023-03-23T17:13:47Z
64,tengine,2463,11930,C,https://github.com/alibaba/tengine,A distribution of Nginx with some advanced features,MDEwOlJlcG9zaXRvcnkzNzg0MDE3,2023-03-27T05:25:29Z
65,skynet,3968,11855,C,https://github.com/cloudwu/skynet,A lightweight online game framework,MDEwOlJlcG9zaXRvcnk1MjU0NTU3,2023-03-28T09:20:44Z
66,twemproxy,2034,11733,C,https://github.com/twitter/twemproxy,"A fast, light-weight proxy for memcached and redis",MDEwOlJlcG9zaXRvcnkzNTE2NjI0,2023-01-14T09:22:36Z
67,lvgl,2377,11635,C,https://github.com/lvgl/lvgl,"Embedded graphics library to create beautiful UIs for any MCU, MPU and display type. It's boosted by a professional yet affordable drag and drop UI editor, called SquareLine Studio.",MDEwOlJlcG9zaXRvcnk2MDY2NzczMA==,2023-03-28T12:02:13Z
68,robotjs,893,11608,C,https://github.com/octalmage/robotjs,Node.js Desktop Automation. ,MDEwOlJlcG9zaXRvcnkyMzUxNTAyNA==,2022-12-06T22:17:24Z
69,tig,597,11545,C,https://github.com/jonas/tig,Text-mode interface for git,MDEwOlJlcG9zaXRvcnkxNDA2NTY=,2023-03-05T19:36:19Z
70,esp8266_deauther,2376,11468,C,https://github.com/SpacehuhnTech/esp8266_deauther,Affordable WiFi hacking platform for testing and learning,MDEwOlJlcG9zaXRvcnk3ODI4MTA3NQ==,2023-01-20T05:15:06Z
71,openresty,1470,11219,C,https://github.com/openresty/openresty,High Performance Web Platform Based on Nginx and LuaJIT,MDEwOlJlcG9zaXRvcnk0ODAwODA=,2023-03-23T10:23:03Z
72,OpenCorePkg,1962,11157,C,https://github.com/acidanthera/OpenCorePkg,OpenCore bootloader,MDEwOlJlcG9zaXRvcnkxNzkzNTQyODI=,2023-03-28T06:46:02Z
73,webview,863,11003,C,https://github.com/webview/webview,Tiny cross-platform webview library for C/C++/Golang. Uses WebKit (Gtk/Cocoa) and Edge (Windows),MDEwOlJlcG9zaXRvcnkxMDA3ODEwMzU=,2023-03-19T21:35:34Z
74,rofi,587,10879,C,https://github.com/davatorium/rofi,"Rofi: A window switcher, application launcher and dmenu replacement",MDEwOlJlcG9zaXRvcnk3NzE1ODIw,2023-03-27T16:47:37Z
75,systemd,3288,10853,C,https://github.com/systemd/systemd,The systemd System and Service Manager ,MDEwOlJlcG9zaXRvcnkzMjg3MzMxMw==,2023-03-28T13:09:27Z
76,libsodium,1659,10849,C,https://github.com/jedisct1/libsodium,"A modern, portable, easy to use crypto library.",MDEwOlJlcG9zaXRvcnk3NzEwNjQ3,2023-03-24T14:53:59Z
77,BlackHole,453,10772,C,https://github.com/ExistentialAudio/BlackHole,BlackHole is a modern macOS virtual audio driver that allows applications to pass audio to other applications with zero additional latency.,MDEwOlJlcG9zaXRvcnkyMTEzODEyOTE=,2023-02-10T20:36:40Z
78,cosmopolitan,349,10647,C,https://github.com/jart/cosmopolitan,build-once run-anywhere c library,MDEwOlJlcG9zaXRvcnkyNzI0NTc2MDY=,2023-03-28T06:02:55Z
79,vlc,3375,10619,C,https://github.com/videolan/vlc,"VLC media player - All pull requests are ignored, please follow https://wiki.videolan.org/Sending_Patches_VLC/",MDEwOlJlcG9zaXRvcnkzMjk5MjA4,2023-03-24T01:27:08Z
80,darwin-xnu,1653,10612,C,https://github.com/apple/darwin-xnu,"The Darwin Kernel (mirror). This repository is a pure mirror and contributions are currently not accepted via pull-requests, please submit your contributions via https://developer.apple.com/bug-reporting/",MDEwOlJlcG9zaXRvcnk5MzIwNTQ2NQ==,2023-01-13T01:48:01Z
81,lua-nginx-module,2005,10559,C,https://github.com/openresty/lua-nginx-module,Embed the Power of Lua into NGINX HTTP servers,MDEwOlJlcG9zaXRvcnk2MTM4Mjk=,2023-03-23T06:30:00Z
82,seafile,1485,10527,C,https://github.com/haiwen/seafile,"High performance file syncing and sharing, with also Markdown WYSIWYG editing, Wiki, file label and other knowledge management features.",MDEwOlJlcG9zaXRvcnk0OTk5OTU5,2023-03-25T07:00:01Z
83,libui,620,10428,C,https://github.com/andlabs/libui,Simple and portable (but not inflexible) GUI library in C that uses the native GUI technologies of each platform it supports.,MDEwOlJlcG9zaXRvcnkzNDA4ODI4NQ==,2022-07-30T22:52:58Z
84,arduino-esp32,6626,10420,C,https://github.com/espressif/arduino-esp32,Arduino core for the ESP32,MDEwOlJlcG9zaXRvcnk3MDEyNzIxOA==,2023-03-28T12:15:37Z
85,glfw,4200,10387,C,https://github.com/glfw/glfw,"A multi-platform library for OpenGL, OpenGL ES, Vulkan, window and input",MDEwOlJlcG9zaXRvcnk5NTI0OTk3,2023-03-27T20:16:09Z
86,h2o,825,10332,C,https://github.com/h2o/h2o,"H2O - the optimized HTTP/1, HTTP/2, HTTP/3 server",MDEwOlJlcG9zaXRvcnkyMzAyOTYxNw==,2023-03-23T17:59:08Z
87,esp-idf,6318,10232,C,https://github.com/espressif/esp-idf,Espressif IoT Development Framework. Official development framework for Espressif SoCs.,MDEwOlJlcG9zaXRvcnk2NTg5OTQ3Ng==,2023-03-28T07:30:31Z
88,DOOM,1758,10121,C,https://github.com/id-Software/DOOM,DOOM Open Source Release,MDEwOlJlcG9zaXRvcnkzMzE5MDQw,2022-10-12T05:22:35Z
89,sumatrapdf,1522,9980,C,https://github.com/sumatrapdfreader/sumatrapdf,SumatraPDF reader,MDEwOlJlcG9zaXRvcnk2MDQxMzAx,2023-03-27T17:28:46Z
90,SoftEtherVPN,2377,9927,C,https://github.com/SoftEtherVPN/SoftEtherVPN,Cross-platform multi-protocol VPN software. Pull requests are welcome. The stable version is available at https://github.com/SoftEtherVPN/SoftEtherVPN_Stable.,MDEwOlJlcG9zaXRvcnkxNTU4MzMxMA==,2023-03-15T12:32:09Z
91,Tinyhttpd,3753,9686,C,https://github.com/EZLippi/Tinyhttpd,Tinyhttpd 是J. David Blackstone在1999年写的一个不到 500 行的超轻量型 Http Server，用来学习非常不错，可以帮助我们真正理解服务器程序的本质。官网:http://tinyhttpd.sourceforge.net,MDEwOlJlcG9zaXRvcnkzNTkzMDgwNQ==,2023-02-16T07:31:21Z
92,libevent,3210,9679,C,https://github.com/libevent/libevent,Event notification library,MDEwOlJlcG9zaXRvcnkxODU2OTc2,2023-03-26T20:35:00Z
93,Craft,1301,9650,C,https://github.com/fogleman/Craft,A simple Minecraft clone written in C using modern OpenGL (shaders).,MDEwOlJlcG9zaXRvcnk5MzMwMDcy,2023-01-06T19:06:10Z
94,linux,4453,9625,C,https://github.com/raspberrypi/linux,Kernel source tree for Raspberry Pi-provided kernel builds. Issues unrelated to the linux kernel should be posted on the community forum at https://forums.raspberrypi.com/,MDEwOlJlcG9zaXRvcnkzMTk5MDAy,2023-03-28T12:47:38Z
95,phpredis,2125,9624,C,https://github.com/phpredis/phpredis,A PHP extension for Redis,MDEwOlJlcG9zaXRvcnkxNDgyOTk3,2023-03-23T21:43:33Z
96,wcdb,1299,9606,C,https://github.com/Tencent/wcdb,WCDB is a cross-platform database framework developed by WeChat.,MDEwOlJlcG9zaXRvcnk5MDk2MTYzNA==,2023-03-28T12:15:49Z
97,sanitizers,927,9482,C,https://github.com/google/sanitizers,"AddressSanitizer, ThreadSanitizer, MemorySanitizer",MDEwOlJlcG9zaXRvcnkyMzY0MTgxNg==,2023-03-10T13:27:26Z
98,redis-3.0-annotated,4115,9393,C,https://github.com/huangz1990/redis-3.0-annotated,带有详细注释的 Redis 3.0 代码（annotated Redis 3.0 source code）。,MDEwOlJlcG9zaXRvcnkyMTI5NDYwMA==,2023-03-18T02:03:40Z
99,Sandboxie,994,9334,C,https://github.com/sandboxie-plus/Sandboxie,Sandboxie Plus & Classic,MDEwOlJlcG9zaXRvcnkyNTQzMjcyNjE=,2023-03-28T09:42:03Z
100,mongoose,2517,9298,C,https://github.com/cesanta/mongoose,Embedded Web Server,MDEwOlJlcG9zaXRvcnk1NDE0NDg4,2023-03-27T21:20:47Z
101,Dummy-Robot,2072,9230,C,https://github.com/peng-zhihui/Dummy-Robot,我的超迷你机械臂机器人项目。,R_kgDOGLXz-Q,2023-01-04T01:24:20Z
102,audacity,2024,9152,C,https://github.com/audacity/audacity,Audio Editor                                     ,MDEwOlJlcG9zaXRvcnkzMjkyMTczNg==,2023-03-27T21:21:50Z
103,coturn,1782,8972,C,https://github.com/coturn/coturn,coturn TURN server project,MDEwOlJlcG9zaXRvcnkzOTI0Mjg5NA==,2023-03-25T04:21:48Z
104,libgit2,2322,8951,C,https://github.com/libgit2/libgit2,"A cross-platform, linkable library implementation of Git that you can use in your application.",MDEwOlJlcG9zaXRvcnk5MDE2NjI=,2023-03-27T21:54:34Z
105,zfs,1583,8831,C,https://github.com/openzfs/zfs,OpenZFS on Linux and FreeBSD,MDEwOlJlcG9zaXRvcnk0MzcwMTE=,2023-03-28T12:25:57Z
106,torch7,2390,8804,C,https://github.com/torch/torch7,http://torch.ch,MDEwOlJlcG9zaXRvcnkxMzY3NzE4Nw==,2022-10-26T03:55:13Z
107,ImageMagick,1153,8723,C,https://github.com/ImageMagick/ImageMagick,🧙‍♂️ ImageMagick 7,MDEwOlJlcG9zaXRvcnkzNTc4MDk3Nw==,2023-03-27T00:02:13Z
108,toxcore,1290,8705,C,https://github.com/irungentoo/toxcore,The future of online communications.,MDEwOlJlcG9zaXRvcnkxMDg5NDcxNg==,2023-03-03T21:04:44Z
109,systeminformer,1193,8649,C,https://github.com/winsiderss/systeminformer,"A free, powerful, multi-purpose tool that helps you monitor system resources, debug software and detect malware. Brought to you by Winsider Seminars & Solutions, Inc. @ http://www.windows-internals.com",MDEwOlJlcG9zaXRvcnk1MDgyNDQ4NQ==,2023-03-24T00:50:22Z
110,ffmpeg-libav-tutorial,841,8637,C,https://github.com/leandromoreira/ffmpeg-libav-tutorial,"FFmpeg libav tutorial - learn how media works from basic to transmuxing, transcoding and more. Translations: 🇺🇸 🇨🇳 🇰🇷 🇪🇸 🇻🇳",MDEwOlJlcG9zaXRvcnkxMDk3NjI5MDQ=,2023-01-04T23:36:11Z
111,cJSON,2893,8609,C,https://github.com/DaveGamble/cJSON,Ultralightweight JSON parser in ANSI C,MDEwOlJlcG9zaXRvcnk1NDI4MDc3OA==,2023-03-21T02:13:29Z
112,japronto,593,8608,C,https://github.com/squeaky-pl/japronto, Screaming-fast Python 3.5+ HTTP toolkit integrated with pipelining HTTP server based on uvloop and picohttpparser.,MDEwOlJlcG9zaXRvcnk3MjAzOTA3Mg==,2022-08-06T05:22:12Z
113,proxychains-ng,1020,8584,C,https://github.com/rofl0r/proxychains-ng,"proxychains ng (new generation) - a preloader which hooks calls to sockets in dynamically linked programs and redirects it through one or more socks/http proxies. continuation of the unmaintained proxychains project. the sf.net page is currently not updated, use releases from github release page instead.",MDEwOlJlcG9zaXRvcnkyMzIxMDUx,2023-03-20T20:30:09Z
114,fastdfs,1953,8479,C,https://github.com/happyfish100/fastdfs,"FastDFS is an open source high performance distributed file system (DFS). It's major functions include: file storing, file syncing and file accessing, and design for high capacity and load balance. Wechat/Weixin public account (Chinese Language): fastdfs",MDEwOlJlcG9zaXRvcnkxMTE3ODUxMg==,2023-02-15T13:13:14Z
115,GoodbyeDPI,791,8431,C,https://github.com/ValdikSS/GoodbyeDPI,GoodbyeDPI — Deep Packet Inspection circumvention utility (for Windows),MDEwOlJlcG9zaXRvcnk5MTQ5MzA4OA==,2022-08-10T17:20:53Z
116,react-native-code-push,1369,8420,C,https://github.com/microsoft/react-native-code-push,React Native module for CodePush,MDEwOlJlcG9zaXRvcnkzNjc0OTE1Mw==,2023-03-27T03:56:56Z
117,tini,425,8401,C,https://github.com/krallin/tini,A tiny but valid `init` for containers,MDEwOlJlcG9zaXRvcnkzMTQzMjU3Mw==,2023-02-08T17:43:21Z
118,xLua,2376,8320,C,https://github.com/Tencent/xLua,"xLua is a lua programming solution for  C# ( Unity, .Net, Mono) , it supports android, ios, windows, linux, osx, etc.",MDEwOlJlcG9zaXRvcnk3NTgxMTAxNQ==,2023-03-21T06:50:49Z
119,openvpn,2661,8301,C,https://github.com/OpenVPN/openvpn,OpenVPN  is  an open source VPN daemon,MDEwOlJlcG9zaXRvcnk0MTUxOTkz,2023-03-28T07:25:30Z
120,i3,720,8140,C,https://github.com/i3/i3,A tiling window manager for X11,MDEwOlJlcG9zaXRvcnkzMDI5MTA5MA==,2023-03-11T14:22:45Z
121,citus,554,8138,C,https://github.com/citusdata/citus,Distributed PostgreSQL as an extension,MDEwOlJlcG9zaXRvcnk1MDg3NDQ0Mg==,2023-03-28T13:12:14Z
122,rt-thread,4338,8133,C,https://github.com/RT-Thread/rt-thread,RT-Thread is an open source IoT real-time operating system (RTOS).,MDEwOlJlcG9zaXRvcnk3NDA4MTA4,2023-03-28T08:37:23Z
123,cockpit,975,8123,C,https://github.com/cockpit-project/cockpit,Cockpit is a web-based graphical interface for servers.,MDEwOlJlcG9zaXRvcnkxNDA0OTIxNg==,2023-03-28T12:58:35Z
124,db_tutorial,878,8116,C,https://github.com/cstack/db_tutorial,Writing a sqlite clone from scratch in C,MDEwOlJlcG9zaXRvcnkxMDIwMjkxNTA=,2023-03-09T05:23:26Z
125,lz4,1228,8074,C,https://github.com/lz4/lz4,Extremely Fast Compression algorithm,MDEwOlJlcG9zaXRvcnkxODEwNjI2OQ==,2023-03-13T08:34:11Z
126,c4,1306,8064,C,https://github.com/rswier/c4,C in four functions,MDEwOlJlcG9zaXRvcnkyNjE4MTI4Nw==,2022-09-10T02:41:16Z
127,FreeRDP,21998,8037,C,https://github.com/FreeRDP/FreeRDP,FreeRDP is a free remote desktop protocol library and clients,MDEwOlJlcG9zaXRvcnkxOTc5Nzk3,2023-03-28T09:34:52Z
128,blender,1373,8024,C,https://github.com/blender/blender,Official mirror of Blender,MDEwOlJlcG9zaXRvcnkyMTM5MTY4OTY=,2023-03-17T18:37:37Z
129,mimalloc,615,7947,C,https://github.com/microsoft/mimalloc,mimalloc is a compact general purpose allocator with excellent performance.,MDEwOlJlcG9zaXRvcnkxOTI4MDUzMzU=,2023-03-24T13:58:56Z
130,disque,550,7920,C,https://github.com/antirez/disque,Disque is a distributed message broker,MDEwOlJlcG9zaXRvcnkzNDY3Njc3Mw==,2021-03-17T14:10:45Z
131,jemalloc,1310,7881,C,https://github.com/jemalloc/jemalloc,,MDEwOlJlcG9zaXRvcnkxMzMxMDUyNw==,2023-03-23T18:16:19Z
132,acwj,768,7880,C,https://github.com/DoctorWkt/acwj,A Compiler Writing Journey,MDEwOlJlcG9zaXRvcnkyMTU5NzM5NjI=,2023-02-10T21:49:26Z
133,AppImageKit,519,7839,C,https://github.com/AppImage/AppImageKit,"Package desktop applications as AppImages that run on common Linux-based operating systems, such as RHEL, CentOS, openSUSE, SLED, Ubuntu, Fedora, debian and derivatives. Join #AppImage on irc.libera.chat",MDEwOlJlcG9zaXRvcnk5NDM1MTUz,2023-03-08T23:25:46Z
134,libvips,593,7783,C,https://github.com/libvips/libvips,A fast image processing library with low memory needs.,MDEwOlJlcG9zaXRvcnkxMjkxNDEw,2023-03-28T11:15:13Z
135,RetroArch,1549,7777,C,https://github.com/libretro/RetroArch,"Cross-platform, sophisticated frontend for the libretro API. Licensed GPLv3.",MDEwOlJlcG9zaXRvcnk2ODkzNDQ=,2023-03-28T00:12:23Z
