rank,repo_name,forks,stars,language,repo_url,description,id,last_commit
270,sshfs,432,4958,C,https://github.com/libfuse/sshfs,A network filesystem client to connect to SSH servers,MDEwOlJlcG9zaXRvcnk0ODM4ODI4Ng==,2022-09-03T19:24:40Z
271,grbl,2914,4956,C,https://github.com/grbl/grbl,"An open source, embedded, high performance g-code-parser and CNC milling controller written in optimized C that will run on a straight Arduino",MDEwOlJlcG9zaXRvcnkxMTQxMDI=,2021-11-02T21:56:41Z
272,fishhook,951,4919,C,https://github.com/facebook/fishhook,A library that enables dynamically rebinding symbols in Mach-O binaries running on iOS.,MDEwOlJlcG9zaXRvcnkxMTM1MTkyNw==,2023-03-07T07:33:58Z
273,n2n,793,4917,C,https://github.com/ntop/n2n,Peer-to-peer VPN,MDEwOlJlcG9zaXRvcnk3MTY5MTIxMg==,2023-02-25T17:03:14Z
274,cmus,476,4893,C,https://github.com/cmus/cmus,"Small, fast and powerful console music player for Unix-like operating systems.",MDEwOlJlcG9zaXRvcnk3MzY1MTM2,2023-01-13T07:09:45Z
275,licecap,433,4884,C,https://github.com/justinfrankel/licecap,LICEcap simple animated screen capture tool for Windows and OS X,MDEwOlJlcG9zaXRvcnkyMjA0ODQ3Mg==,2022-02-14T02:47:31Z
276,ravynos,170,4853,C,https://github.com/ravynsoft/ravynos,A BSD-based OS project that aims to provide an experience like and some compatibility with macOS (formerly known as airyxOS),MDEwOlJlcG9zaXRvcnkzMzQ3Nzc4NTc=,2023-03-18T17:50:02Z
277,VeraCrypt,748,4852,C,https://github.com/veracrypt/VeraCrypt,Disk encryption with strong security based on TrueCrypt,MDEwOlJlcG9zaXRvcnkyNjM3NjQ5MA==,2023-02-02T20:58:12Z
278,rtl_433,1154,4831,C,https://github.com/merbanan/rtl_433,Program to decode radio transmissions from devices on the ISM bands (and other frequencies),MDEwOlJlcG9zaXRvcnk3NzA1NjM5,2023-03-27T08:13:41Z
279,redcarpet,540,4829,C,https://github.com/vmg/redcarpet,"The safe Markdown parser, reloaded.",MDEwOlJlcG9zaXRvcnkxNTIzMTA2,2023-01-29T13:13:55Z
280,Logan,785,4829,C,https://github.com/Meituan-Dianping/Logan,Logan is a lightweight case logging system based on mobile platform.,MDEwOlJlcG9zaXRvcnkxNTAzNTQzNjc=,2023-03-04T07:09:51Z
281,firejail,513,4799,C,https://github.com/netblue30/firejail,Linux namespaces and seccomp-bpf sandbox,MDEwOlJlcG9zaXRvcnk0MDQxODE0Ng==,2023-03-28T10:46:30Z
282,HelloWord-Keyboard,787,4775,C,https://github.com/peng-zhihui/HelloWord-Keyboard,,R_kgDOHvZyPg,2023-03-01T00:45:00Z
283,firmware,1667,4773,C,https://github.com/raspberrypi/firmware,"This repository contains pre-compiled binaries of the current Raspberry Pi  kernel and modules, userspace libraries, and bootloader/GPU firmware.",MDEwOlJlcG9zaXRvcnkzNTY1OTA5,2023-03-24T18:43:15Z
284,linux-kernel-exploits,1758,4768,C,https://github.com/SecWiki/linux-kernel-exploits,linux-kernel-exploits Linux平台提权漏洞集合,MDEwOlJlcG9zaXRvcnk4OTMxODk2NA==,2020-07-13T05:02:00Z
285,yasea,1319,4763,C,https://github.com/begeekmyfriend/yasea,RTMP live streaming client for Android,MDEwOlJlcG9zaXRvcnk1NTYwODk5Mw==,2021-12-30T03:20:15Z
286,coder-kung-fu,796,4759,C,https://github.com/yanfeizhang/coder-kung-fu,开发内功修炼,MDEwOlJlcG9zaXRvcnkzMzA5ODA1OTk=,2023-03-16T00:54:24Z
287,hekate,463,4739,C,https://github.com/CTCaer/hekate,hekate - A GUI based Nintendo Switch Bootloader,MDEwOlJlcG9zaXRvcnkxMzE3MTAzMjg=,2023-03-07T15:01:12Z
288,htop,309,4729,C,https://github.com/htop-dev/htop,htop - an interactive process viewer,MDEwOlJlcG9zaXRvcnkyODgwODI5MDk=,2023-03-15T02:07:19Z
289,kcat,439,4718,C,https://github.com/edenhill/kcat,Generic command line non-JVM Apache Kafka producer and consumer,MDEwOlJlcG9zaXRvcnkxODI1NzM1OA==,2023-02-07T01:23:09Z
290,sioyek,142,4715,C,https://github.com/ahrm/sioyek,Sioyek is a PDF viewer with a focus on textbooks and research papers,MDEwOlJlcG9zaXRvcnkzODUwMzcwNTI=,2023-03-24T09:47:46Z
291,zmap,863,4692,C,https://github.com/zmap/zmap,ZMap is a fast single packet network scanner designed for Internet-wide network surveys.,MDEwOlJlcG9zaXRvcnk3NzY1NDAz,2023-03-23T15:46:02Z
292,nanovg,731,4678,C,https://github.com/memononen/nanovg,Antialiased 2D vector drawing library on top of OpenGL for UI and visualizations.,MDEwOlJlcG9zaXRvcnkxNDMyNTc1Nw==,2022-09-25T21:17:20Z
293,arcore-android-sdk,1170,4677,C,https://github.com/google-ar/arcore-android-sdk,ARCore SDK for Android Studio,MDEwOlJlcG9zaXRvcnkxMDA5Nzk0ODQ=,2023-03-06T03:42:02Z
294,Atlas,1172,4646,C,https://github.com/Qihoo360/Atlas,"A high-performance and stable proxy for MySQL, it is developed by Qihoo's DBA and infrastructure team",MDEwOlJlcG9zaXRvcnkxNTI3OTk4MA==,2019-01-04T09:14:10Z
295,pngquant,464,4629,C,https://github.com/kornelski/pngquant,Lossy PNG compressor — pngquant command based on libimagequant library,MDEwOlJlcG9zaXRvcnkzMTAyOTY=,2023-03-10T04:30:14Z
296,dokany,612,4624,C,https://github.com/dokan-dev/dokany,User mode file system library for windows with FUSE Wrapper,MDEwOlJlcG9zaXRvcnkyNzgxODM2NQ==,2023-03-13T12:11:41Z
297,LiteOS,1553,4621,C,https://github.com/LiteOS/LiteOS,code and manual,MDEwOlJlcG9zaXRvcnk2NzkzNDE5MA==,2022-05-31T09:51:46Z
298,MangoHud,193,4601,C,https://github.com/flightlessmango/MangoHud,"A Vulkan and OpenGL overlay for monitoring FPS, temperatures, CPU/GPU load and more. Discord: https://discordapp.com/invite/Gj5YmBb",MDEwOlJlcG9zaXRvcnkyMzY2NDgzMzM=,2023-03-28T00:59:05Z
299,streem,257,4592,C,https://github.com/matz/streem,prototype of stream based programming language,MDEwOlJlcG9zaXRvcnkyNzg2MDczOA==,2022-01-03T10:45:02Z
300,tpotce,816,4591,C,https://github.com/telekom-security/tpotce,🍯 T-Pot - The All In One Honeypot Platform 🐝,MDEwOlJlcG9zaXRvcnkyNzI3NTQ0Mg==,2023-03-23T15:21:18Z
301,mdp,258,4574,C,https://github.com/visit1985/mdp,A command-line based markdown presentation tool.,MDEwOlJlcG9zaXRvcnkyNDAyMjMzMw==,2022-09-06T13:54:19Z
302,clib,230,4506,C,https://github.com/clibs/clib,C package manager-ish,MDEwOlJlcG9zaXRvcnk2NDI1NDM1,2023-03-06T16:22:16Z
303,yaf,1410,4495,C,https://github.com/laruence/yaf,"Fast php framework written in c, built in php extension",MDEwOlJlcG9zaXRvcnkyOTcwOTgy,2022-09-19T09:47:30Z
304,vim.js,283,4458,C,https://github.com/coolwanglu/vim.js,JavaScript port of Vim,MDEwOlJlcG9zaXRvcnkxNDgxNjk5Mw==,2016-05-12T09:08:08Z
305,xrdp,2561,4436,C,https://github.com/neutrinolabs/xrdp,xrdp: an open source RDP server,MDEwOlJlcG9zaXRvcnkxNjYwMTI3,2023-03-28T12:25:12Z
306,fluent-bit,1253,4421,C,https://github.com/fluent/fluent-bit,"Fast and Lightweight Logs and Metrics processor for Linux, BSD, OSX and Windows",MDEwOlJlcG9zaXRvcnkyOTkzMzk0OA==,2023-03-28T11:28:06Z
307,collapseos,268,4404,C,https://github.com/hsoft/collapseos,Bootstrap post-collapse technology,MDEwOlJlcG9zaXRvcnkxNzQyMzE3MzU=,2021-10-05T21:29:43Z
308,RIOT,1876,4396,C,https://github.com/RIOT-OS/RIOT,RIOT -  The friendly OS for IoT,MDEwOlJlcG9zaXRvcnk3MzcwMjQx,2023-03-28T12:13:43Z
309,libfuse,987,4382,C,https://github.com/libfuse/libfuse,The reference implementation of the Linux FUSE (Filesystem in Userspace) interface,MDEwOlJlcG9zaXRvcnk0ODI5NjE3Nw==,2023-03-28T09:46:16Z
310,mgba,613,4381,C,https://github.com/mgba-emu/mgba,mGBA Game Boy Advance Emulator,MDEwOlJlcG9zaXRvcnkyNzc4ODQ3MQ==,2023-03-27T08:10:45Z
311,AliOS-Things,1085,4366,C,https://github.com/alibaba/AliOS-Things,面向IoT领域的、高可伸缩的物联网操作系统，可去官网了解更多信息https://www.aliyun.com/product/aliosthings,MDEwOlJlcG9zaXRvcnkxMDE4NjYwNzM=,2023-01-05T07:29:14Z
312,jo,145,4349,C,https://github.com/jpmens/jo,JSON output from a shell,MDEwOlJlcG9zaXRvcnk1MzEzMzYxMw==,2022-11-03T17:09:41Z
313,WickedEngine,462,4345,C,https://github.com/turanszkij/WickedEngine,3D engine with modern graphics,MDEwOlJlcG9zaXRvcnkzNzc3MDk2MQ==,2023-03-27T17:14:43Z
314,sds,438,4337,C,https://github.com/antirez/sds,Simple Dynamic Strings library for C,MDEwOlJlcG9zaXRvcnkxNjU4MjQ2Mw==,2022-12-11T20:27:30Z
315,Telegram-iOS,1228,4333,C,https://github.com/TelegramMessenger/Telegram-iOS,Telegram-iOS,MDEwOlJlcG9zaXRvcnkxNTc1OTAyOTQ=,2023-03-14T20:14:58Z
316,sokol,351,4332,C,https://github.com/floooh/sokol,minimal cross-platform standalone C headers,MDEwOlJlcG9zaXRvcnk5NzIxMjQ5MA==,2023-03-18T16:17:28Z
317,esp_wifi_repeater,863,4327,C,https://github.com/martin-ger/esp_wifi_repeater,A full functional WiFi Repeater (correctly: a WiFi NAT Router),MDEwOlJlcG9zaXRvcnk3NjY0OTQzMA==,2023-02-11T18:27:16Z
318,tbox,656,4311,C,https://github.com/tboox/tbox,🎁 A glib-like multi-platform c library,MDEwOlJlcG9zaXRvcnkxNTk1MDk5,2023-03-03T15:08:21Z
319,mbed-os,2897,4310,C,https://github.com/ARMmbed/mbed-os,Arm Mbed OS is a platform operating system designed for the internet of things,MDEwOlJlcG9zaXRvcnk4MjcwOTcy,2023-03-24T19:55:52Z
320,zlib,2144,4278,C,https://github.com/madler/zlib,A massively spiffy yet delicately unobtrusive compression library.,MDEwOlJlcG9zaXRvcnkyMzU5Mzc4,2023-03-14T16:32:35Z
321,libusb,1700,4275,C,https://github.com/libusb/libusb,A cross-platform library to access USB devices ,MDEwOlJlcG9zaXRvcnkxNTEyMDY3Ng==,2023-03-12T13:53:12Z
322,s2n-tls,685,4263,C,https://github.com/aws/s2n-tls,An implementation of the TLS/SSL protocols,MDEwOlJlcG9zaXRvcnkyMTI4NzA3Ng==,2023-03-28T01:15:04Z
323,naxsi,596,4262,C,https://github.com/nbs-system/naxsi,"NAXSI is an open-source, high performance, low rules maintenance WAF for NGINX",MDEwOlJlcG9zaXRvcnkyMjMzMTg1,2022-09-14T19:19:54Z
324,phc-winner-argon2,378,4239,C,https://github.com/P-H-C/phc-winner-argon2,"The password hash Argon2, winner of PHC ",MDEwOlJlcG9zaXRvcnk0MzYyOTc5MA==,2022-12-18T17:42:05Z
325,RediSearch,438,4231,C,https://github.com/RediSearch/RediSearch,"A query and indexing engine for Redis, providing secondary indexing, full-text search, and aggregations. ",MDEwOlJlcG9zaXRvcnk1ODEzMjU0NA==,2023-03-28T12:55:23Z
326,MTProxy,748,4225,C,https://github.com/TelegramMessenger/MTProxy,,MDEwOlJlcG9zaXRvcnkxMzUzNDgyMTU=,2022-10-12T19:59:02Z
327,tcpcopy,1027,4222,C,https://github.com/session-replay-tools/tcpcopy,"An online request replication tool, also a tcp stream replay tool, fit for real testing, performance testing, stability testing, stress testing, load testing, smoke testing, etc",MDEwOlJlcG9zaXRvcnkyNTc0OTgw,2022-11-26T11:06:51Z
328,Tesseract-OCR-iOS,956,4160,C,https://github.com/gali8/Tesseract-OCR-iOS,"Tesseract OCR iOS is a Framework for iOS7+, compiled also for armv7s and arm64.",MDEwOlJlcG9zaXRvcnk5NzY5MDQx,2021-05-03T20:04:54Z
329,gravity,211,4149,C,https://github.com/marcobambini/gravity,Gravity Programming Language,MDEwOlJlcG9zaXRvcnk4MzA1MjE2NQ==,2022-12-27T16:19:20Z
330,X-TRACK,999,4147,C,https://github.com/FASTSHIFT/X-TRACK,A GPS bicycle speedometer that supports offline maps and track recording ,MDEwOlJlcG9zaXRvcnkzNDk0OTA3NzA=,2022-08-14T12:17:18Z
331,seL4,578,4138,C,https://github.com/seL4/seL4,The seL4 microkernel,MDEwOlJlcG9zaXRvcnkyMTk3NzY5MQ==,2023-03-28T10:31:36Z
332,Luma3DS,515,4135,C,https://github.com/LumaTeam/Luma3DS,"Noob-proof (N)3DS ""Custom Firmware""",MDEwOlJlcG9zaXRvcnk1MTI3NTk4NA==,2023-03-27T22:40:49Z
333,OpenLara,355,4131,C,https://github.com/XProger/OpenLara,Classic Tomb Raider open-source engine,MDEwOlJlcG9zaXRvcnk2NTYzODgxMA==,2023-03-02T12:54:19Z
334,fio,1088,4086,C,https://github.com/axboe/fio,Flexible I/O Tester,MDEwOlJlcG9zaXRvcnk2MzMxNjMx,2023-03-27T20:44:53Z
335,mbedtls,2232,4083,C,https://github.com/Mbed-TLS/mbedtls,"An open source, portable, easy to use, readable and flexible TLS library, and reference implementation of the PSA Cryptography API.",MDEwOlJlcG9zaXRvcnk2Njg3OTM2,2023-03-28T12:48:55Z
336,loadlibrary,374,4080,C,https://github.com/taviso/loadlibrary,Porting Windows Dynamic Link Libraries to Linux,MDEwOlJlcG9zaXRvcnk5MjIxOTQzMQ==,2022-01-23T18:34:49Z
337,katran,444,4077,C,https://github.com/facebookincubator/katran,A high performance layer 4 load balancer,MDEwOlJlcG9zaXRvcnkxMzEzNDc5NTQ=,2023-03-28T02:23:00Z
338,mpc-hc,1723,4066,C,https://github.com/mpc-hc/mpc-hc,MPC-HC's main repository.  For support use our Trac: https://trac.mpc-hc.org/,MDEwOlJlcG9zaXRvcnk1MTgwNTc3,2020-04-24T11:04:40Z
339,dynomite,534,4046,C,https://github.com/Netflix/dynomite,A generic dynamo implementation for different k-v storage engines,MDEwOlJlcG9zaXRvcnkxMzQ4NDYyNQ==,2022-10-03T19:49:53Z
340,openwrt-passwall,2023,4034,C,https://github.com/xiaorouji/openwrt-passwall,A commonly used proxy toolchain for Openwrt LuCI Application.,MDEwOlJlcG9zaXRvcnkxNTE4NzAzNjQ=,2023-03-28T12:07:14Z
341,glusterfs,1041,4027,C,https://github.com/gluster/glusterfs,Gluster Filesystem : Build your distributed storage in minutes,MDEwOlJlcG9zaXRvcnkxMzc3MDM3,2023-03-28T12:14:20Z
342,meltdown,535,4026,C,https://github.com/IAIK/meltdown,"This repository contains several applications, demonstrating the Meltdown bug.",MDEwOlJlcG9zaXRvcnkxMTYxMTk3MDQ=,2022-05-30T09:50:58Z
343,oot,520,4023,C,https://github.com/zeldaret/oot,Decompilation of The Legend of Zelda: Ocarina of Time,MDEwOlJlcG9zaXRvcnkyNDc4NzU3Mzg=,2023-03-22T09:26:06Z
344,lxc,1075,4017,C,https://github.com/lxc/lxc,LXC - Linux Containers,MDEwOlJlcG9zaXRvcnk1NzIwOTk1,2023-03-19T22:05:06Z
345,ultrajson,364,4011,C,https://github.com/ultrajson/ultrajson,Ultra fast JSON decoder and encoder written in C with Python bindings,MDEwOlJlcG9zaXRvcnkxNDE4OTQx,2023-03-19T16:00:56Z
346,Quake,792,3987,C,https://github.com/id-Software/Quake,Quake GPL Source Release,MDEwOlJlcG9zaXRvcnkzMzE4NTMx,2017-07-23T12:20:27Z
347,h3,404,3983,C,https://github.com/uber/h3,Hexagonal hierarchical geospatial indexing system,MDEwOlJlcG9zaXRvcnkxMTQ5NDg4MTY=,2023-03-23T21:29:43Z
348,CyberEngineTweaks,255,3980,C,https://github.com/yamashi/CyberEngineTweaks,"Cyberpunk 2077 tweaks, hacks and scripting framework",MDEwOlJlcG9zaXRvcnkzMjA5MjE0NTM=,2023-03-21T21:17:45Z
349,LookingGlass,244,3971,C,https://github.com/gnif/LookingGlass,An extremely low latency KVMFR (KVM FrameRelay) implementation for guests with VGA PCI Passthrough.,MDEwOlJlcG9zaXRvcnkxMTM0MTI0NTc=,2023-03-19T01:58:26Z
350,PINRemoteImage,512,3970,C,https://github.com/pinterest/PINRemoteImage,"A thread safe, performant, feature rich image fetcher",MDEwOlJlcG9zaXRvcnkzOTUzNzEwMw==,2023-03-24T22:14:00Z
351,vis,253,3946,C,https://github.com/martanne/vis,A vi-like editor based on Plan 9's structural regular expressions,MDEwOlJlcG9zaXRvcnkyNjY3NzQxOA==,2023-03-27T22:53:20Z
352,sslh,342,3942,C,https://github.com/yrutschle/sslh,Applicative Protocol Multiplexer (e.g. share SSH and HTTPS on the same port),MDEwOlJlcG9zaXRvcnkxMTMyNDk5MQ==,2023-02-19T16:24:54Z
353,TIC-80,374,3941,C,https://github.com/nesbox/TIC-80,"TIC-80 is a fantasy computer for making, playing and sharing tiny games.",MDEwOlJlcG9zaXRvcnk3NzkyMDM4Mw==,2023-03-24T17:11:59Z
354,RxFFmpeg,699,3931,C,https://github.com/microshow/RxFFmpeg,🔥💥RxFFmpeg 是基于 ( FFmpeg 4.0 + X264 + mp3lame + fdk-aac + opencore-amr + openssl ) 编译的适用于 Android 平台的音视频编辑、视频剪辑的快速处理框架，包含以下功能：视频拼接，转码，压缩，裁剪，片头片尾，分离音视频，变速，添加静态贴纸和gif动态贴纸，添加字幕，添加滤镜，添加背景音乐，加速减速视频，倒放音视频，音频裁剪，变声，混音，图片合成视频，视频解码图片，抖音首页，视频播放器及支持 OpenSSL https 等主流特色功能,MDEwOlJlcG9zaXRvcnkxNTI0MjAwMzM=,2022-10-20T04:31:11Z
355,FFmpegAndroid,1087,3913,C,https://github.com/xufuji456/FFmpegAndroid,FFmpeg实现音频拼接、混音、均衡器音效；视频裁剪、水印、转码、编解码、转Gif动图；FFmpeg本地推流、H264与RTMP实时推流直播；OpenGL滤镜特效，视频拍摄。音视频学习路线，音视频知识总结、流媒体协议,MDEwOlJlcG9zaXRvcnkxMTg1NzI0MjY=,2023-03-15T03:07:21Z
356,ossec-hids,994,3911,C,https://github.com/ossec/ossec-hids,"OSSEC is an Open Source Host-based Intrusion Detection System that performs log analysis, file integrity checking, policy monitoring, rootkit detection, real-time alerting and active response.",MDEwOlJlcG9zaXRvcnkxMjkwMTU1OQ==,2023-03-20T13:26:11Z
357,LCUI,354,3908,C,https://github.com/lc-soft/LCUI,"A small C library for building user interfaces with C, XML and CSS.",MDEwOlJlcG9zaXRvcnk1MjkzODAy,2023-03-23T14:43:51Z
358,osv,601,3886,C,https://github.com/cloudius-systems/osv,"OSv, a new operating system for the cloud.",MDEwOlJlcG9zaXRvcnk3MjU4Njg1,2023-03-24T15:52:55Z
359,gimp,607,3872,C,https://github.com/GNOME/gimp,Read-only mirror of https://gitlab.gnome.org/GNOME/gimp,MDEwOlJlcG9zaXRvcnk0NTM3NTA4,2023-03-28T08:06:46Z
360,btrfs,190,3870,C,https://github.com/maharmstone/btrfs,WinBtrfs - an open-source btrfs driver for Windows,MDEwOlJlcG9zaXRvcnk1MjIzMDM5Ng==,2023-03-12T23:15:27Z
361,CloverBootloader,579,3864,C,https://github.com/CloverHackyColor/CloverBootloader,"Bootloader for macOS, Windows and Linux in UEFI and in legacy mode",MDEwOlJlcG9zaXRvcnkyMDU4MTAxMjE=,2023-03-26T17:30:33Z
362,reading-code-of-nginx-1.9.2,1194,3861,C,https://github.com/y123456yz/reading-code-of-nginx-1.9.2,nginx-1.9.2源码通读分析注释，带详尽函数中文分析注释以及相关函数流程调用注释，最全面的nginx源码阅读分析中文注释，更新完毕,MDEwOlJlcG9zaXRvcnk0Mjc2NjE5Nw==,2021-07-26T04:33:02Z
363,skhd,167,3857,C,https://github.com/koekeishiya/skhd, Simple hotkey daemon for macOS,MDEwOlJlcG9zaXRvcnk5OTYwNzA4Mg==,2023-03-27T22:58:26Z
364,littlefs,648,3846,C,https://github.com/littlefs-project/littlefs,A little fail-safe filesystem designed for microcontrollers,MDEwOlJlcG9zaXRvcnk4MzE2MDgxMQ==,2023-03-21T19:07:30Z
365,GmSSL,1407,3840,C,https://github.com/guanzhi/GmSSL,支持国密SM2/SM3/SM4/SM9/SSL的密码工具箱,MDEwOlJlcG9zaXRvcnkyNzM1OTE4Mw==,2023-03-23T08:12:25Z
366,tinyproxy,592,3820,C,https://github.com/tinyproxy/tinyproxy,tinyproxy - a light-weight HTTP/HTTPS proxy daemon for POSIX operating systems,MDEwOlJlcG9zaXRvcnk0NzU1NjA0OQ==,2023-03-20T20:34:22Z
367,study,757,3818,C,https://github.com/ming1016/study,学习记录,MDEwOlJlcG9zaXRvcnkzMTM1NjMyMQ==,2022-11-14T03:35:36Z
368,wrk2,339,3809,C,https://github.com/giltene/wrk2,"A constant throughput, correct latency recording variant of wrk",MDEwOlJlcG9zaXRvcnkyNjM2Mjc5OA==,2022-08-22T13:16:56Z
369,libwebsockets,1363,3804,C,https://github.com/warmcat/libwebsockets,canonical libwebsockets.org networking library,MDEwOlJlcG9zaXRvcnk4MDQ2MjY5,2023-03-23T15:36:24Z
370,simplewall,368,3803,C,https://github.com/henrypp/simplewall,Simple tool to configure Windows Filtering Platform (WFP) which can configure network activity on your computer.,MDEwOlJlcG9zaXRvcnk2NjAxNjEzNA==,2023-03-23T08:54:18Z
371,ttygif,249,3795,C,https://github.com/icholy/ttygif,Convert terminal recordings to animated gifs,MDEwOlJlcG9zaXRvcnkxMjA2MDcyNQ==,2022-01-10T15:50:30Z
372,vgpu_unlock,366,3791,C,https://github.com/DualCoder/vgpu_unlock,Unlock vGPU functionality for consumer grade GPUs.,MDEwOlJlcG9zaXRvcnkzMzM5MTcyNTU=,2023-02-28T18:32:51Z
373,tmk_keyboard,1686,3782,C,https://github.com/tmk/tmk_keyboard,Keyboard firmwares for Atmel AVR and Cortex-M,MDEwOlJlcG9zaXRvcnkxMDMwNjAy,2023-03-11T16:43:10Z
374,sqlite,654,3772,C,https://github.com/sqlite/sqlite,Official Git mirror of the SQLite source tree,MDEwOlJlcG9zaXRvcnkxNzYyNzg0ODU=,2023-03-28T12:17:10Z
375,fastsocket,745,3769,C,https://github.com/fastos/fastsocket,"Fastsocket is a highly scalable socket and its underlying networking implementation of Linux kernel. With the straight linear scalability, Fastsocket can provide extremely good performance in multicore machines. In addition, it is very easy to use and maintain. As a result, it has been deployed in the production environment of SINA.",MDEwOlJlcG9zaXRvcnkyMTE1NjkwOA==,2018-04-19T09:27:36Z
376,u8g2,899,3763,C,https://github.com/olikraus/u8g2,"U8glib library for monochrome displays, version 2 ",MDEwOlJlcG9zaXRvcnk0NTcwMzg4NA==,2023-03-19T19:29:15Z
377,klib,515,3750,C,https://github.com/attractivechaos/klib,A standalone and lightweight C library,MDEwOlJlcG9zaXRvcnkxMjUxMzkz,2023-03-08T09:34:07Z
378,tor,886,3750,C,https://github.com/torproject/tor,unofficial git repo -- report bugs/issues/pull requests on https://gitlab.torproject.org/ --,MDEwOlJlcG9zaXRvcnkxMDUxMzU5MA==,2023-03-15T15:14:23Z
379,xv6-riscv,1420,3747,C,https://github.com/mit-pdos/xv6-riscv,Xv6 for RISC-V,MDEwOlJlcG9zaXRvcnkyMDQ0NTkyNTA=,2023-03-27T12:03:10Z
380,cute_headers,255,3746,C,https://github.com/RandyGaul/cute_headers,"Collection of cross-platform one-file C/C++ libraries with no dependencies, primarily used for games",MDEwOlJlcG9zaXRvcnk2MDQzNjA1NA==,2023-03-27T23:18:59Z
381,rainmeter,537,3745,C,https://github.com/rainmeter/rainmeter,Desktop customization tool for Windows,MDEwOlJlcG9zaXRvcnkzODg3Mzc1,2023-02-17T15:54:45Z
382,sshfs-win,209,3744,C,https://github.com/winfsp/sshfs-win,SSHFS For Windows,MDEwOlJlcG9zaXRvcnk2MTQ1MTkxNw==,2023-03-27T13:22:53Z
383,flecs,293,3740,C,https://github.com/SanderMertens/flecs,A fast entity component system (ECS) for C & C++,MDEwOlJlcG9zaXRvcnkxNDYxNTUyODQ=,2023-03-28T02:58:49Z
384,pushdeer,398,3729,C,https://github.com/easychen/pushdeer,开放源码的无App推送服务，iOS14+扫码即用。亦支持快应用/iOS和Mac客户端、Android客户端、自制设备,R_kgDOGihuAA,2023-02-02T15:27:08Z
385,aircrack-ng,768,3727,C,https://github.com/aircrack-ng/aircrack-ng,WiFi security auditing tools suite,MDEwOlJlcG9zaXRvcnkxMjQ2NzgyMDQ=,2023-03-24T20:02:57Z
386,tess-two,1401,3725,C,https://github.com/rmtheis/tess-two,Fork of Tesseract Tools for Android,MDEwOlJlcG9zaXRvcnkyNTgxMzU3,2022-03-17T11:24:00Z
387,LuaJIT,807,3723,C,https://github.com/LuaJIT/LuaJIT,Mirror of the LuaJIT git repository,MDEwOlJlcG9zaXRvcnk0MDMwNjUxMg==,2023-03-06T19:21:59Z
388,dunst,318,3715,C,https://github.com/dunst-project/dunst,Lightweight and customizable notification daemon,MDEwOlJlcG9zaXRvcnkyMzQxMTQ2,2023-03-23T21:07:34Z
389,ly,257,3698,C,https://github.com/fairyglade/ly,display manager with console UI,MDEwOlJlcG9zaXRvcnk5MjIwMzg2OA==,2023-03-28T01:06:01Z
390,stlink,1122,3693,C,https://github.com/stlink-org/stlink,Open source STM32 MCU programming toolset,MDEwOlJlcG9zaXRvcnkxMjUzODc5,2023-03-19T17:47:18Z
391,gamemode,178,3690,C,https://github.com/FeralInteractive/gamemode,Optimise Linux system performance on demand,MDEwOlJlcG9zaXRvcnkxMjg5MDk5MTk=,2023-03-02T11:27:44Z
392,clumsy,407,3687,C,https://github.com/jagt/clumsy,"clumsy makes your network condition on Windows significantly worse, but in a controlled and interactive manner.",MDEwOlJlcG9zaXRvcnkxMzIzNDA0OA==,2022-05-17T08:51:49Z
393,qira,460,3678,C,https://github.com/geohot/qira,QEMU Interactive Runtime Analyser,MDEwOlJlcG9zaXRvcnkyMzcwNzM2Mg==,2022-07-02T21:00:16Z
394,libpostal,388,3674,C,https://github.com/openvenues/libpostal,A C library for parsing/normalizing street addresses around the world. Powered by statistical NLP and open geo data.,MDEwOlJlcG9zaXRvcnkzMTU3MDkwNg==,2023-03-13T02:49:27Z
395,zelda3,311,3671,C,https://github.com/snesrev/zelda3,,R_kgDOHzSorA,2023-03-17T16:38:58Z
396,CPython-Internals,393,3668,C,https://github.com/zpoint/CPython-Internals,"Dive into CPython internals, trying to illustrate every detail of CPython implementation",MDEwOlJlcG9zaXRvcnkxODE1MTMzNjM=,2022-03-14T02:40:04Z
397,Linux-NetSpeed,2552,3642,C,https://github.com/Chikage0o0/Linux-NetSpeed,将Linux现常用的网络加速集成在一起,MDEwOlJlcG9zaXRvcnkxMDg5ODkyMDk=,2022-11-10T04:00:26Z
398,flatpak,368,3637,C,https://github.com/flatpak/flatpak,Linux application sandboxing and distribution framework,MDEwOlJlcG9zaXRvcnk1OTIxMzIwMA==,2023-03-24T13:29:32Z
399,wasm-micro-runtime,459,3617,C,https://github.com/bytecodealliance/wasm-micro-runtime,WebAssembly Micro Runtime (WAMR),MDEwOlJlcG9zaXRvcnkxODQ2NTQyOTg=,2023-03-28T11:51:15Z
400,sc-im,178,3608,C,https://github.com/andmarti1424/sc-im,sc-im - Spreadsheet Calculator Improvised -- An ncurses spreadsheet program for terminal,MDEwOlJlcG9zaXRvcnkyNTk4MDczOA==,2023-03-06T21:49:56Z
401,xHook,694,3601,C,https://github.com/iqiyi/xHook,🔥 A PLT hook library for Android native ELF.,MDEwOlJlcG9zaXRvcnkxMzAwMTI5NDI=,2022-04-25T17:40:30Z
402,magspoof,590,3597,C,https://github.com/samyk/magspoof,"A portable device that can spoof/emulate any magnetic stripe, credit card or hotel card ""wirelessly"", even on standard magstripe (non-NFC/RFID) readers. It can disable Chip&PIN and predict AMEX card numbers with 100% accuracy.",MDEwOlJlcG9zaXRvcnk0NjgxNDQ4MQ==,2022-07-03T07:23:15Z
403,flinux,257,3595,C,https://github.com/wishstudio/flinux,Foreign LINUX - Run unmodified Linux applications inside Windows.,MDEwOlJlcG9zaXRvcnkyMTczOTQ3Mg==,2016-03-31T09:32:36Z
404,grbl,1491,3579,C,https://github.com/gnea/grbl,"An open source, embedded, high performance g-code-parser and CNC milling controller written in optimized C that will run on a straight Arduino",MDEwOlJlcG9zaXRvcnk2ODc1MTg1Ng==,2023-03-24T22:30:31Z
405,mobile-ffmpeg,724,3573,C,https://github.com/tanersener/mobile-ffmpeg,"FFmpeg for Android, iOS and tvOS. Not maintained anymore. Superseded by FFmpegKit.",MDEwOlJlcG9zaXRvcnkxMjMxMzU2OTE=,2021-10-07T08:42:47Z
406,tinyusb,736,3573,C,https://github.com/hathach/tinyusb,An open source  cross-platform USB stack for embedded system,MDEwOlJlcG9zaXRvcnk2ODYwNzcx,2023-03-26T13:11:53Z
407,haproxy,665,3566,C,https://github.com/haproxy/haproxy,HAProxy Load Balancer's development branch (mirror of git.haproxy.org),MDEwOlJlcG9zaXRvcnkxMjg3OTE4ODk=,2023-03-28T12:56:36Z
408,kore,321,3562,C,https://github.com/jorisvink/kore,"An easy to use, scalable and secure web application framework for writing web APIs in C or Python. || This is a read-only mirror, please see https://kore.io/mail and https://kore.io/source for information on how to contribute via the mailing lists.",MDEwOlJlcG9zaXRvcnkxMDUwNDcwMg==,2023-03-12T22:36:11Z
409,contiki,2587,3547,C,https://github.com/contiki-os/contiki,"The official git repository for Contiki, the open source OS for the Internet of Things",MDEwOlJlcG9zaXRvcnk2MzY1Mjg0,2021-10-03T12:28:34Z
